,id,publishedDate,title,url,description,source,tags,crawlDate,tickers
0,94602451,2026-04-18T00:00:00Z,"I swapped my phone for a cycle computer after a crash — but a tiny, underrated device was the real safety upgrade",https://www.techradar.com/health-fitness/i-swapped-my-phone-for-a-cycle-computer-after-a-crash-but-a-tiny-underrated-device-was-the-real-safety-upgrade,It's like gaining a sixth sense for trucks and cars,techradar.com,"['Stock', 'Technology']",2026-04-18T00:07:32.788629Z,"['goog', 'googl', 'grmn']"
1,94602638,2026-04-17T23:59:39Z,Geothermal developer Fervo Energy files for Nasdaq IPO as losses widen,https://finance.yahoo.com/markets/stocks/articles/geothermal-developer-fervo-energy-files-235939282.html,"Investing.com -- Fervo Energy Co. has filed for an initial public offering, as the Houston-based geothermal power firm moves closer to generating power from its flagship project in Utah later this year.",finance.yahoo.com,"['Beaver County', 'Energy', 'Fervo Energy', 'Financial Services', 'Flagship Project', 'Generating Power', 'Geothermal Power', 'Initial Public Offering', 'Stock', 'Technology', 'U.S. Securities And Exchange Commission', 'Unknown Sector', 'Utah']",2026-04-18T00:24:01.542024Z,"['bac', 'bcs', 'dvn', 'goog', 'googl', 'jpm', 'jpm-ws', 'mhm', 'mpe', 'ry']"
2,94606832,2026-04-17T23:40:55Z,"WWII veteran turns 100, now one of three centenarians living in Ogden veterans’ home",https://www.aol.com/news/wwii-veteran-turns-100-now-234055842.html,A WWII Navy veteran in Ogden is joining the centenarian club today. He is now in the ranks with two other WWII veterans who reside at George E. Whalen Ogden Veterans Home.,aol.com,"['Dan Whiteleather', 'Debbie Simmons', 'Navy Veteran', 'Stock', 'Technology', 'Wwii']",2026-04-18T08:23:46.033110Z,"['goog', 'googl']"
3,94602199,2026-04-17T23:17:05Z,"Photos of the 'Build the Red Wall' rally in Arizona, headlined by Trump",https://apnews.com/photo-gallery/turning-point-trump-photos-dbb7b20298c8061a7bb6f649ba8a0ffe,PHOENIX (AP) — President Donald Trump joins Erika Kirk at Dream City Church in north Phoenix for Turning Point Action’s “Build the Red Wall” rally to show support for Republicans in the 2026 midterm elections.,apnews.com,"['Arizona', 'Az State Wire', 'Domestic News', 'Donald Trump', 'Erika Kirk', 'General', 'Phoenix', 'Photo Galleries', 'Politics', 'Religion', 'Stock', 'Technology', 'Tiingo Top', 'Trending Photo', 'U.S.', 'Washington']",2026-04-17T23:47:44.058744Z,"['goog', 'googl']"
4,94601700,2026-04-17T23:13:30.995000Z,A Look At Trade Desk (TTD) Valuation As Earnings Approach And Revenue Skepticism Builds,https://simplywall.st/stocks/us/media/nasdaq-ttd/trade-desk/news/a-look-at-trade-desk-ttd-valuation-as-earnings-approach-and-1,"Board resignation and pre earnings caution
Trade Desk (TTD) heads into its upcoming earnings report under a cautious spotlight, as recent commentary questions whether second half revenue expectations align with fee scrutiny and rising competition from larger tech and AI focused platforms.
See our latest analysis for Trade Desk.
Trade Desk's US$22.47 share price reflects a sharp reset in expectations, with a 7 day share price return of 11.85% contrasting with a 40.37% year to date share price...",simplywall.st,"['Stock', 'Technology']",2026-04-17T23:20:03.787070Z,"['goog', 'googl', 'ttd']"
