id,publishedDate,title,url,description,source,tags,crawlDate,tickers
97282473,2026-07-16T23:47:27Z,"One of China's top investors says finance, not AI, is the country's biggest bottleneck",https://www.cnbc.com/2026/07/17/primavera-capital-fred-hu-china-economy-wall-street-finance-private-equity-.html,"Finance would be China's weak point in a prolonged rivalry with the U.S. which has the world's deepest capital market, says Primavera Capital founder Fred Hu.",cnbc.com,"('Asia Economy', 'Breaking News: Markets', 'Breaking News: Politics', 'China', 'Consumer Cyclical', 'ETF', 'Financial Services', 'Markets', 'Politics', 'Stock', 'Technology', 'Tiingo Top', 'Unknown Sector', 'Venture Capital', 'Wall Street')",2026-07-16T23:55:42.658837Z,"('baba', 'bx', 'bx', 'cqqq', 'gs', 'gs', 'mchi', 'meta', 'meta', 'meta', 'metv', 'pgj', 'yumc')"
97280776,2026-07-16T22:09:55Z,Elon Musk's Memphis AI empire is the epicenter of the data center backlash,https://www.cnbc.com/2026/07/16/elon-musk-memphis-ai-colossus-data-center.html,"Data center-related policy proposals, protests and litigation are underway across the country citing Colossus and Memphis as a cautionary tale.",cnbc.com,"('Autos', 'Breaking News: Politics', 'Business', 'Computing', 'Consumer Cyclical', 'ETF', 'Energy', 'Environment', 'Financial Services', 'Industrials', 'Internet', 'Politics', 'Stock', 'Technology', 'Unknown Sector', 'Utilities', 'Venture Capital', 'Wireless')",2026-07-16T22:13:30.830154Z,"('botz', 'dtcr', 'duk', 'fdig', 'fdx', 'googl', 'grid', 'grid', 'jpm', 'jpm', 'meta', 'meta', 'meta', 'metv', 'msft', 'msft', 'sei', 'sei', 'spcx', 'spcx', 'tsla', 'tsla')"
97280532,2026-07-16T21:33:00Z,1 Critical Reason to Buy Broadcom Stock on the Dip,https://www.fool.com/investing/2026/07/16/1-critical-reason-to-buy-broadcom-stock-on-the-dip/?source=iedfolrf0000001,Broadcom is set for major expansion next year.,fool.com,"('07Ad7Ed2-1F09-4Ae4-908D-26Efdbfa51D1', 'Avgo', 'ETF', 'Goog', 'Googl', 'Investing', 'Meta', 'Stock', 'Technology', 'Technology And Telecom', 'Tiingo Top', 'Unknown Sector')",2026-07-16T21:58:48.101818Z,"('avgo', 'avgo', 'brcm', 'goog', 'goog', 'googl', 'meta', 'meta', 'meta', 'metv')"
97279026,2026-07-16T20:40:38Z,Meta's Astryx Returns to GitHub Trending: JSON Manifest Stops AI Agents From Hallucinating UI Props,https://www.techtimes.com/articles/320761/20260716/metas-astryx-returns-github-trending-json-manifest-stops-ai-agents-hallucinating-ui-props.htm,"Meta Astryx design system is back on GitHub Trending, with a JSON manifest CLI that gives AI coding agents a machine-readable contract for every command — eliminating the prop hallucination that plagues agents using other React libraries. Built on StyleX and the Model Context Protocol, Astryx backs",techtimes.com,"('Ai Coding Agents', 'Apps', 'Astryx', 'ETF', 'Json Manifest Cli', 'Meta', 'Model Context Protocol', 'Mui', 'Open Source', 'React Design System', 'Software', 'Stock', 'Technology', 'Unknown Sector')",2026-07-16T20:41:46.811118Z,"('goog', 'googl', 'meta', 'meta', 'meta', 'metv', 'mui')"
97279038,2026-07-16T20:15:00Z,"The ""Magnificent Seven"" Are at Their Lowest Relative Valuations in a Decade. My 3 Favorite Mag 7 Stocks to Buy.",https://www.fool.com/investing/2026/07/16/magnificent-seven-low-valuation-mag-7-stock/?source=iedfolrf0000001,"Amazon, Alphabet, and Meta are my three favorite ""Magnificent Seven"" stocks to buy right now.",fool.com,"('Amzn', 'Consumer Cyclical', 'ETF', 'F2Ee16E6-5Db7-4503-A952-24Df1F959D6F', 'Goog', 'Googl', 'Investing', 'Meta', 'Stock', 'Technology', 'Technology And Telecom', 'Tiingo Top', 'Unknown Sector')",2026-07-16T20:42:34.295393Z,"('amzn', 'amzn', 'goog', 'goog', 'googl', 'meta', 'meta', 'meta', 'metv')"
97277993,2026-07-16T19:40:47Z,Meta's stock buybacks: How the company's AI spending could affect shareholder returns,https://finance.yahoo.com/markets/stocks/articles/metas-stock-buybacks-companys-ai-194047284.html,"For years, Meta has rewarded shareholders with one of the biggest stock buyback programs in history. But as the company pours hundreds of billions of dollars into artificial intelligence, investors are asking a new question: Has Meta's AI strategy changed how the company returns cash to ...",finance.yahoo.com,"('Artificial Intelligence', 'Company', 'ETF', 'Earnings Per Share', 'Meta', 'Shareholders', 'Stock', 'Stock Buyback', 'Technology', 'Unknown Sector')",2026-07-16T20:00:39.988915Z,"('goog', 'googl', 'meta', 'meta', 'meta', 'metv')"
97277394,2026-07-16T19:31:50.122498Z,Netflix Drops 45% as Critical Earnings Test Looms,https://www.gurufocus.com/news/8963251/netflix-drops-45-as-critical-earnings-test-looms,,gurufocus.com,"('Consumer Cyclical', 'ETF', 'Stock', 'Technology', 'Unknown Sector')",2026-07-16T19:31:50.485871Z,"('meta', 'meta', 'meta', 'metv', 'nflx', 'nflx')"
97277372,2026-07-16T19:31:42.949653Z,"TSMC Targets 40%+ Sales Growth, Lifts 2026 Capex to $64 Billion",https://www.gurufocus.com/news/8963194/tsmc-targets-40-sales-growth-lifts-2026-capex-to-64-billion,,gurufocus.com,"('ETF', 'Stock', 'Technology', 'Unknown Sector')",2026-07-16T19:31:43.369600Z,"('aapl', 'aapl', 'asml', 'asml', 'googl', 'meta', 'meta', 'meta', 'metv', 'nvda', 'nvda', 'tsm')"
97277602,2026-07-16T19:24:29Z,Elon Musk's Political Spending Hits $90 Million With New $5 Million Donation,https://www.gurufocus.com/news/8962234/elon-musks-political-spending-hits-90-million-with-new-5-million-donation,,gurufocus.com,"('Consumer Cyclical', 'ETF', 'Stock', 'Technology', 'Unknown Sector')",2026-07-16T19:40:23.494195Z,"('meta', 'meta', 'meta', 'metv', 'spcx', 'spcx', 'tsla', 'tsla')"
97276944,2026-07-16T19:07:42Z,Alphabet shares fall on report its most powerful AI model Gemini 3.5 Pro is delayed,https://www.cnbc.com/2026/07/16/alphabet-stock-gemini-3-5-pro-ai.html,"Alphabet announced the Gemini 3.5 Pro AI  in May, saying it was being used internally but wouldn't be ready for a broader rollout until the following month.",cnbc.com,"('Breaking News: Technology', 'Business', 'Computing', 'ETF', 'Internet', 'Social Media', 'Stock', 'Technology', 'Unknown Sector', 'Wireless')",2026-07-16T19:12:28.081743Z,"('goog', 'goog', 'googl', 'meta', 'meta', 'meta', 'metv')"
97276599,2026-07-16T18:50:06Z,"Here's a rapid-fire update on our stock portfolio, including the 5 names to buy",https://www.cnbc.com/2026/07/16/heres-a-rapid-fire-update-on-our-stock-portfolio-including-the-5-names-to-buy.html,Jim Cramer and Jeff Marks offered their latest thoughts on the Investing Club's portfolio during the July Monthly Meeting.,cnbc.com,"('Basic Materials', 'Breaking News: Markets', 'Consumer Cyclical', 'Consumer Defensive', 'ETF', 'Financial Services', 'Healthcare', 'Industrials', 'Investment Strategy', 'Markets', 'Materials', 'Stock', 'Technology', 'Tiingo Top', 'Unknown Sector')",2026-07-16T18:56:34.107525Z,"('aapl', 'aapl', 'amzn', 'amzn', 'avgo', 'avgo', 'ba', 'ba', 'cah', 'cof', 'cost', 'cost', 'crm', 'crwd', 'crwd', 'dd', 'dd', 'dd', 'dov', 'fdx', 'fdxf', 'ge', 'gev', 'gev', 'glw', 'googl', 'gs', 'gs', 'hd', 'hon', 'hon', 'hona', 'hona', 'ibm', 'intc', 'intc', 'jbht', 'jnj', 'jnj', 'lin', 'lly', 'lly', 'meta', 'meta', 'meta', 'metv', 'msft', 'msft', 'nvda', 'nvda', 'nvo', 'nvo', 'panw', 'panw', 'pg', 'qqq', 'qqq', 'qxo', 'sbux', 'sbux', 'soxx', 'tjx', 'tjx', 'tsm', 'ups', 'wfc', 'wfc', 'xli', 'xlk')"
97275663,2026-07-16T18:09:05Z,Threads Deploys Reddit's Flair System Across Communities for Half a Billion Users,https://www.techtimes.com/articles/320741/20260716/threads-deploys-reddits-flair-system-across-communities-half-billion-users.htm,"Threads flair tags are now rolling out across all communities on the platform, giving users icon-based subtopic labels that appear under their usernames — and giving Meta a new layer of declared interest data across its 500 million monthly users. Here is what the feature means for community",techtimes.com,"('Community Managers', 'ETF', 'Interest Graph', 'Internet', 'Meta', 'Meta Interest Graph', 'Reddit', 'Social Media Algorithm', 'Stock', 'Technology', 'Threads Communities', 'Threads Flair Tags', 'Unknown Sector')",2026-07-16T18:10:14.874582Z,"('meta', 'meta', 'meta', 'metv')"
97275205,2026-07-16T17:56:11Z,Meta creates monitoring tool for kids using its chatbot to discuss self-harm — and alerts their parents,https://nypost.com/2026/07/16/lifestyle/meta-to-alert-parents-when-kids-discuss-suicide-with-chatbot/,Meta is launching a new AI safety feature that alerts parents via Instagram supervision tools if teens discuss self-harm or suicide with Meta AI. Learn how it works.,nypost.com,"('Artificial Intelligence', 'ETF', 'Facebook', 'Instagram', 'Meta', 'Stock', 'Suicide', 'Technology', 'Teens', 'Unknown Sector')",2026-07-16T17:57:21.599637Z,"('meta', 'meta', 'meta', 'metv')"
97273686,2026-07-16T16:40:31Z,Meta's data center plans could help solve its AI spending problems,https://finance.yahoo.com/technology/article/metas-data-center-plans-could-help-solve-its-ai-spending-problems-164031347.html,Meta CEO Mark Zuckerberg is teasing launching a data center business.,finance.yahoo.com,"('Anthropic', 'Data Center', 'ETF', 'Excess Capacity', 'Financial Services', 'Google', 'Mark Zuckerberg', 'Meta', 'Spacex', 'Stock', 'Technology', 'Unknown Sector')",2026-07-16T17:02:46.900830Z,"('aaba', 'goog', 'googl', 'jef', 'jef-1', 'meta', 'meta', 'meta', 'metv', 'msft', 'yhoo')"
97271271,2026-07-16T15:23:38Z,Meta Is Betting $50 Billion on AI Data Centers. Where Does The Stock Go From Here?,https://finance.yahoo.com/markets/stocks/articles/meta-betting-50-billion-ai-152338970.html,Meta is pouring hundreds of billions into AI data centers while its stock sits well below its recent highs and insiders quietly sell shares every week. The gap between that spending ambition and what shareholders actually earn back is the tension every META investor needs to understand right now.,finance.yahoo.com,"('Ai Conversations', 'Alphabet', 'Basic Materials', 'Consumer Cyclical', 'ETF', 'Energyx', 'General Motors', 'Meta', 'Price Target', 'Stock', 'Technology', 'Unknown Sector', 'Wall St.')",2026-07-16T15:52:39.207900Z,"('gm', 'googl', 'meta', 'meta', 'meta', 'metv', 'pins', 'pkx')"
97268379,2026-07-16T14:43:40Z,Truth Social launches service to give Wall Street traders an edge with real-time service,https://www.cnbc.com/2026/07/16/trump-truth-social-wall-street-traders-api.html,Trump Media launched an API to give paying customers real-time access to market-moving Truth Social posts.,cnbc.com,"('Breaking News: Politics', 'Business', 'ETF', 'Entertainment', 'Media', 'Politics', 'Publishing', 'Social Issues', 'Social Media', 'Stock', 'Technology', 'Television', 'Unknown Sector')",2026-07-16T14:47:33.557599Z,"('djt', 'meta', 'meta', 'meta', 'metv')"
97268181,2026-07-16T14:33:03Z,"3 of our stocks rode the AI rally, while 3 others fell out of favor since last month",https://www.cnbc.com/2026/07/16/3-of-our-stocks-rode-the-ai-rally-while-3-others-fell-out-of-favor-since-last-month.html,"Ahead of the CNBC Investing Club's July Monthly Meeting, here's a look at what moved our three top and bottom performers since our last meeting.",cnbc.com,"('Basic Materials', 'Breaking News: Markets', 'Breaking News: Technology', 'Business', 'Computing', 'Cybersecurity', 'ETF', 'Healthcare', 'Internet', 'Investment Strategy', 'Markets', 'Materials', 'Stock', 'Technology', 'Tiingo Top', 'Unknown Sector', 'Wireless')",2026-07-16T14:39:36.958663Z,"('aapl', 'aapl', 'cibr', 'cibr', 'crwd', 'crwd', 'dd', 'dd', 'dd', 'fdxf', 'googl', 'hack', 'hona', 'hona', 'ibm', 'igv', 'ihak', 'intc', 'intc', 'jnj', 'jnj', 'meta', 'meta', 'meta', 'metv', 'panw', 'panw', 'qqq', 'qqq', 'qxo', 'soxx', 'ssnhz', 'xlk', 'xlv')"
97267939,2026-07-16T14:05:48Z,Meta Vs. Microsoft: Insider Selling Shows Meta’s $1.4 Trillion Existential Crisis Worse Than Microsoft’s Legal Woes,https://finance.yahoo.com/markets/stocks/articles/meta-vs-microsoft-insider-selling-140548940.html,"Meta and Microsoft both crushed earnings on the same day, yet the executives at one company immediately started selling shares at a frantic pace while the other held steady. What the insiders know about what comes next in August may change how you see both stocks.",finance.yahoo.com,"('Basic Materials', 'Consumer Cyclical', 'ETF', 'Energyx', 'General Motors', 'Meta', 'Microsoft', 'Stock', 'Technology', 'Unknown Sector')",2026-07-16T14:31:54.220339Z,"('gm', 'meta', 'meta', 'meta', 'metv', 'msft', 'pkx')"
97267643,2026-07-16T14:00:00Z,The S&P 500 Is Doing Something Not Seen in 60 Years. History Says Investors Should Make This 1 Move Right Now.,https://www.fool.com/investing/2026/07/16/the-sp-500-is-doing-something-not-seen-in-60-years/?source=iedfolrf0000001,"Tech stocks have been lucrative, but they're creating a rare risk for the market.",fool.com,"('Aapl', 'Amzn', 'Avgo', 'Brka', 'Brkb', 'Consumer Cyclical', 'E7C4C242-E1F4-4242-Abfc-1E15736828Ff', 'ETF', 'Goog', 'Googl', 'Investing', 'Markets', 'Meta', 'Msft', 'Mu', 'Nvda', 'Stock', 'Technology', 'Tsla', 'Unknown Sector', '^Dji', '^Gspc', '^Ixic')",2026-07-16T14:24:44.681143Z,"('aapl', 'aapl', 'amzn', 'amzn', 'avgo', 'avgo', 'brka', 'brkb', 'goog', 'goog', 'googl', 'meta', 'meta', 'meta', 'metv', 'msft', 'msft', 'mu', 'mu', 'nvda', 'nvda', 'tsla', 'tsla')"
97266854,2026-07-16T13:30:59Z,AI Revenue Milestone: Exponential View Report Highlights Industry Sustainability,https://www.gurufocus.com/news/8962304/ai-revenue-milestone-exponential-view-report-highlights-industry-sustainability,,gurufocus.com,"('ETF', 'Stock', 'Technology', 'Unknown Sector')",2026-07-16T14:01:28.727624Z,"('meta', 'meta', 'meta', 'metv')"
97266100,2026-07-16T13:23:00Z,These 3 Social Media Stocks Are Among the Best Bargains in the Market,https://www.fool.com/investing/2026/07/16/these-3-social-media-stocks-among-best-bargains/?source=iedfolrf0000001,"Meta, Pinterest, and Reddit look like bargains given their growth.",fool.com,"('9Fbb27Ab-806A-4Aa8-933C-7A6F94C18532', 'ETF', 'Investing', 'Meta', 'Pins', 'Rddt', 'Stock', 'Technology', 'Technology And Telecom', 'Unknown Sector')",2026-07-16T13:45:27.921190Z,"('meta', 'meta', 'meta', 'metv', 'pins', 'rddt', 'rddt')"
97266166,2026-07-16T13:11:19Z,Meta says it's creating new safety features to help protect teens. Here's how,https://www.aol.com/news/meta-says-creating-safety-features-131119901.html,"Meta announced it is introducing new features to help protect teens using Instagram, Facebook and WhatsApp, including alerting a parent if their child discusses self-harm with one of its AI chatbots. Kelly O'Grady explains.",aol.com,"('ETF', 'Facebook', 'Meta', 'Stock', 'Technology', 'Unknown Sector', 'Whatsapp')",2026-07-16T13:46:24.270520Z,"('meta', 'meta', 'meta', 'metv')"
97265580,2026-07-16T13:00:36Z,META Price Prediction: The Stock Will Hit $700 on This Date,https://finance.yahoo.com/markets/stocks/articles/meta-price-prediction-stock-hit-130036237.html,"Meta just crushed earnings by nearly 57% yet the stock sits flat on the year, and a specific date in fall 2026 is when our model says the dam finally breaks.",finance.yahoo.com,"('Basic Materials', 'Consumer Cyclical', 'ETF', 'Energyx', 'General Motors', 'Lithium', 'Meta', 'Operating Margins', 'Reality Labs', 'Stock', 'Technology', 'Unknown Sector')",2026-07-16T13:28:14.316339Z,"('gm', 'meta', 'meta', 'meta', 'metv', 'pkx')"
97264759,2026-07-16T13:00:02Z,Nvidia-backed Fireworks hits $17.5 billion valuation as companies pursue cheaper AI models,https://www.cnbc.com/2026/07/16/fireworks-nvidia-cloud-ai-startup-value.html,"Fireworks once relied heavily on revenue from coding startup Cursor, but has diversified in the past year as more companies reach for lower-cost AI models.",cnbc.com,"('Breaking News: Technology', 'Business', 'Computing', 'Consumer Cyclical', 'ETF', 'Enterprise', 'Internet', 'Stock', 'Technology', 'Unknown Sector', 'Wireless')",2026-07-16T13:03:37.541057Z,"('amzn', 'amzn', 'botz', 'coin', 'coin', 'crm', 'crwv', 'crwv', 'docn', 'estc', 'googl', 'gtlb', 'mdb', 'meta', 'meta', 'meta', 'metv', 'msft', 'msft', 'nbis', 'nvda', 'nvda', 'pltr', 'pltr', 'sgrt', 'soxs', 'soxs', 'spcx', 'spcx', 'uber', 'uber', 'wcld')"
97263579,2026-07-16T12:31:33.668624Z,META Assumes Neutral by Wedbush -- Price Target Announced at $671,https://www.gurufocus.com/news/8962092/meta-assumes-neutral-by-wedbush-price-target-announced-at-671,,gurufocus.com,"('ETF', 'Stock', 'Technology', 'Unknown Sector')",2026-07-16T12:31:34.026539Z,"('meta', 'meta', 'meta', 'metv')"
97263192,2026-07-16T12:00:00Z,"26 Meta employees sue, claiming AI flagged workers on medical and pregnancy leave for layoffs",https://finance.yahoo.com/technology/ai/articles/26-meta-employees-sue-claiming-120000142.html,Current and former employees have filed a lawsuit claiming AI penalized protected leave. Here's what employees should know about their rights.,finance.yahoo.com,"('Ai Tool Usage', 'Dave Ramsey', 'ETF', 'Employees', 'Equal Employment Opportunity Commission', 'Federal Court', 'Layoffs', 'Medical Leave', 'Meta', 'Organizational Decisions', 'Pregnancy', 'Stock', 'Technology', 'Unknown Sector')",2026-07-16T12:22:54.246243Z,"('meta', 'meta', 'meta', 'metv')"
97259880,2026-07-16T10:30:38Z,Consent Defense Rejected: Google and Meta Face Discovery Over Prescription Pixel Data,https://www.techtimes.com/articles/320676/20260716/consent-defense-rejected-google-meta-face-discovery-over-prescription-pixel-data.htm,"Meta Pixel health data privacy lawsuit takes a significant turn as a federal judge refuses to dismiss claims against Google and Meta over prescription data collected via tracking pixels on telehealth site BlueChew, forcing both ad-tech giants into discovery and exposing what their internal",techtimes.com,"('Bluechew Lawsuit', 'California Invasion Of Privacy Act Cipa', 'ETF', 'Ftc', 'Google', 'Health Data Privacy', 'Healthcare', 'Legal', 'Meta', 'Meta Pixel Prescription Data', 'Stock', 'Technology', 'Tracking Pixels', 'Unknown Sector')",2026-07-16T10:35:22.557957Z,"('asmb', 'goog', 'googl', 'meta', 'meta', 'meta', 'metv')"
97259917,2026-07-16T10:27:35Z,YouTube Appeals Addiction Verdict but Already Settled Second Case to Dodge Jury,https://www.techtimes.com/articles/320675/20260716/youtube-appeals-addiction-verdict-already-settled-second-case-dodge-jury.htm,"YouTube social media addiction lawsuit appeal came Monday in Los Angeles, challenging the landmark $6 million verdict — but three weeks earlier, YouTube had quietly settled the second bellwether trial to avoid a second jury. The dual-track strategy aims to fight the design-defect theory on appeal",techtimes.com,"('Bellwether Trial Social Media', 'ETF', 'Kgm Verdict Appeal', 'Legal', 'Materials', 'Meta', 'Section 230', 'Social Media Addiction', 'Stock', 'Technology', 'Teen Mental Health', 'Unknown Sector', 'Youtube', 'Youtube Social Media Addiction Lawsuit')",2026-07-16T10:36:12.666012Z,"('goog', 'googl', 'meta', 'meta', 'meta', 'metv', 'sfeg')"
97260036,2026-07-16T10:00:00Z,Meta accused of using AI to pick employees with medical conditions for layoffs,https://www.aol.com/news/meta-accused-using-ai-pick-100000981.html,"Twenty-six current and former Meta employees, including some from California, allege the company violated federal and state laws. Meta denied the accusations.",aol.com,"('ETF', 'Employees', 'Family Leave', 'Medical Leave', 'Meta', 'Stock', 'Technology', 'Unknown Sector')",2026-07-16T10:41:07.993087Z,"('meta', 'meta', 'meta', 'metv', 'msft', 'orcl')"
97257953,2026-07-16T08:41:13Z,"Manning & Napier Advisors LLC Has $210.16 Million Stake in Meta Platforms, Inc. $META",https://www.thelincolnianonline.com/2026/07/16/manning-napier-advisors-llc-has-210-16-million-stake-in-meta-platforms-inc-meta.html,"Manning & Napier Advisors LLC lifted its position in Meta Platforms, Inc. (NASDAQ:META – Free Report) by 28.5% in the first quarter, according to its most recent Form 13F filing with the SEC. The firm owned 367,335 shares of the social networking company’s stock after purchasing an additional 81,499 shares during the period. Meta Platforms […]",thelincolnianonline.com,"('13F', '30303M10', 'Computer And Technology', 'ETF', 'Financial Services', 'Hedge Fund Holdings', 'Institutional Investor Holdings', 'Meta', 'Meta Platforms', 'Nasdaq:Meta', 'Sec Filings', 'Stock', 'Technology', 'Unknown Sector')",2026-07-16T09:14:29.320565Z,"('bac', 'bcs', 'gs', 'gsf', 'gsj', 'meta', 'meta', 'meta', 'metv', 'mhm', 'mpe')"
97257364,2026-07-16T08:20:00Z,Investors Are Growing Wary of AI-Related Debt,https://www.fool.com/investing/2026/07/16/investors-are-growing-wary-of-ai-related-debt/?source=iedfolrf0000001,Demand for hyperscaler company bonds has waned this year.,fool.com,"('1B93C18D-D872-43A0-9Da2-0Ecf602A0928', 'Amzn', 'Consumer Cyclical', 'ETF', 'Goog', 'Googl', 'Investing', 'Meta', 'Msft', 'Spcx', 'Stock', 'Technology', 'Technology And Telecom', 'Unknown Sector')",2026-07-16T08:42:45.046418Z,"('amzn', 'amzn', 'goog', 'goog', 'googl', 'meta', 'meta', 'meta', 'metv', 'msft', 'msft', 'spcx', 'spcx')"
97257165,2026-07-16T08:02:00Z,"SpaceX vs the ""Magnificent Seven"": Which Is the Better Buy?",https://www.fool.com/investing/2026/07/16/spacex-vs-the-magnificent-seven-which-is-the-bette/?source=iedfolrf0000001,All of these tech players have delivered significant gains.,fool.com,"('4F37A4Dd-2231-44D6-97De-5483C8B722Ae', 'Aapl', 'Amzn', 'Consumer Cyclical', 'ETF', 'Goog', 'Googl', 'Investing', 'Meta', 'Msft', 'Nvda', 'Spcx', 'Stock', 'Technology', 'Technology And Telecom', 'Tsla', 'Unknown Sector')",2026-07-16T08:28:29.328965Z,"('aapl', 'aapl', 'amzn', 'amzn', 'goog', 'goog', 'googl', 'meta', 'meta', 'meta', 'metv', 'msft', 'msft', 'nvda', 'nvda', 'spcx', 'spcx', 'tsla', 'tsla')"
97256952,2026-07-16T07:44:00Z,CoreWeave Has Fallen 49% From Its 52-Week High. Is the Beaten-Down AI Stock a Bargain or a Value Trap?,https://www.fool.com/investing/2026/07/16/coreweave-has-fallen-49-from-its-52-week-high-is-t/?source=iedfolrf0000001,The backlog is enormous. So are the losses and the capital bills behind it.,fool.com,"('6C458239-3666-4B68-Bde0-D7E2808024Df', 'Crwv', 'ETF', 'Investing', 'Meta', 'Stock', 'Technology', 'Technology And Telecom', 'Unknown Sector')",2026-07-16T08:12:31.888222Z,"('crwv', 'crwv', 'meta', 'meta', 'meta', 'metv')"
97260348,2026-07-16T06:52:07Z,Why Stripe might want to acquire PayPal,https://fortune.com/2026/07/16/why-stripe-might-want-to-acquire-paypal/,"Plus: Anthropic, ASML, Elon Musk, Google, Hyundai, Intel, Meta, OnePlus, Waymo, Uber.",fortune.com,"('Anthropic', 'Apple', 'Asml Holding', 'China', 'Communication Services', 'Digital And Mobile Payments', 'ETF', 'Elon Musk', 'Fortune Tech', 'Google', 'Hyundai', 'Intel', 'Meta', 'Mira Murati', 'No Copyright', 'Paypal Holdings', 'Stock', 'Stripe', 'Technology', 'Uber Technologies', 'Unknown Sector', 'Waymo')",2026-07-16T10:56:15.115786Z,"('goog', 'googl', 'hymlf', 'intc', 'iqnt', 'meta', 'meta', 'meta', 'metv')"
97256140,2026-07-16T06:30:00Z,Apple CEO Tim Cook Just Announced Great News for Broadcom Stock Investors,https://www.fool.com/investing/2026/07/16/apple-ceo-tim-cook-just-announced-great-news-for-b/?source=iedfolrf0000001,Broadcom's prospects continue to improve.,fool.com,"('79Dd9717-Cc55-4F0A-Bcae-Eb3F49F3A7B7', 'Aapl', 'Avgo', 'ETF', 'Investing', 'Meta', 'Stock', 'Technology', 'Technology And Telecom', 'Tiingo Top', 'Unknown Sector')",2026-07-16T06:55:31.940372Z,"('aapl', 'aapl', 'avgo', 'avgo', 'brcm', 'meta', 'meta', 'meta', 'metv')"
97255096,2026-07-16T05:04:30Z,U.S. slaps 25% tariff on most Brazilian goods over 'unfair trade practices',https://www.cnbc.com/2026/07/16/us-tariffs-brazil-unfair-trade-practices-section-301-.html,"A separate U.S. probe into forced-labor enforcement has also proposed an additional 12.5% duty on Brazilian goods that would stack on top of the 25%, with a decision due within days.",cnbc.com,"('Asia Economy', 'Brazil', 'Breaking News: Politics', 'ETF', 'Politics', 'Stock', 'Technology', 'Tiingo Top', 'Unknown Sector')",2026-07-16T05:06:24.576711Z,"('googl', 'meta', 'meta', 'meta', 'metv')"
97254688,2026-07-16T04:22:25.269593Z,Is the AI Infrastructure Build-Out a Bubble? Here's What the Data Actually Shows.,https://www.fool.com/investing/2026/07/16/is-the-ai-infrastructure-build-out-a-bubble-heres/?source=iedfolrf0000001,The data is mixed as to whether there is an AI bubble.,fool.com,"('70F24D40-Da0B-4371-80E9-Ba1739Bf9E61', 'Amzn', 'Consumer Cyclical', 'ETF', 'Goog', 'Googl', 'Investing', 'Meta', 'Msft', 'Mu', 'Nvda', 'Pltr', 'Spcx', 'Stock', 'Technology', 'Technology And Telecom', 'Tiingo Top', 'Tsla', 'Unknown Sector')",2026-07-16T04:23:18.527918Z,"('amzn', 'amzn', 'goog', 'goog', 'googl', 'meta', 'meta', 'meta', 'metv', 'msft', 'msft', 'mu', 'mu', 'nvda', 'nvda', 'pltr', 'pltr', 'spcx', 'spcx', 'tsla', 'tsla')"
97254433,2026-07-16T03:41:02Z,"$350 Billion Debt! Time to Sell Microsoft Stock, Meta Stock, GOOG Stock, AMZN Stock, and ORCL Stock?",https://www.fool.com/investing/2026/07/15/350-billion-debt-time-to-sell-microsoft-stock-meta/?source=iedfolrf0000001,Capital spending is increasing so rapidly that these large companies are borrowing hundreds of billions of dollars.,fool.com,"('62Fb3491-E507-4B92-9A2A-9D70C46Eaae4', 'Amzn', 'Consumer Cyclical', 'ETF', 'Goog', 'Googl', 'Investing', 'Meta', 'Msft', 'Orcl', 'Stock', 'Technology', 'Technology And Telecom', 'Unknown Sector')",2026-07-16T04:06:52.477477Z,"('amzn', 'amzn', 'goog', 'goog', 'googl', 'meta', 'meta', 'meta', 'metv', 'msft', 'msft', 'orcl')"
97254441,2026-07-16T03:39:24Z,Meta Stock: Buy or Sell?,https://www.fool.com/investing/2026/07/15/meta-stock-buy-or-sell/?source=iedfolrf0000001,The social media giant is one of the most interesting stocks to consider right now.,fool.com,"('92A76494-3Fd9-4930-8F62-96E90Fdba8Cb', 'ETF', 'Investing', 'Meta', 'Stock', 'Technology', 'Technology And Telecom', 'Unknown Sector')",2026-07-16T04:07:10.162660Z,"('meta', 'meta', 'meta', 'metv')"
