id,publishedDate,title,url,description,source,tags,crawlDate,tickers
96745687,2026-06-26T17:45:09Z,Meta's flurry of AI initiatives this month hasn't helped lift the stock. What will?,https://www.cnbc.com/2026/06/26/metas-flurry-of-ai-initiatives-this-month-hasnt-helped-lift-the-stock-what-will.html,Meta has to justify its AI spending to unlock the struggling stock.,cnbc.com,"('Breaking News: Markets', 'Breaking News: Technology', 'Business', 'Computing', 'Consumer Cyclical', 'ETF', 'Internet', 'Investment Strategy', 'Markets', 'Stock', 'Technology', 'Tiingo Top', 'Unknown Sector', 'Wireless')",2026-06-26T17:47:44.731048Z,"('amzn', 'amzn', 'googl', 'meta', 'meta', 'meta', 'metv', 'msft', 'msft', 'qcom', 'qcom', 'snap')"
96745292,2026-06-26T17:27:38Z,Sony’s New Wearable Air Conditioner Arrives In U.S. To Beat Summer Heatwaves,https://www.forbes.com/sites/davidphelan/2026/06/26/sonys-new-wearable-air-conditioner-arrives-in-us-to-beat-summer-heatwaves/,"After a European launch last month, the portable aircon device is now available for pre-order in the U.S., and at a lower price than predicted.",forbes.com,"('Beat Summer Heatwaves', 'ETF', 'Meta', 'Neck Cooling Plate', 'Personal Ac Unit', 'Portable Cooling Device', 'Reon Pocket Tag 2', 'Smart Heatwave Tech', 'Sony Reon Pocket Pro Plus', 'Sony Wearable Thermo Device', 'Stock', 'Technology', 'Unknown Sector', 'Wearable Air Conditioner')",2026-06-26T17:33:16.028665Z,"('meta', 'meta', 'meta', 'metv')"
96744860,2026-06-26T16:13:25Z,Xprize founder says global surveillance is a good thing because humans behave better when they are being watched,https://thenextweb.com/news/diamandis-xprize-surveillance-privacy-transparency,Diamandis joins Larry Ellison in arguing that global surveillance builds trust. Cities covering cameras with trash bags suggest people disagree.,thenextweb.com,"('Data And Security', 'ETF', 'Government And Policy', 'Meta', 'Next Featured', 'Stock', 'Technology', 'Tiingo Top', 'Unknown Sector')",2026-06-26T17:16:25.141943Z,"('goog', 'googl', 'meta', 'meta', 'meta', 'metv', 'orcl')"
96743242,2026-06-26T16:00:00Z,"If a Stock Market Crash Is Coming, I'm Loading Up on This 1 Surefire Vanguard ETF",https://www.fool.com/investing/2026/06/26/if-a-stock-market-crash-is-coming-im-loading-up-on/?source=iedfolrf0000001,The right investment is more important than ever if a downturn is looming.,fool.com,"('Aapl', 'Af55Fc36-55Fa-4257-A7E1-F7Add9563Bab', 'Amzn', 'Consumer Cyclical', 'ETF', 'Goog', 'Googl', 'Investing', 'Markets', 'Meta', 'Msft', 'Nvda', 'Stock', 'Technology', 'Tsla', 'Unknown Sector', 'Voo', '^Gspc', '^Ixic')",2026-06-26T16:27:01.140343Z,"('aapl', 'aapl', 'amzn', 'amzn', 'goog', 'goog', 'googl', 'meta', 'meta', 'meta', 'metv', 'msft', 'msft', 'nvda', 'nvda', 'tsla', 'tsla', 'voo')"
96742045,2026-06-26T15:23:10Z,Meta Stock Price Prediction: The Case for Nearly 50% Upside,https://finance.yahoo.com/markets/stocks/articles/meta-stock-price-prediction-case-152310070.html,"Meta Platforms (NASDAQ:META) has slid hard in 2026, and that selloff has opened up a setup the model rates as one of the most attractive in mega-cap tech. Our 24/7 Wall St. price target for Meta is $801.42 over the next 12 months, implying 47.63% upside from $542.87. The recommendation is a buy with high ... Meta Stock Price Prediction: The Case for Nearly 50% Upside",finance.yahoo.com,"('ETF', 'Meta', 'Price Target', 'Reality Labs', 'Revenue Growth', 'Stock', 'Technology', 'Top 10 Ai Stocks', 'Unknown Sector', 'Wall St.')",2026-06-26T15:40:03.076404Z,"('meta', 'meta', 'meta', 'metv', 'nvda')"
96741485,2026-06-26T14:55:11Z,Big Tech Took a $3.5 Billion Hit for Feeding AI With Your Personal Data,https://finance.yahoo.com/technology/ai/articles/big-tech-took-3-5-145511963.html,"AI privacy fines hit $3.5 billion since 2022, but at roughly 1% of Meta's revenue, critics say the penalties may not deter Big Tech.",finance.yahoo.com,"('Amazon', 'Biometric Data', 'Clearview Ai', 'ETF', 'Enforcement Actions', 'Google', 'Luis Costa', 'Meta', 'Stock', 'Tech Companies', 'Technology', 'Unknown Sector')",2026-06-26T15:20:28.498270Z,"('goog', 'googl', 'meta', 'meta', 'meta', 'metv')"
96742654,2026-06-26T14:36:00Z,Alphabet Benefits From Rising Advertising Revenues: More Upside Ahead?,https://www.zacks.com/stock/news/2943756/alphabet-benefits-from-rising-advertising-revenues-more-upside-ahead?cid=CS-ZC-FT-analyst_blog%7Cquick_take-2943756,,zacks.com,"('Analyst Blog', 'ETF', 'Stock', 'Technology', 'Unknown Sector')",2026-06-26T16:01:28.469413Z,"('googl', 'meta', 'meta', 'meta', 'metv', 'rddt', 'rddt')"
96739236,2026-06-26T13:47:46Z,Meta and Microsoft Look Cheap. But What If the Bears Are Right?,https://www.fool.com/investing/2026/06/26/meta-and-microsoft-look-cheap-but-what-if-the-bear/?source=iedfolrf0000001,"The bull case for these two tech giants is compelling, but the bear case deserves a closer look than most investors are giving it.",fool.com,"('B8656D92-C424-4F4A-A3Bd-8A462Ed0Ab4F', 'ETF', 'Investing', 'Meta', 'Msft', 'Stock', 'Technology', 'Technology And Telecom', 'Unknown Sector')",2026-06-26T14:18:39.759497Z,"('meta', 'meta', 'meta', 'metv', 'msft', 'msft')"
96739953,2026-06-26T13:22:00Z,"Company News for Jun 26, 2026",https://www.zacks.com/stock/news/2943538/company-news-for-jun-26-2026?cid=CS-ZC-FT-corporate_summary-2943538,,zacks.com,"('Corporate Summary', 'ETF', 'Stock', 'Technology', 'Unknown Sector')",2026-06-26T14:33:21.609546Z,"('bb', 'meta', 'meta', 'meta', 'metv', 'mkkgy', 'tech')"
96736471,2026-06-26T12:30:54.196920Z,Meta (META) Shifts to AI for Content Moderation,https://www.gurufocus.com/news/8934081/meta-meta-shifts-to-ai-for-content-moderation,,gurufocus.com,"('ETF', 'Stock', 'Technology', 'Unknown Sector')",2026-06-26T12:30:54.528442Z,"('meta', 'meta', 'meta', 'metv')"
96736469,2026-06-26T12:30:53.435333Z,"First Look: Tech Selloff, SCOTUS Weed Killer Ruling, USPS Update",https://www.gurufocus.com/news/8934084/first-look-tech-selloff-scotus-weed-killer-ruling-usps-update,,gurufocus.com,"('ETF', 'Stock', 'Technology', 'Unknown Sector')",2026-06-26T12:30:53.834828Z,"('aapl', 'aapl', 'googl', 'intc', 'intc', 'meta', 'meta', 'meta', 'metv', 'msft', 'msft', 'mu', 'mu', 'nvda', 'nvda')"
96743142,2026-06-26T12:05:14Z,‘Careless People’ author claims Meta surveilled her for a year to enforce her silence,https://fortune.com/2026/06/26/meta-wynn-williams-surveillance-gag-order-lawsuit-2026/,"Sarah Wynn-Williams former director of global public policy at Facebook, sued the company, claiming it tried to ""silence"" her.",fortune.com,"('Books', 'ETF', 'Meta', 'Stock', 'Technology', 'Unknown Sector')",2026-06-26T16:23:22.420770Z,"('meta', 'meta', 'meta', 'metv')"
96735677,2026-06-26T12:00:01Z,OpenAI and Anthropic face new AI reality as companies shift from tokenmaxxing to efficiency,https://www.cnbc.com/2026/06/26/openai-anthropic-new-ai-spending-reality-as-users-shift-to-efficiency.html,,cnbc.com,"('Breaking News: Technology', 'Business', 'Computing', 'Consumer Cyclical', 'ETF', 'Internet', 'Stock', 'Technology', 'Unknown Sector', 'Wireless')",2026-06-26T12:02:39.622562Z,"('amzn', 'amzn', 'baba', 'googl', 'meta', 'meta', 'meta', 'metv', 'msft', 'msft', 'uber', 'uber')"
96735155,2026-06-26T11:06:00Z,"Ranking the FAANG Stocks From Most to Least Attractive, Based on Future Cash Flow",https://www.fool.com/investing/2026/06/26/ranking-faang-stocks-from-most-to-least-attractive/?source=iedfolrf0000001,"Among Meta Platforms (formerly Facebook), Apple, Amazon, Netflix, and Alphabet (formerly Google), there are two standout bargains and one historically expensive stock.",fool.com,"('Aapl', 'Amzn', 'Consumer Cyclical', 'ETF', 'Fd3Bc7B9-8493-4Ccd-82Df-7D148Dce2A4D', 'Goog', 'Googl', 'Investing', 'Meta', 'Nflx', 'Stock', 'Technology', 'Technology And Telecom', 'Unknown Sector')",2026-06-26T11:35:33.501679Z,"('aapl', 'aapl', 'amzn', 'amzn', 'goog', 'goog', 'googl', 'meta', 'meta', 'meta', 'metv', 'nflx', 'nflx')"
96734224,2026-06-26T11:00:31.155806Z,Meta and Snap Face Australia Youth Crackdown,https://www.gurufocus.com/news/8934005/meta-and-snap-face-australia-youth-crackdown,,gurufocus.com,"('Australia', 'ETF', 'Stock', 'Technology', 'Unknown Sector')",2026-06-26T11:00:31.497736Z,"('goog', 'goog', 'meta', 'meta', 'meta', 'metv', 'snap')"
96733168,2026-06-26T10:04:05Z,America’s data-centre backlash puts the AI boom at risk,https://www.livemint.com/global/americas-data-centre-backlash-puts-the-ai-boom-at-risk-11782459880288.html,Opposition is spreading across the country,livemint.com,"('Artificial Intelligence', 'CryptoCurrency', 'Data Centre', 'ETF', 'Economist', 'Global', 'Meta', 'Ohio', 'Semiconductors', 'Stock', 'Technology', 'Unknown Sector')",2026-06-26T10:06:14.139990Z,"('meta', 'meta', 'meta', 'metv')"
96732807,2026-06-26T08:35:52Z,"SVB Wealth LLC Sells 1,412 Shares of Meta Platforms, Inc. $META",https://www.thelincolnianonline.com/2026/06/26/svb-wealth-llc-sells-1412-shares-of-meta-platforms-inc-meta.html,"SVB Wealth LLC lowered its stake in Meta Platforms, Inc. (NASDAQ:META – Free Report) by 4.4% during the first quarter, according to the company in its most recent filing with the Securities & Exchange Commission. The firm owned 30,777 shares of the social networking company’s stock after selling 1,412 shares during the quarter. Meta Platforms […]",thelincolnianonline.com,"('13F', '30303M10', 'Computer And Technology', 'ETF', 'Financial Services', 'Hedge Fund Holdings', 'Institutional Investor Holdings', 'Meta', 'Meta Platforms', 'Nasdaq:Meta', 'Sec Filings', 'Stock', 'Technology', 'Unknown Sector')",2026-06-26T09:56:21.980915Z,"('jpm', 'jpm-ws', 'meta', 'meta', 'meta', 'metv', 'mfg', 'wfc', 'wfc-ws')"
96730945,2026-06-26T07:50:00Z,"Amazon Is Now the Worst Performer Among the ""Magnificent Seven"" Over the Last 5 Years. Is Amazon a No-Brainer Buy, or Is There More Room to Fall?",https://www.fool.com/investing/2026/06/26/amazon-is-now-the-worst-performer-among-the-magnif/?source=iedfolrf0000001,Amazon's aggressive capital expenditures are troubling some investors.,fool.com,"('786Ab5Ff-Bfb9-4Fe9-9644-C9F6A2A4A4D3', 'Aapl', 'Amzn', 'Consumer Cyclical', 'Consumer Goods', 'ETF', 'Goog', 'Googl', 'Investing', 'Meta', 'Msft', 'Nvda', 'Spcx', 'Stock', 'Technology', 'Tiingo Top', 'Tsla', 'Unknown Sector')",2026-06-26T08:15:28.805005Z,"('aapl', 'aapl', 'amzn', 'amzn', 'goog', 'goog', 'googl', 'meta', 'meta', 'meta', 'metv', 'msft', 'msft', 'nvda', 'nvda', 'spcx', 'spcx', 'tsla', 'tsla')"
96734322,2026-06-26T06:37:11Z,Apple loses its iron grip on pricing power,https://fortune.com/2026/06/26/apple-loses-iron-grip-pricing-power/,"Plus: Alibaba, Anthropic, ASML, Kioxia, Meta, Microsoft, Mirendil.",fortune.com,"('Alibaba Group', 'Anthropic', 'Apple', 'Asml Holding', 'Consumer Cyclical', 'ETF', 'Fortune Tech', 'Ibm', 'Meta', 'Microsoft', 'Microsoft Xbox', 'No Copyright', 'Sony', 'Stock', 'Technology', 'Unknown Sector', 'Video Games')",2026-06-26T11:03:12.122850Z,"('baba', 'ibm', 'meta', 'meta', 'meta', 'metv', 'msft', 'sony', 'sony')"
96729576,2026-06-26T06:00:37Z,"Daily Open: One session, two major sell-offs",https://www.cnbc.com/2026/06/26/cnbc-daily-open-one-session-two-major-sell-offs.html,Friday's session looks set to be dominated by two major sell-offs — the tech rout deepening and oil prices diving further into the red.,cnbc.com,"('Breaking News: Politics', 'Consumer Cyclical', 'ETF', 'Financial Services', 'Foreign Policy', 'Markets', 'Politics', 'Stock', 'Technology', 'Tiingo Top', 'Unknown Sector', 'World Markets')",2026-06-26T06:07:20.994450Z,"('aapl', 'aapl', 'amd', 'amzn', 'amzn', 'dis', 'dis', 'googl', 'intc', 'intc', 'meta', 'meta', 'meta', 'metv', 'ms', 'ms', 'msft', 'msft', 'mu', 'mu', 'qcom', 'qcom', 'soxx', 'wdc', 'wdc', 'xlk')"
96729767,2026-06-26T05:59:06Z,Micron Beats Meta in Market Cap: Can It Catch Nvidia Next?,https://finance.yahoo.com/markets/stocks/articles/micron-beats-meta-market-cap-055906218.html,"Micron topped Meta in market cap after a 346% revenue jump. With AI memory demand surging, can it catch Nvidia next?",finance.yahoo.com,"('CryptoCurrency', 'ETF', 'Graphics Processing Units', 'Meta', 'Micron Technology', 'Nvidia', 'Stock', 'Technology', 'Unknown Sector')",2026-06-26T06:23:38.104656Z,"('meta', 'meta', 'meta', 'metv', 'msft', 'mu', 'nvda')"
96727951,2026-06-26T03:30:19Z,"Virginia Lottery Pick 3 Night, Pick 3 Day results for June 25, 2026",https://www.aol.com/news/virginia-lottery-pick-3-night-033019832.html,Check your tickets for Virginia daily lottery draw games here.,aol.com,"('ETF', 'Fb', 'Stock', 'Technology', 'Unknown Sector', 'Virginia Lottery')",2026-06-26T03:45:18.281352Z,"('fb', 'meta')"
96728134,2026-06-26T03:30:19Z,"Virginia Lottery Pick 3 Night, Pick 3 Day results for June 25, 2026",https://www.aol.com/news/virginia-lottery-pick-3-night-033019267.html,Check your tickets for Virginia daily lottery draw games here.,aol.com,"('ETF', 'Fb', 'Stock', 'Technology', 'Unknown Sector', 'Virginia Lottery')",2026-06-26T03:54:37.488373Z,"('fb', 'meta')"
96727748,2026-06-26T03:00:00Z,Should You Forget NuScale Power and Buy Oklo Stock Instead?,https://www.fool.com/investing/2026/06/25/should-you-forget-stock-a-and-buy-stock-b-instead/?source=iedfolrf0000001,Nuclear power is experiencing a $10 trillion renaissance.,fool.com,"('1F9C9Abf-3780-41Dd-B572-27C95A77D0Ad', 'And Utilities', 'Bac', 'ETF', 'Energy', 'Financial Services', 'Investing', 'Materials', 'Meta', 'Oklo', 'Smr', 'Stock', 'Technology', 'Unknown Sector')",2026-06-26T03:31:37.360101Z,"('bac', 'bac', 'meta', 'meta', 'meta', 'metv', 'oklo', 'smr')"
96725741,2026-06-26T00:54:25Z,SoftBank sinks 11% as Asia tech rout track declines in the U.S.,https://www.cnbc.com/2026/06/26/global-tech-stocks-ai-infrastructure-costs-selloff-softbank-apple.html,"SoftBank Group plunged, leading a broad selloff in Asian technology stocks amid mounting concerns over the rising cost of artificial intelligence infrastructure. ",cnbc.com,"('Breaking', 'Breaking News: Asia', 'Breaking News: Markets', 'Breaking News: Technology', 'Business', 'Computing', 'ETF', 'Internet', 'Stock', 'Technology', 'Tiingo Top', 'Unknown Sector', 'Wireless')",2026-06-26T00:59:29.594542Z,"('aapl', 'aapl', 'googl', 'meta', 'meta', 'meta', 'metv', 'msft', 'msft', 'mu', 'mu', 'sftbf', 'soxx')"
96725258,2026-06-26T00:15:00Z,"Decibel brings Apple, Meta and Microsoft to onchain trading with no market hours",https://finance.yahoo.com/markets/crypto/articles/decibel-brings-apple-meta-microsoft-001500782.html,"Traders can now go long or short on Apple (NASDAQ: AAPL), Meta (NASDAQ: META), Microsoft (NASDAQ: MSFT), and Strategy (NASDAQ: MSTR), no brokerage account, no market hours, no middleman. Decibel, a fully on-chain perpetual exchange built on the Aptos blockchain, has listed five new markets, namely ...",finance.yahoo.com,"('Apple', 'Decibel', 'ETF', 'Meta', 'Microsoft', 'Nasdaq', 'Stock', 'Technology', 'Traditional Markets', 'Unknown Sector')",2026-06-26T00:29:23.510940Z,"('aapl', 'goog', 'googl', 'meta', 'meta', 'meta', 'metv', 'msft', 'mstr', 'mu', 'nvda')"
