id,publishedDate,title,url,description,source,tags,crawlDate,tickers
97254240,2026-07-16T03:30:26Z,"Florida Lottery Powerball, Fantasy 5 results for July 15, 2026",https://www.aol.com/news/florida-lottery-powerball-fantasy-5-033026468.html,Check your tickets for Florida daily lottery draw games here.,aol.com,"('ETF', 'Fb', 'Florida Lottery', 'Powerball', 'Stock', 'Technology', 'Unknown Sector', 'Winning Fantasy 5 Numbers', 'Winning Pick 3 Numbers', 'Winning Pick 4 Numbers')",2026-07-16T03:54:57.019859Z,"('fb', 'meta')"
97254169,2026-07-16T03:30:26Z,"Florida Lottery Powerball, Fantasy 5 results for July 15, 2026",https://www.aol.com/news/florida-lottery-powerball-fantasy-5-033026304.html,Check your tickets for Florida daily lottery draw games here.,aol.com,"('ETF', 'Fb', 'Florida Lottery', 'Powerball', 'Stock', 'Technology', 'Unknown Sector', 'Winning Fantasy 5 Numbers', 'Winning Pick 3 Numbers', 'Winning Pick 4 Numbers')",2026-07-16T03:51:14.979820Z,"('fb', 'meta')"
97253408,2026-07-16T02:21:30Z,Why Apple Stock Climbed to a New All-Time High Today,https://www.fool.com/investing/2026/07/15/why-apple-stock-climbed-to-new-all-time-high-today/?source=iedfolrf0000001,The technology giant's AI strategy is emerging.,fool.com,"('Aapl', 'Baba', 'Bidu', 'C53E56E2-Ff05-43F2-A79C-Adb438E0A41E', 'Consumer Cyclical', 'ETF', 'Goog', 'Googl', 'Investing', 'Meta', 'Stock', 'Technology', 'Technology And Telecom', 'Tiingo Top', 'Unknown Sector')",2026-07-16T02:55:49.914549Z,"('aapl', 'aapl', 'baba', 'bidu', 'goog', 'goog', 'googl', 'meta', 'meta', 'meta', 'metv')"
97252424,2026-07-16T01:17:00Z,Meta doubles down on its most enormous AI bet yet,https://finance.yahoo.com/technology/ai/articles/meta-doubles-down-most-enormous-011700221.html,"Richland Parish, Louisiana, may not be a place that comes to mind when people think about the AI race. It's a rural stretch of Northeast Louisiana, the kind of place that doesn't usually make headlines in the technology industry. But since December 2024, something has been going up there on a ...",finance.yahoo.com,"('Alexandr Wang', 'Blue Owl', 'Data Center', 'ETF', 'Hyperion', 'Infrastructure', 'Louisiana', 'Meta', 'Meta Superintelligence Labs', 'Richland Parish', 'Stock', 'Technology', 'Unknown Sector', 'Utilities')",2026-07-16T01:39:36.599987Z,"('eaa', 'ela', 'elb', 'elu', 'etr', 'ezt', 'meta', 'meta', 'meta', 'metv')"
97251915,2026-07-16T01:06:31Z,Daily Open: Big Tech rally drowns out Iran war fears — Buffett urges caution,https://www.cnbc.com/2026/07/16/daily-open-newsletter-fed-warsh-inflation-ppi-spacex-paypal-anthropic-warren-buffett-.html,"Stocks closed higher on Big Tech gains and a surprise drop in wholesale prices, shrugging off fresh U.S. strikes on Iran, a naval blockade.",cnbc.com,"('Asia Economy', 'Basic Materials', 'Breaking News: Economy', 'Consumer Cyclical', 'ETF', 'Economy', 'Energy', 'Financial Services', 'Foreign Policy', 'Industrials', 'Iran', 'Stock', 'Technology', 'Tiingo Top', 'Unknown Sector')",2026-07-16T01:12:41.669624Z,"('aal', 'aapl', 'aapl', 'amd', 'arkk', 'avgo', 'avgo', 'ba', 'ba', 'bno', 'brk', 'cf', 'cf', 'cop', 'cvx', 'dal', 'dbo', 'dbo', 'ewh', 'ewj', 'ews', 'ewu', 'ewy', 'fdn', 'fdn', 'fdx', 'finx', 'googl', 'gs', 'gs', 'ixc', 'kwt', 'kwt', 'lmt', 'lmt', 'mchi', 'meta', 'meta', 'meta', 'metv', 'mos', 'mrvl', 'mrvl', 'msft', 'msft', 'noc', 'noc', 'ntr', 'ntr', 'nvda', 'nvda', 'orcl', 'oxy', 'oxy', 'pypl', 'pypl', 'pypy', 'qqq', 'qqq', 'shel', 'shel', 'socl', 'soxx', 'spcx', 'spcx', 'thd', 'tsla', 'tsla', 'tsm', 'tte', 'tte', 'ual', 'uco', 'uga', 'ups', 'vgk', 'xar', 'xle', 'xlk', 'xom', 'xom')"
97250970,2026-07-15T23:47:00Z,Why Would Nvidia Invest $2 Billion in a Company Helping Build an Alternative to NVLink?,https://www.fool.com/investing/2026/07/15/why-would-nvidia-invest-2-billion-in-a-company-hel/?source=iedfolrf0000001,"Why would Nvidia invest $2 billion in a company that helps customers build alternatives to its own technology? Marvell's unusual position across custom AI chips, NVLink, UALink, copper, and optical networking may reveal how Nvidia plans to compete as AI infrastructure becomes more modular.",fool.com,"('Amzn', 'Avgo', 'Communication Services', 'Consumer Cyclical', 'E52E72F6-Daa9-4Ff1-9869-73Dea5Ab6E1E', 'ETF', 'Goog', 'Googl', 'Investing', 'Meta', 'Mrvl', 'Msft', 'Nvda', 'Stock', 'T', 'Technology', 'Technology And Telecom', 'Unknown Sector', 'Vz')",2026-07-16T00:11:48.464406Z,"('amzn', 'amzn', 'avgo', 'avgo', 'goog', 'goog', 'googl', 'meta', 'meta', 'meta', 'metv', 'mrvl', 'mrvl', 'msft', 'msft', 'nvda', 'nvda', 'vz', 'vz')"
97249764,2026-07-15T22:51:00Z,Qualcomm Might Be a Hot AI Stock Next Year,https://www.fool.com/investing/2026/07/15/qualcomm-might-be-a-hot-ai-stock-next-year/?source=iedfolrf0000001,Qualcomm could surprise a lot of investors next year.,fool.com,"('Aapl', 'Amd', 'D85Eee98-3339-4Fa0-B012-8Dda58B55Dec', 'ETF', 'Investing', 'Meta', 'Nvda', 'Qcom', 'Stock', 'Technology', 'Technology And Telecom', 'Unknown Sector')",2026-07-15T23:21:33.492756Z,"('aapl', 'aapl', 'amd', 'meta', 'meta', 'meta', 'metv', 'nvda', 'nvda', 'qcom', 'qcom')"
97249132,2026-07-15T22:46:06Z,Jim Cramer questions whether Wednesday's rally in Big Tech will have staying power,https://www.cnbc.com/2026/07/15/jim-cramer-wednesday-rally-big-tech-staying-power.html,CNBC's Jim Cramer warned that Wednesday's rally in tech may have gotten carried away from fundamentals.,cnbc.com,"('Breaking News: Technology', 'Business', 'Computing', 'Consumer Cyclical', 'ETF', 'Internet', 'Investment Strategy', 'Markets', 'Stock', 'Stock Markets', 'Technology', 'Tiingo Top', 'Unknown Sector', 'Wireless')",2026-07-15T22:53:35.016862Z,"('aapl', 'aapl', 'amzn', 'amzn', 'botz', 'brk', 'dell', 'dell', 'googl', 'igv', 'meta', 'meta', 'meta', 'metv', 'msft', 'msft', 'mu', 'mu', 'nvda', 'nvda', 'qqq', 'qqq', 'soxx', 'vgt', 'xlk')"
97248563,2026-07-15T22:03:37Z,Meta Platforms Inc (META) Stock Up 3.1% and Still Undervalued -- GF Score: 96/100,https://www.gurufocus.com/news/8961109/meta-platforms-inc-meta-stock-up-31-and-still-undervalued-gf-score-96100,,gurufocus.com,"('ETF', 'Stock', 'Technology', 'Unknown Sector')",2026-07-15T22:31:24.608179Z,"('meta', 'meta', 'meta', 'metv')"
97247980,2026-07-15T21:20:51Z,"YouTube appeals the social media addiction verdict, arguing it isn’t social media",https://thenextweb.com/news/youtube-appeals-social-media-addiction-verdict,"YouTube has appealed the landmark social media addiction verdict, joining Meta, and argues it is not a social media platform like Instagram or TikTok.",thenextweb.com,"('Business', 'ETF', 'Google', 'Legal', 'Meta', 'Privacy', 'Social Media', 'Stock', 'Technology', 'Tiingo Top', 'United States', 'Unknown Sector')",2026-07-15T22:18:58.497844Z,"('goog', 'googl', 'meta', 'meta', 'meta', 'metv')"
97246509,2026-07-15T20:58:10Z,"What Meta, Google, and BlackRock get for training electricians",https://finance.yahoo.com/small-business/articles/meta-google-blackrock-training-electricians-205810029.html,Meta's newest recruits could lose their jobs once data center construction is finished. Nobody knows if they'll get hired anywhere else,finance.yahoo.com,"('Blackrock', 'Data Centers', 'ETF', 'Electrical Training Alliance', 'Financial Services', 'Meta', 'Skilled Worker', 'Stock', 'Technology', 'Union Apprenticeship', 'Unknown Sector', 'Workforce Academy', 'Workforce Innovation')",2026-07-15T21:19:07.899686Z,"('bcf', 'bgio', 'blk', 'goog', 'googl', 'meta', 'meta', 'meta', 'metv')"
97244037,2026-07-15T20:04:35Z,Meta Faces First AI Layoff Discrimination Suit as July 22 Deadline Looms,https://www.techtimes.com/articles/320647/20260715/meta-faces-first-ai-layoff-discrimination-suit-july-22-deadline-looms.htm,"Meta AI layoff discrimination lawsuit: 26 employees allege that behavioral telemetry scoring systems used in Meta’s May 2026 layoffs could not account for workers on protected medical, parental, or disability leave — potentially the first legal test of AI-assisted layoff selection under the FMLA,",techtimes.com,"('Ai Employment Law', 'Ai Layoffs', 'Behavioral Telemetry Employment Discrimination', 'ETF', 'Employee Monitoring', 'Fmla', 'Legal', 'Meta', 'Meta Ai Lawsuit', 'Stock', 'Technology', 'Unknown Sector', 'Workday Lawsuit')",2026-07-15T20:05:53.709615Z,"('meta', 'meta', 'meta', 'metv')"
97243443,2026-07-15T19:15:00Z,Better Artificial Intelligence (AI) Stock: Alphabet Versus Meta Platforms,https://www.fool.com/investing/2026/07/15/better-ai-stock-alphabet-versus-meta-platforms/?source=iedfolrf0000001,Meta and Alphabet may be competing in another field soon.,fool.com,"('B91863A0-079F-4C1A-9Fa6-Fc9055692Db2', 'ETF', 'Goog', 'Googl', 'Investing', 'Meta', 'Stock', 'Technology', 'Technology And Telecom', 'Unknown Sector')",2026-07-15T19:43:40.734450Z,"('goog', 'goog', 'googl', 'meta', 'meta', 'meta', 'metv')"
97242557,2026-07-15T18:49:42Z,Meta Faces Lawsuit Regarding Claims Its AI Systems Targeted Employees With Disabilities When It Reduced Workforce,https://finance.yahoo.com/technology/ai/articles/meta-faces-lawsuit-regarding-claims-184942077.html,Meta is facing a lawsuit over its alleged use of AI in layoffs.,finance.yahoo.com,"('Courthouse News Service', 'ETF', 'Employees', 'Medical Leave', 'Meta', 'Pregnancy Discrimination Act', 'Stock', 'Technology', 'Unknown Sector', 'Workforce Management')",2026-07-15T19:10:40.308726Z,"('meta', 'meta', 'meta', 'metv')"
97241787,2026-07-15T18:40:24Z,Instagram's Topic Controls Work Only If You Never Actually Watched That Content,https://www.techtimes.com/articles/320623/20260715/instagrams-topic-controls-work-only-if-you-never-actually-watched-that-content.htm,"Instagram algorithm control is now in users’ hands via the “Your Algorithm” feature, live across Feed, Reels, and Explore globally since June 10, 2026 — but your scrolling behavior still outweighs your stated topic preferences in Instagram’s ranking engine. Here is what the feature changes, where",techtimes.com,"('Adam Mosseri', 'ETF', 'Eu Digital Services Act', 'Eu Digital Services Act Meta', 'Instagram', 'Instagram Algorithm Control', 'Instagram Your Algorithm', 'Internet', 'Meta', 'Social Media Algorithm', 'Stock', 'Technology', 'Unknown Sector')",2026-07-15T18:42:44.080912Z,"('meta', 'meta', 'meta', 'metv')"
97241850,2026-07-15T18:36:11Z,Apple's China breakthrough on AI provides another tailwind for its stock,https://www.cnbc.com/2026/07/15/apples-china-breakthrough-provides-another-tailwind-for-its-stock.html,"Every weekday, the Investing Club releases the Homestretch; an actionable afternoon update just in time for the last hour of trading.",cnbc.com,"('Breaking News: Markets', 'China', 'Consumer Cyclical', 'ETF', 'Financial Services', 'Healthcare', 'Industrials', 'Investment Strategy', 'Markets', 'Real Estate', 'Stock', 'Technology', 'Tiingo Top', 'Unknown Sector')",2026-07-15T18:45:26.926683Z,"('aapl', 'aapl', 'abt', 'abt', 'amzn', 'amzn', 'baba', 'bidu', 'ge', 'glw', 'googl', 'jbht', 'meta', 'meta', 'meta', 'metv', 'msft', 'msft', 'pld', 'qqq', 'qqq', 'stt', 'tsm', 'ual', 'unh', 'unh', 'xlk')"
97242017,2026-07-15T18:30:14Z,Why I Won’t Stop Buying Meta Before September,https://finance.yahoo.com/markets/stocks/articles/why-won-t-stop-buying-183014149.html,"I keep hitting the buy button on Meta, and the September deadline is the reason I refuse to stop before then. The pull for me is simple. Meta Platforms (NASDAQ:META) owns the demand side of the AI economy. Every quarter, 3.56 billion people show up on Facebook, Instagram, WhatsApp, and Threads, and Mark Zuckerberg gets ... Why I Won’t Stop Buying Meta Before September",finance.yahoo.com,"('Broadcom', 'ETF', 'Meta', 'Stock', 'Technology', 'Top 10 Ai Stocks', 'Unknown Sector')",2026-07-15T18:49:35.176608Z,"('avgo', 'brcm', 'meta', 'meta', 'meta', 'metv', 'nvda')"
97239675,2026-07-15T17:20:36Z,Meta Builds AI Revenue Stack: Developer API Launches as Advertiser Automation Goes Global,https://www.techtimes.com/articles/320609/20260715/meta-builds-ai-revenue-stack-developer-api-launches-advertiser-automation-goes-global.htm,"Meta Muse Spark 1.1 API launches at roughly one-quarter of OpenAI and Anthropic flagship rates as Advantage+ Catalog Ads expand globally, removing the last manual audience controls from automated product advertising. Independent benchmarks found a 10-point gap from Meta’s own scores, and EU",techtimes.com,"('Advantage+ Catalog Ads', 'Agentic Ai', 'Ai', 'Ai Advertising', 'Artificial Intelligence', 'ETF', 'Financial Services', 'Meta', 'Meta Model Api', 'Meta Muse Spark 1.1', 'Meta Stock', 'Stock', 'Technology', 'Tiingo Top', 'Unknown Sector')",2026-07-15T17:22:49.411658Z,"('aaic', 'ai', 'ai', 'meta', 'meta', 'meta', 'metv')"
97238381,2026-07-15T16:18:00Z,Meta employees sue over alleged AI-driven layoffs targeting workers on leave,https://finance.yahoo.com/technology/ai/articles/meta-employees-sue-over-alleged-161800799.html,"Meta Platforms Inc (NASDAQ:META, XETRA:FB2A, SIX:FB) is facing a lawsuit from 26 employees who allege the company used artificial intelligence tools and automated workplace metrics to select workers for mass layoffs, with the plaintiffs claiming the process disproportionately affected employees...",finance.yahoo.com,"('Artificial Intelligence Tools', 'ETF', 'Employees', 'Medical Leave', 'Meta', 'Select Workers', 'Stock', 'Technology', 'Unknown Sector')",2026-07-15T16:40:51.267091Z,"('meta', 'meta', 'meta', 'metv')"
97237468,2026-07-15T15:44:15Z,Zuckerberg is a “Brilliant Gangster”: Dana White’s Inside Look at the Meta Boardroom,https://finance.yahoo.com/technology/ai/articles/zuckerberg-brilliant-gangster-dana-white-154415096.html,UFC CEO Dana White sits inside Meta's boardroom and calls Mark Zuckerberg the biggest killer he has ever met. What he witnessed there explains why Meta is now placing a bet that dwarfs anything Silicon Valley has attempted before.,finance.yahoo.com,"('Dana White', 'ETF', 'Meta', 'Meta Ai', 'Reality Labs', 'Stock', 'Technology', 'Top 10 Ai Stocks', 'Unknown Sector', 'Zuckerberg')",2026-07-15T16:11:09.217710Z,"('meta', 'meta', 'meta', 'metv', 'nvda')"
97241314,2026-07-15T13:55:14Z,Meta commits $50B to Louisiana data center and surrounding area,https://finance.yahoo.com/technology/articles/meta-commits-50b-louisiana-data-135514147.html,"The facility in Richland Parish, which broke ground in December 2024, will support 7,500 construction jobs at peak construction.",finance.yahoo.com,"('Announcement', 'Data Center', 'Dpr Construction', 'ETF', 'Louisiana', 'Meta', 'Richland Parish', 'Stock', 'Technology', 'Turner Construction', 'Unknown Sector', 'Utilities')",2026-07-15T18:18:38.028130Z,"('ela', 'elb', 'elu', 'meta', 'meta', 'meta', 'metv')"
97232157,2026-07-15T13:50:57Z,Meta Faces Lawsuit Over AI-Driven Layoffs Amid Allegations of Discrimination,https://www.gurufocus.com/news/8959977/meta-faces-lawsuit-over-aidriven-layoffs-amid-allegations-of-discrimination,,gurufocus.com,"('ETF', 'Stock', 'Technology', 'Unknown Sector')",2026-07-15T14:01:40.851327Z,"('meta', 'meta', 'meta', 'metv')"
97231035,2026-07-15T13:32:57Z,EU Moves to Bar Children From Social Media as US Congress Stalls on Safety Law,https://www.techtimes.com/articles/320565/20260715/eu-moves-bar-children-social-media-us-congress-stalls-safety-law.htm,"Children social media ban: The EU announced restrictions for minors across all 27 member states on July 13 as the US House passed the Kids Internet and Digital Safety Act, but Senate sponsors declared the bill dead on arrival — exposing a global divide over how far governments should go and what",techtimes.com,"('Age Verification', 'Children Social Media Ban', 'Duty Of Care', 'ETF', 'Eu Digital Regulation', 'Kids Act', 'Legal', 'Meta', 'Online Safety Law', 'Stock', 'Technology', 'Tiktok', 'Unknown Sector')",2026-07-15T13:34:21.385394Z,"('goog', 'googl', 'meta', 'meta', 'meta', 'metv')"
97233777,2026-07-15T13:00:11Z,"Meta Platforms, Inc. (META) is Attracting Investor Attention: Here is What You Should Know",https://www.zacks.com/stock/news/2953741/meta-platforms-inc-meta-is-attracting-investor-attention-here-is-what-you-should-know?cid=CS-ZC-FT-tale_of_the_tape%7Cmost_searched_stocks-2953741,,zacks.com,"('ETF', 'Stock', 'Tale Of The Tape', 'Technology', 'Unknown Sector')",2026-07-15T14:31:52.556012Z,"('meta', 'meta', 'meta', 'metv')"
97228452,2026-07-15T12:00:00Z,"If a Stock Market Crash Is Coming, 100 Years of History Says This Is the Best Move Investors Can Make",https://www.fool.com/investing/2026/07/15/if-a-stock-market-crash-is-coming-100-years-of-his/?source=iedfolrf0000001,Market volatility could be looming. Here's how to protect your investments.,fool.com,"('Aapl', 'Amzn', 'Cfe44E4C-D6Dd-4D87-A868-4A7809E93717', 'Consumer Cyclical', 'ETF', 'Goog', 'Googl', 'Investing', 'Markets', 'Meta', 'Msft', 'Mu', 'Nvda', 'Stock', 'Technology', 'Tsla', 'Unknown Sector', '^Gspc')",2026-07-15T12:25:27.982122Z,"('aapl', 'aapl', 'amzn', 'amzn', 'goog', 'goog', 'googl', 'meta', 'meta', 'meta', 'metv', 'msft', 'msft', 'mu', 'mu', 'nvda', 'nvda', 'tsla', 'tsla')"
97227620,2026-07-15T11:55:08Z,Alibaba’s U.S.-listed shares rise 4% after Qwen AI set to be integrated in Apple Intelligence,https://www.cnbc.com/2026/07/15/alibaba-qwen-ai-apple-intelligence.html,The Cyberspace Administration of China on Wednesday included Apple's AI services on a list of approved providers.,cnbc.com,"('Breaking News: Markets', 'Breaking News: Technology', 'Business', 'China', 'Computing', 'Consumer Cyclical', 'ETF', 'Internet', 'Markets', 'Stock', 'Technology', 'Tiingo Top', 'Unknown Sector', 'Wireless')",2026-07-15T12:00:27.768094Z,"('aapl', 'aapl', 'baba', 'meta', 'meta', 'meta', 'metv')"
97227608,2026-07-15T11:35:00Z,2 Superior Growth Stocks to Buy in 2026,https://www.fool.com/investing/2026/07/15/2-superior-growth-stocks-to-buy-in-2026/?source=iedfolrf0000001,Buying and holding these tech stocks for the long term could pay off.,fool.com,"('0F58C477-8727-4Fad-95Ea-005770072Edd', 'ETF', 'Investing', 'Meta', 'Nvda', 'Stock', 'Technology', 'Technology And Telecom', 'Unknown Sector')",2026-07-15T11:59:33.193556Z,"('meta', 'meta', 'meta', 'metv', 'nvda', 'nvda')"
97227077,2026-07-15T11:32:44Z,EU Forces Meta to Reopen WhatsApp to ChatGPT After Rare Antitrust Order,https://www.techtimes.com/articles/320541/20260715/eu-forces-meta-reopen-whatsapp-chatgpt-after-rare-antitrust-order.htm,"ChatGPT WhatsApp access returned to 500 million European Economic Area users on July 13 after the EU forced Meta to reopen its platform under a rare Article 8(1) antitrust order — only the second emergency intervention under Regulation 1/2003 since 2004, triggered by regulators‘ finding that Meta’s",techtimes.com,"('2003', 'Ai Competition', 'Article 8 Regulation 1', 'Artificial Intelligence', 'Chatgpt', 'ETF', 'Eu Antitrust Interim Measures', 'Meta', 'Openai', 'Stock', 'Technology', 'Tiingo Top', 'Unknown Sector', 'Whatsapp', 'Whatsapp Business Api Chatgpt')",2026-07-15T11:34:10.378335Z,"('brcm', 'goog', 'googl', 'meta', 'meta', 'meta', 'metv', 'msft')"
97227044,2026-07-15T11:31:31Z,"EU Antitrust Order Reopens WhatsApp to ChatGPT, Setting Precedent for AI Markets",https://www.techtimes.com/articles/320553/20260715/eu-antitrust-order-reopens-whatsapp-chatgpt-setting-precedent-ai-markets.htm,ChatGPT is back on WhatsApp in Europe after the European Commission issued a rare interim measures order forcing Meta to restore free access for rival AI assistants to the WhatsApp Business API — only the second such order in more than twenty years — a decision that sets a binding precedent for AI,techtimes.com,"('Artificial Intelligence', 'Chatgpt', 'Chatgpt Whatsapp Europe', 'ETF', 'Eu Ai Act', 'Eu Antitrust Meta Whatsapp', 'Meta', 'Openai', 'Stock', 'Technology', 'Tiingo Top', 'Unknown Sector', 'Whatsapp', 'Whatsapp Business Api')",2026-07-15T11:32:53.963837Z,"('brcm', 'ims', 'meta', 'meta', 'meta', 'metv', 'msft')"
97226499,2026-07-15T11:09:10Z,Meta Faces Jury Over Addictive Design: Four States Seek $1.4 Trillion in Damages,https://www.techtimes.com/articles/320535/20260715/meta-faces-jury-over-addictive-design-four-states-seek-14-trillion-damages.htm,"Meta social media addiction trial begins July 27 in Los Angeles as four states demand up to $1.4 trillion in penalties over Instagram and Facebook’s infinite scroll design. The August 18 Oakland attorneys general trial could force Meta to disable addictive platform mechanics, and age verification",techtimes.com,"('Age Verification', 'ETF', 'Industrials', 'Infinite Scroll Addiction Trial', 'Instagram', 'Legal', 'Meta', 'Meta $1.4 Trillion Penalty', 'Meta Social Media Lawsuit', 'Social Media Addiction', 'Stock', 'Technology', 'Teen Mental Health', 'Unknown Sector')",2026-07-15T11:11:05.360533Z,"('arb', 'meta', 'meta', 'meta', 'metv', 'nlsn')"
97227136,2026-07-15T11:06:00Z,"AI Is Reshaping a Trillion-Dollar Wall Street Catalyst, and It Has Terrifying Implications for the 2nd-Priciest Stock Market in History",https://www.fool.com/investing/2026/07/15/ai-reshaping-trillion-dollar-wall-street-catalyst/?source=iedfolrf0000001,"As spending on the artificial intelligence (AI) infrastructure build-out accelerates, a separate stock market catalyst is being starved of capital.",fool.com,"('3833A216-0F61-473A-Ac38-F805F87648Cd', 'Aapl', 'ETF', 'Goog', 'Googl', 'Investing', 'Meta', 'Stock', 'Technology', 'Technology And Telecom', 'Unknown Sector')",2026-07-15T11:34:50.379954Z,"('aapl', 'aapl', 'goog', 'goog', 'googl', 'meta', 'meta', 'meta', 'metv')"
97226169,2026-07-15T11:00:46.452178Z,Meta Faces Lawsuit Over AI-Driven Layoffs Amid Workforce Reduction,https://www.gurufocus.com/news/8959610/meta-faces-lawsuit-over-aidriven-layoffs-amid-workforce-reduction,,gurufocus.com,"('ETF', 'Stock', 'Technology', 'Unknown Sector')",2026-07-15T11:00:46.782815Z,"('meta', 'meta', 'meta', 'metv')"
97232877,2026-07-15T10:31:08Z,"Main Street Research LLC Cuts Stake in Meta Platforms, Inc. $META",https://www.thelincolnianonline.com/2026/07/15/main-street-research-llc-cuts-stake-in-meta-platforms-inc-meta.html,"Main Street Research LLC lowered its holdings in shares of Meta Platforms, Inc. (NASDAQ:META – Free Report) by 18.0% during the 1st quarter, according to the company in its most recent filing with the SEC. The fund owned 70,962 shares of the social networking company’s stock after selling 15,585 shares during the period. Meta Platforms […]",thelincolnianonline.com,"('13F', '30303M10', 'Computer And Technology', 'ETF', 'Financial Services', 'Hedge Fund Holdings', 'Institutional Investor Holdings', 'Meta', 'Meta Platforms', 'Nasdaq:Meta', 'Sec Filings', 'Stock', 'Technology', 'Unknown Sector')",2026-07-15T14:12:56.554160Z,"('jpm', 'jpm-ws', 'meta', 'meta', 'meta', 'metv', 'stt')"
97232888,2026-07-15T10:30:55Z,"Meta Platforms, Inc. $META Stake Reduced by Sumitomo Mitsui Trust Group Inc.",https://www.thelincolnianonline.com/2026/07/15/meta-platforms-inc-meta-stake-reduced-by-sumitomo-mitsui-trust-group-inc.html,"Sumitomo Mitsui Trust Group Inc. cut its position in shares of Meta Platforms, Inc. (NASDAQ:META – Free Report) by 4.7% in the first quarter, according to the company in its most recent filing with the Securities & Exchange Commission. The institutional investor owned 5,076,431 shares of the social networking company’s stock after selling 249,706 shares […]",thelincolnianonline.com,"('13F', '30303M10', 'Computer And Technology', 'ETF', 'Hedge Fund Holdings', 'Institutional Investor Holdings', 'Meta', 'Meta Platforms', 'Nasdaq:Meta', 'Sec Filings', 'Stock', 'Technology', 'Unknown Sector')",2026-07-15T14:13:11.114202Z,"('meta', 'meta', 'meta', 'metv')"
97225514,2026-07-15T10:13:17Z,3 Quality Compounders to Keep an Eye On,https://finance.yahoo.com/markets/stocks/articles/3-quality-compounders-keep-eye-101317008.html,"Quality compounders are well-oiled machines. Their competitive advantages allow them to make profits consistently and reinvest them into projects that generate even more profits, creating a virtuous cycle of returns.",finance.yahoo.com,"('Consumer Defensive', 'ETF', 'Earnings Per Share', 'Ebitda Margin', 'Free Cash Flow', 'Mark Zuckerberg', 'Market Cap', 'Meta', 'Mnst', 'Operating Leverage', 'Revenue Gains', 'Stock', 'Technology', 'Unknown Sector')",2026-07-15T10:27:35.115845Z,"('meta', 'meta', 'meta', 'metv', 'mnst', 'uber')"
97225060,2026-07-15T10:02:30Z,Midnight social media curfew and limits to infinite scrolling proposed for older UK teens,https://www.cnbc.com/2026/07/15/social-media-ban-uk-midnight-curfews-infinite-scroll-teens.html,"The U.K. government has proposed new measures to protect older teens on social media, including a midnight curfew and a limit to infinite scrolling.",cnbc.com,"('Breaking News: Technology', 'Business', 'Drug Addiction', 'ETF', 'Entertainment', 'Media', 'Online Safety', 'Publishing', 'Social Issues', 'Social Media', 'Social Media Industry', 'Stock', 'Technology', 'Television', 'Unknown Sector')",2026-07-15T10:08:22.229573Z,"('googl', 'meta', 'meta', 'meta', 'metv', 'snap')"
97223692,2026-07-15T08:53:00Z,"Buy 2 Vanguard Index Funds to Beat the S&P 500 in the Next Year, According to Wall Street Analysts",https://www.fool.com/investing/2026/07/15/buy-2-index-funds-beat-sp-500-next-year-wall-st/?source=iedfolrf0000001,Wall Street expects the communication services and technology sectors to beat the S&P 500 over the next year.,fool.com,"('04608Dc3-87B8-474A-8461-3Bb37F4D5A7D', 'Aapl', 'Avgo', 'Communication Services', 'Consumer Cyclical', 'Dis', 'ETF', 'Fds', 'Financial Services', 'Goog', 'Googl', 'Investing', 'Markets', 'Meta', 'Msft', 'Mu', 'Nvda', 'Stock', 'T', 'Technology', 'Unknown Sector', 'Vgt', 'Voo', 'Vox', 'Vz', '^Gspc')",2026-07-15T09:17:50.571922Z,"('aapl', 'aapl', 'avgo', 'avgo', 'dis', 'dis', 'fds', 'goog', 'goog', 'googl', 'meta', 'meta', 'meta', 'metv', 'msft', 'msft', 'mu', 'mu', 'nvda', 'nvda', 'vgt', 'voo', 'vox', 'vz', 'vz')"
