id,publishedDate,title,url,description,source,tags,crawlDate,tickers
96032191,2026-05-28T22:14:49Z,Wiwynn Warns AI Supply Crunch Could Last Until 2027-2028,https://finance.yahoo.com/sectors/technology/articles/wiwynn-warns-ai-supply-crunch-221449458.html,Server supplier says component shortages beyond memory chips may raise costs as AI spending accelerates.,finance.yahoo.com,"('Ai Infrastructure', 'Chair Emily Hong', 'Gurufocus', 'Memory Chips', 'Stock', 'Technology', 'Wiwynn Corp.')",2026-05-28T22:25:43.615071Z,"('meta', 'msft', 'nvda')"
96031992,2026-05-28T21:56:00Z,Meta Announces Quarterly Cash Dividend,https://finance.yahoo.com/markets/stocks/articles/meta-announces-quarterly-cash-dividend-215600046.html,"The Meta Platforms, Inc. (Nasdaq: META) board of directors today declared a quarterly cash dividend of $0.525 per share of the company's outstanding Class A common stock and Class B common stock, payable on June 25, 2026 to stockholders of record as of the close of business on June 15, 2026.",finance.yahoo.com,"('Inc.', 'Meta Platforms', 'Prnewswire', 'Stock', 'Technology')",2026-05-28T22:14:14.558390Z,"('meta',)"
96031644,2026-05-28T21:56:00Z,Meta Announces Quarterly Cash Dividend,https://www.prnewswire.com/news-releases/meta-announces-quarterly-cash-dividend-302785064.html,"/PRNewswire/ -- The Meta Platforms, Inc. (Nasdaq: META) board of directors today declared a quarterly cash dividend of $0.525 per share of the company's...",prnewswire.com,"('Computer & Electronics', 'Dividends', 'Retail', 'Social Media', 'Stock', 'Technology')",2026-05-28T21:57:11.045613Z,"('meta',)"
96031492,2026-05-28T21:51:56Z,Brutal bloodbath at California tech startup Webflow as staff locked out without warning,https://nypost.com/2026/05/28/tech/bloodbath-at-california-tech-startup-as-staff-locked-out-without-warning/,Website building and hosting platform Webflow is just the latest victim of Artificial Intelligence that has wreaked havoc on California tech industry — making the shocking announcement Wednesday th…,nypost.com,"('California', 'ETF', 'Financial Services', 'Layoffs', 'Linkedin', 'Meta', 'San Francisco', 'Stock', 'Technology', 'Wix')",2026-05-28T21:54:38.825455Z,"('aaba', 'csco', 'intu', 'meta', 'meta', 'metv', 'wix', 'yhoo')"
96031442,2026-05-28T21:41:00Z,Three AI-Platform Leaders Driving the Growth Narrative,https://kalkinemedia.com/us/stocks/growth/three-ai-platform-leaders-driving-the-growth-narrative,"Microsoft, Alphabet and Meta Platforms are three mega-cap US platforms driving the AI-powered growth narrative.",kalkinemedia.com,"('Stock', 'Technology', 'Three Ai-Platform Leaders Driving The Growth Narrative')",2026-05-28T21:53:32.282972Z,"('googl', 'meta', 'msft')"
96030436,2026-05-28T20:50:12Z,"Zuck Says Meta Will Sell Its Excess Compute, Maybe",https://finance.yahoo.com/sectors/technology/articles/zuck-says-meta-sell-excess-205012147.html,"Meta's CEO floated a pivot into cloud computing at the annual shareholder meeting, doubling down on AI infrastructure with no clear return in sight.",finance.yahoo.com,"('ETF', 'Excess Capacity', 'Mark Zuckerberg', 'Meta', 'Reality Labs', 'Stock', 'Technology')",2026-05-28T21:10:36.494632Z,"('meta', 'meta', 'metv', 'msft', 'nvda', 'orcl')"
96030049,2026-05-28T20:48:27.287000Z,Apollo Shops $36 Billion Debt Deal to Buy Google Chips for Anthropic,https://www.bloomberg.com/news/articles/2026-05-28/apollo-shops-36-billion-debt-deal-to-buy-google-chips-for-anthropic,,bloomberg.com,"('Financial Services', 'Stock', 'Technology', 'Tiingo Top', 'Unknown Sector')",2026-05-28T20:54:35.024671Z,"('avgo', 'bx', 'crwv', 'meta', 'nvda')"
96027094,2026-05-28T18:43:51.466000Z,US Investors Back Brazil’s Pax in Bet on AI-Powered Policing,https://www.bloomberg.com/news/articles/2026-05-28/us-investors-back-brazil-s-pax-in-bet-on-ai-powered-policing,,bloomberg.com,"('Brazil', 'Industrials', 'Stock', 'Technology', 'Tiingo Top', 'Unknown Sector')",2026-05-28T18:50:33.342058Z,"('axon', 'meta', 'msi', 'uber')"
96027207,2026-05-28T18:33:00Z,Mark Zuckerberg rolls out a bizarre new update for Meta users,https://finance.yahoo.com/sectors/technology/articles/mark-zuckerberg-rolls-bizarre-meta-183300039.html,"Facebook, Instagram, and WhatsApp have been free since the day they launched. Billions of people built habits around that. On May 27, Mark Zuckerberg started changing it. The change is optional, and the core apps stay free. But the structure Meta is building around them is something the company has ...",finance.yahoo.com,"('ETF', 'Facebook', 'Mark Zuckerberg', 'Meta', 'Meta One', 'Personalization Features', 'Stock', 'Techcrunch', 'Technology', 'Whatsapp Plus')",2026-05-28T18:55:37.697713Z,"('meta', 'meta', 'metv')"
96025993,2026-05-28T17:29:00Z,My Top 4 Stocks That Benefit Most from the $725 Billion AI Infrastructure Supercycle,https://www.fool.com/investing/2026/05/28/my-top-4-stocks-that-benefit-most-from-the-725-bil/?source=iedfolrf0000001,These AI stocks are going to be certain winners of the huge investments in data centers.,fool.com,"('73E9A6F9-Ea15-4667-A0B0-B0413B00C50B', 'Amd', 'Amzn', 'Avgo', 'Consumer Cyclical', 'ETF', 'Investing', 'It', 'Meta', 'Msft', 'Nvda', 'Stock', 'Technology', 'Technology And Telecom', 'Tsm', '^Ixic')",2026-05-28T17:55:35.487939Z,"('amzn', 'avgo', 'meta', 'meta', 'metv', 'msft', 'nvda', 'tsm')"
96025238,2026-05-28T17:05:00Z,Meta Platforms: A Stock to Avoid or a Once-in-a-Decade Buying Opportunity?,https://finance.yahoo.com/markets/stocks/articles/meta-platforms-stock-avoid-once-170500938.html,Can Meta's massive AI spending pay off?,finance.yahoo.com,"('Communication Services', 'Consumer Cyclical', 'Meta Platforms', 'Meta Stock', 'Spending', 'Stock', 'Technology')",2026-05-28T17:24:32.366872Z,"('goog', 'googl', 'intc', 'iqnt', 'meta', 'msft', 'nflx', 'nvda')"
96024831,2026-05-28T16:45:00Z,Meta Platforms: A Stock to Avoid or a Once-in-a-Decade Buying Opportunity?,https://www.fool.com/investing/2026/05/28/meta-platforms-stock-to-avoid-or-once-in-a-decade/?source=iedfolrf0000001,Can Meta's massive AI spending pay off?,fool.com,"('96521Ed8-6109-4064-910B-Ce9Ea577004C', 'ETF', 'Goog', 'Googl', 'Investing', 'Meta', 'Stock', 'Technology', 'Technology And Telecom')",2026-05-28T17:10:05.339669Z,"('goog', 'googl', 'meta', 'meta', 'metv')"
96029773,2026-05-28T16:27:09Z,"What’s rarer than a unicorn? Anthropic didn’t just join the Series H club, it almost became the first $1 trillion private company ever",https://fortune.com/2026/05/28/anthropic-series-h-valuation-ipo-unicorn/,"The $65 billion funding round was led by Altimeter, Dragoneer, Greenoaks and Sequoia, more than doubling the company's valuation in just three months.",fortune.com,"('Anduril', 'Anthropic', 'ETF', 'Meta', 'Openai', 'Slack', 'Start Up', 'Stock', 'Technology', 'Unicorns')",2026-05-28T20:41:18.411309Z,"('meta', 'meta', 'metv')"
96023527,2026-05-28T16:21:55Z,2 major developments at Meta may have just put a floor in on the struggling stock,https://www.cnbc.com/2026/05/28/2-major-developments-at-meta-may-have-just-put-a-floor-in-on-the-struggling-stock.html,Is now the time to step and buy shares of Meta Platforms?,cnbc.com,"('Breaking News: Markets', 'Breaking News: Technology', 'Business', 'Consumer Cyclical', 'ETF', 'Entertainment', 'Investment Strategy', 'Markets', 'Media', 'Publishing', 'Social Media', 'Stock', 'Technology', 'Television', 'Tiingo Top')",2026-05-28T16:28:17.756068Z,"('amzn', 'googl', 'meta', 'meta', 'metv', 'msft')"
96023048,2026-05-28T16:02:12Z,AI play Nebius is surging after mysterious new hedge fund manager reveals stake. Here are his other holdings,https://www.cnbc.com/2026/05/28/ai-play-nebius-surges-after-mysterious-new-hedge-fund-manager-reveals-stake.html,"The fund invests in publicly traded companies expected to benefit from AI adoption — including semiconductor, infrastructure and power firms.",cnbc.com,"('ETF', 'Investment Strategy', 'Stock', 'Stock Markets', 'Technology', 'Tiingo Top', 'Unknown Sector')",2026-05-28T16:07:16.988134Z,"('apld', 'avgo', 'corz', 'crwv', 'intc', 'iren', 'lite', 'meta', 'meta', 'metv', 'nbis', 'nvda', 'orcl', 'smh', 'sndk', 'sndk', 'wdc')"
96033157,2026-05-28T15:57:36Z,Meta and X make deals to monetize AI projects,https://finance.yahoo.com/sectors/technology/articles/meta-x-deals-monetize-ai-155736392.html,"Many businesses are looking to justify their massive artificial intelligence investments, but the AI bubble may be nearing its bursting point.",finance.yahoo.com,"('Ai Developers', 'Ai Infrastructure', 'Alexandr Wang', 'Development Costs', 'ETF', 'Meta', 'Stock', 'Technology', 'Uber Operations Chief Andrew Macdonald')",2026-05-28T23:11:17.247673Z,"('meta', 'meta', 'metv')"
96028751,2026-05-28T15:55:22Z,Tokenmaxxing is over. That’s because it never measured what really counts to see ROI from AI,https://fortune.com/2026/05/28/tokenmaxxing-is-dead-companies-didnt-get-the-roi-from-ai-they-wanted-to-see/,"Token usage is a poor proxy for company-wide productivity gains that only come from redesigning workflows, not just automating them.",fortune.com,"('Amazon', 'Anthropic', 'ETF', 'Eye On Ai', 'Meta', 'Productivity', 'Salesforce', 'Stock', 'Technology', 'Tokens', 'Uber Technologies', 'Worker Productivity')",2026-05-28T20:07:17.468830Z,"('meta', 'meta', 'metv')"
96023013,2026-05-28T15:48:00Z,2 Top Tech Stocks to Buy Right Now,https://finance.yahoo.com/markets/stocks/articles/2-top-tech-stocks-buy-154800041.html,Both have long-term potential that might be too good to pass up right now.,finance.yahoo.com,"('Communication Services', 'Consumer Cyclical', 'ETF', 'Energy Sector', 'S&P 500', 'Stock', 'Taiwan Semiconductor', 'Tech Companies', 'Technology', 'The Motley Fool', 'Unknown Sector')",2026-05-28T16:06:00.263524Z,"('intc', 'iqnt', 'meta', 'nflx', 'nvda', 'tall', 'tsm')"
96022603,2026-05-28T15:41:43Z,"Working overtime won't give you job security in the age of AI, say career experts: Stability is 'no longer a guarantee'",https://www.cnbc.com/2026/05/28/working-overtime-wont-give-you-job-security-in-the-age-of-ai-say-career-experts-stability-is-no-longer-a-guarantee.html,"With AI disrupting workplaces worldwide, you may feel pressured to work overtime to stay competitive. Those extra hours may not be worth it, experts say.",cnbc.com,"('Artificial Intelligence', 'ETF', 'Leadership', 'Mental Health', 'Personnel', 'Stock', 'Technology', 'Workplace Culture')",2026-05-28T15:50:21.749906Z,"('meta', 'meta', 'metv', 'msft')"
96022758,2026-05-28T15:40:37Z,ETFs Were Built to Make Investing Easier. They May Also Make Crashes Faster,https://finance.yahoo.com/markets/stocks/articles/etfs-were-built-investing-easier-154037158.html,"For years, exchange-traded funds were one of Wall Street’s great success stories. ETFs gave ordinary investors cheap diversification, instant market exposure, and lower fees than traditional mutual funds. Instead of picking individual stocks, investors could buy the whole market with a single click. It was investing simplified. But the ETF market has grown into something ... ETFs Were Built to Make Investing Easier. They May Also Make Crashes Faster",finance.yahoo.com,"('Consumer Cyclical', 'Etfs', 'Index Fund', 'Market Volatility', 'Stock', 'Technology', 'Trading Volume')",2026-05-28T15:56:40.961150Z,"('aapl', 'amzn', 'goog', 'googl', 'meta', 'msft', 'nvda')"
96022988,2026-05-28T15:38:18Z,"Meta asks users to pay for WhatsApp, Instagram and Facebook",https://www.aol.com/news/meta-asks-users-pay-whatsapp-153818963.html,Users asked to pay monthly fee for extra features,aol.com,"('ETF', 'Facebook', 'Meta', 'Personalisation Features', 'Stock', 'Technology')",2026-05-28T16:05:30.976450Z,"('meta', 'meta', 'metv')"
96022660,2026-05-28T15:28:00Z,2 Top Tech Stocks to Buy Right Now,https://www.fool.com/investing/2026/05/28/2-top-tech-stocks-to-buy-right-now/?source=iedfolrf0000001,Both have long-term potential that might be too good to pass up right now.,fool.com,"('2734Fb4D-13Ac-49C6-94Be-4B7A8Fe15B2C', 'ETF', 'Investing', 'Meta', 'Stock', 'Technology', 'Technology And Telecom', 'Tsm')",2026-05-28T15:53:35.001449Z,"('meta', 'meta', 'metv', 'tsm')"
96022086,2026-05-28T15:16:07Z,Meta Launches AI Subscriptions As Shares Jump More Than 3%,https://finance.yahoo.com/markets/stocks/articles/meta-launches-ai-subscriptions-shares-151607813.html,Meta introduced paid Meta AI tiers while expanding efforts to monetize AI investments beyond advertising.,finance.yahoo.com,"('Mark Zuckerberg', 'Meta Platforms', 'Stock', 'Technology')",2026-05-28T15:31:26.226835Z,"('meta',)"
96022105,2026-05-28T15:14:31Z,Meta Stock Pops After Meta Tests AI Chatbot Subscriptions,https://finance.yahoo.com/markets/stocks/articles/meta-stock-pops-meta-tests-151431746.html,Meta New Paid AI Push Sends Stock Soaring -- Wall Street Eyes Revenue Boom,finance.yahoo.com,"('Facebook Plus', 'Meta Ai', 'Meta Platforms', 'Stock', 'Technology')",2026-05-28T15:31:57.979011Z,"('meta',)"
96021395,2026-05-28T15:02:21Z,"Despite Hitting a $1 Trillion Valuation, Micron Remains My Favorite Stock for 2026",https://finance.yahoo.com/markets/stocks/articles/despite-hitting-1-trillion-valuation-150221362.html,"For years, investors treated memory-chip companies like airlines or steelmakers — cyclical businesses that boomed when supply tightened and collapsed when too many competitors flooded the market with inventory. That’s why what’s happening with Micron Technology (NASDAQ:MU) today feels so different. The company just crossed a $1 trillion valuation after a blistering rally, yet the ... Despite Hitting a $1 Trillion Valuation, Micron Remains My Favorite Stock for 2026",finance.yahoo.com,"('Consumer Cyclical', 'High-Bandwidth Memory', 'Infrastructure', 'Micron', 'Nvidia', 'Stock', 'Technology', 'Top 10 Ai Stocks')",2026-05-28T15:08:02.832270Z,"('amzn', 'goog', 'meta', 'msft', 'mu', 'nvda')"
96022938,2026-05-28T14:47:00Z,BABA vs. META: Which AI Data Center Giant Is the Better Bet?,https://www.zacks.com/stock/news/2928353/baba-vs-meta-which-ai-data-center-giant-is-the-better-bet?cid=CS-ZC-FT-analyst_blog%7Cmost_popular_stocks-2928353,,zacks.com,"('Analyst Blog', 'Consumer Cyclical', 'ETF', 'Stock', 'Technology')",2026-05-28T16:04:16.003952Z,"('baba', 'meta', 'meta', 'metv')"
96020289,2026-05-28T14:21:10Z,Mark Zuckerberg’s $145 Billion AI Gamble Could Spawn Meta’s Next Monster Business,https://finance.yahoo.com/sectors/technology/articles/mark-zuckerberg-145-billion-ai-142110842.html,"The artificial intelligence arms race has turned Silicon Valley into a spending contest. Meta Platforms (NASDAQ:META), Microsoft (NASDAQ:MSFT), Alphabet (NASDAQ:GOOG), and Amazon (NASDAQ:AMZN) are pouring hundreds of billions of dollars into chips, servers, networking gear, and data centers in a scramble to dominate AI infrastructure. The question investors are wrestling with is simple: how much ... Mark Zuckerberg’s $145 Billion AI Gamble Could Spawn Meta’s Next Monster Business",finance.yahoo.com,"('Amazon', 'Amazon Web Services', 'Cloud Computing', 'Consumer Cyclical', 'Mark Zuckerberg', 'Meta Platforms', 'Meta Stock', 'Microsoft', 'Microsoft Azure', 'Social Media Company', 'Stock', 'Technology', 'Top 10 Ai Stocks')",2026-05-28T14:33:57.723845Z,"('amzn', 'goog', 'googl', 'meta', 'msft', 'nvda')"
96019635,2026-05-28T14:11:56Z,Bitcoin drops out of the top 10 largest assets by market cap,https://finbold.com/bitcoin-drops-out-of-the-top-10-largest-assets-by-market-cap/,"Bitcoin has officially dropped out of the top 10 largest assets by market cap, now occupying spot number 13.",finbold.com,"('Bitcoin', 'Btc', 'Consumer Cyclical', 'Crypto', 'CryptoCurrency', 'ETF', 'Stock', 'Technology', 'Unknown Sector')",2026-05-28T14:13:34.287720Z,"('aapl', 'btc', 'btc', 'googl', 'meta', 'nvda', 'pifi', 'tsla')"
96017936,2026-05-28T13:14:35Z,Meta (META) Quietly Launches A New Social App,https://www.insidermonkey.com/blog/meta-meta-quietly-launches-a-new-social-app-1770282/,"On May 23, 2026, Morningstar reported that Meta Platforms, Inc. (NASDAQ:META) had quietly launched a new free app called Forum on Apple’s App Store without a public announcement.",insidermonkey.com,"('Industrials', 'Stock', 'Technology')",2026-05-28T13:16:06.073082Z,"('meta', 'morn')"
96018970,2026-05-28T13:14:35Z,Meta (META) Quietly Launches A New Social App,https://finance.yahoo.com/markets/stocks/articles/meta-meta-quietly-launches-social-131435111.html,"Meta Platforms, Inc. (NASDAQ:META) is one of the 10 Best Stocks in Steve Cohen’s Portfolio. On May 23, 2026, Morningstar reported that Meta Platforms, Inc. (NASDAQ:META) had quietly launched a new free app called Forum on Apple’s App Store without a public announcement. This new standalone iOS application, dedicated entirely to Facebook Groups, streamlines group […]",finance.yahoo.com,"('Inc.', 'Industrials', 'Meta Platforms', 'Stock', 'Technology')",2026-05-28T13:51:11.042993Z,"('meta', 'morn')"
96017530,2026-05-28T13:00:01Z,"Some AI mental health apps are harmful for kids, says report—what experts say parents should keep in mind",https://www.cnbc.com/2026/05/28/some-ai-mental-health-apps-have-an-unacceptable-rating-for-teens-says-report.html,The organization found that school-based mental health apps were safer than direct-to-consumer apps. ,cnbc.com,"('Alphabet Class A', 'ETF', 'Meta Platforms Inc', 'Stock', 'Technology')",2026-05-28T13:06:29.703007Z,"('googl', 'meta', 'meta', 'metv')"
96018363,2026-05-28T12:59:52Z,Meta vs. Alphabet: Which Stock Is The Better Buy Today,https://finance.yahoo.com/markets/stocks/articles/meta-vs-alphabet-stock-better-125952752.html,"Meta Platforms (NASDAQ: META) and Alphabet (NASDAQ: GOOG) both reported Q1 results on April 29, 2026, and the results frame a clear question. Both companies are pouring tens of billions into AI infrastructure, both ride enormous ad engines, yet only one is showing investors a second growth pillar already paying off. Ads Power Meta. Cloud ... Meta vs. Alphabet: Which Stock Is The Better Buy Today",finance.yahoo.com,"('Alphabet', 'ETF', 'Google Cloud', 'Meta', 'Meta Superintelligence Labs', 'Reality Labs', 'Stock', 'Technology')",2026-05-28T13:34:04.212336Z,"('goog', 'googl', 'meta', 'meta', 'metv', 'nvda')"
96017009,2026-05-28T12:49:37Z,Jim Cramer's top 10 things to watch in the stock market Thursday,https://www.cnbc.com/2026/05/28/jim-cramers-top-10-things-to-watch-in-the-stock-market-thursday.html,"Snowflake breaks out from the enterprise software group, Salesforce remains a beleaguered name.",cnbc.com,"('Breaking News: Markets', 'Consumer Cyclical', 'Consumer Discretionary', 'ETF', 'Industrials', 'Investment Strategy', 'Markets', 'Stock', 'Technology', 'Tiingo Top', 'Unknown Sector')",2026-05-28T12:55:35.022351Z,"('amzn', 'ba', 'cat', 'cmi', 'dell', 'dell', 'gev', 'googl', 'hpq', 'intc', 'meta', 'meta', 'metv', 'mod', 'mrvl', 'mu', 'nbis', 'pwr', 'skyy', 'snow', 'snow', 'soxx', 'wcld', 'xlk')"
96016839,2026-05-28T12:45:02.835000Z,Bezos Earth Fund Is Off Pace to Meet $10 BillionClimate GivingPledge,https://www.bloomberg.com/news/articles/2026-05-28/bezos-earth-fund-is-off-pace-to-meet-10-billion-climate-giving-pledge,,bloomberg.com,"('Consumer Cyclical', 'Stock', 'Technology', 'Tiingo Top')",2026-05-28T12:47:51.091022Z,"('amzn', 'meta')"
96017581,2026-05-28T12:28:01Z,Mark Zuckerberg Just Revealed Meta’s “Break In Case of Emergency” AI Plan,https://finance.yahoo.com/sectors/technology/articles/mark-zuckerberg-just-revealed-meta-122801007.html,"Eight days ago, I told you that Mark Zuckerberg’s smartest move was sitting in plain sight: rent out Meta’s excess AI compute the way SpaceX is renting its to Anthropic. My May 20 piece argued that SpaceX’s $1.25 billion per month Cloud Services Agreement with Anthropic, running through May 2029 with a 90-day termination clause, ... Mark Zuckerberg Just Revealed Meta’s “Break In Case of Emergency” AI Plan",finance.yahoo.com,"('Cloud Services', 'ETF', 'Mark Zuckerberg', 'Meta', 'Spacex', 'Stock', 'Technology')",2026-05-28T13:07:08.056651Z,"('meta', 'meta', 'metv', 'msft', 'nvda')"
96015262,2026-05-28T12:06:16Z,"Here are Thursday's biggest analyst calls: Nvidia, Tesla, Marvell, Broadcom, Dell, Dick's, Meta, Salesforce & more",https://www.cnbc.com/2026/05/28/biggest-analyst-calls-like-nvidia-thursday.html,Here are Thursday's biggest calls on Wall Street.,cnbc.com,"('Basic Materials', 'Breaking News: Investing', 'Breaking News: Markets', 'Consumer Cyclical', 'Consumer Discretionary', 'ETF', 'Industrials', 'Investment Strategy', 'Markets', 'Stock', 'Technology', 'Tiingo Top', 'Unknown Sector', 'Utilities')",2026-05-28T12:13:28.790016Z,"('absi', 'avgo', 'brcm', 'carg', 'dell', 'dell', 'dks', 'fdx', 'lyb', 'meta', 'meta', 'metv', 'mrvl', 'mu', 'nee', 'nhp', 'nvda', 'pwr', 'rmix', 'snow', 'snow', 'strl', 'tsla')"
96015191,2026-05-28T12:00:00.001000Z,Boston Seizes on California Billionaire Tax to Lure AI Talent,https://www.bloomberg.com/news/articles/2026-05-28/boston-seizes-on-california-billionaire-tax-to-lure-ai-talent,,bloomberg.com,"('Stock', 'Technology', 'Tiingo Top', 'Unknown Sector')",2026-05-28T12:09:27.797390Z,"('dkng', 'hubs', 'meta', 'uber')"
96014821,2026-05-28T11:35:54Z,"Is Meta Platforms, Inc. (META) Entering a New AI Growth Phase After Workforce Restructuring?",https://finance.yahoo.com/markets/stocks/articles/meta-platforms-inc-meta-entering-113554258.html,"We recently compiled a list of the 10 Most Widely Held Stocks by Individuals in 2026. Meta Platforms, Inc. (NASDAQ:META) is also among the most widely held stocks by individuals. TheFly reported on May 20 that META CEO Mark Zuckerberg informed employees that the company does not expect any additional broad layoffs for the remainder […]",finance.yahoo.com,"('Ai Stock', 'Data Protection', 'Global Workforce', 'Inc.', 'Individuals', 'Mark Zuckerberg', 'Meta Platforms', 'Stock', 'Technology')",2026-05-28T12:01:29.455645Z,"('meta',)"
96015573,2026-05-28T11:30:55Z,"WD Rutherford LLC Grows Stock Position in Meta Platforms, Inc. $META",https://www.thelincolnianonline.com/2026/05/28/wd-rutherford-llc-grows-stock-position-in-meta-platforms-inc-meta.html,"WD Rutherford LLC increased its holdings in shares of Meta Platforms, Inc. (NASDAQ:META – Free Report) by 35.5% during the 4th quarter, HoldingsChannel.com reports. The institutional investor owned 8,582 shares of the social networking company’s stock after purchasing an additional 2,248 shares during the quarter. Meta Platforms comprises about 2.4% of WD Rutherford LLC’s investment […]",thelincolnianonline.com,"('13F', '30303M10', 'Computer And Technology', 'ETF', 'Hedge Fund Holdings', 'Institutional Investor Holdings', 'Meta', 'Meta Platforms', 'Nasdaq:Meta', 'Sec Filings', 'Stock', 'Technology')",2026-05-28T12:21:23.532835Z,"('meta', 'meta', 'metv')"
96014027,2026-05-28T11:25:01.006000Z,"Ambani Says Reliance Evaluating ‘Strategic Pathways’ for Jio, No Word on IPO",https://www.bloomberg.com/news/articles/2026-05-28/ambani-says-reliance-evaluating-strategic-pathways-for-jio-no-word-on-ipo,,bloomberg.com,"('Stock', 'Technology', 'Tiingo Top')",2026-05-28T11:29:41.439993Z,"('googl', 'meta')"
96025377,2026-05-28T11:17:01Z,How Is Meta’s Stock Performance Compared to Other Internet Stocks?,https://finance.yahoo.com/markets/stocks/articles/meta-stock-performance-compared-other-111701807.html,"Meta has trailed behind the broader internet industry recently, but analysts are highly upbeat about its future prospects.",finance.yahoo.com,"('Artificial Intelligence', 'Digital Advertising', 'ETF', 'Facebook', 'Meta', 'Meta Stock', 'Stock', 'Technology')",2026-05-28T17:29:40.131058Z,"('goog', 'googl', 'meta', 'meta', 'metv')"
96013041,2026-05-28T10:52:07Z,"China AI Travel Curbs Reach Alibaba, DeepSeek: Private-Sector Researchers Need Beijing Approval",https://www.techtimes.com/articles/317325/20260528/china-ai-travel-curbs-reach-alibaba-deepseek-private-sector-researchers-need-beijing-approval.htm,"China AI travel restrictions now reach Alibaba and DeepSeek researchers, who need Beijing’s approval before any overseas trip — a control once reserved for nuclear scientists. Stanford’s 2026 AI Index shows the US-China performance gap has collapsed to 2.7%, explaining why Beijing now treats AI",techtimes.com,"('Ai Talent Controls', 'Alibaba', 'Artificial Intelligence', 'China', 'Consumer Cyclical', 'Deepseek', 'ETF', 'Huawei', 'Meta', 'National Security', 'Stock', 'Technology', 'Technology Policy', 'Unknown Sector', 'Us China Tech War')",2026-05-28T10:54:45.049600Z,"('002502', 'baba', 'meta', 'meta', 'metv', 'nvda')"
96012233,2026-05-28T10:11:04Z,"‘Do I still have a job?’ Webflow techie discovers possible layoff via locked laptop: No email, no warning, nothing",https://www.livemint.com/news/us-news/do-i-still-have-a-job-webflow-techie-discovers-possible-layoff-via-locked-laptop-no-email-no-warning-nothing-11779962488925.html,"Mark Willis, a Webflow employee, discovered his layoff when he was locked out of his laptop without any prior notice. He publicly addressed the situation on LinkedIn, tagging the CEO and expressing his disbelief.",livemint.com,"('Amazon Layoff', 'CryptoCurrency', 'ETF', 'Layoff', 'Layoffs', 'Meta', 'Meta Layoff', 'Microsoft Layoff', 'Reddit Layoff', 'Stock', 'Technology', 'The Layoff', 'Webflow', 'Webflow Layoff')",2026-05-28T10:11:44.865508Z,"('lnkd', 'meta', 'meta', 'metv')"
96012444,2026-05-28T10:00:00Z,Jensen Huang Just Gave AI Investors Great News,https://www.fool.com/investing/2026/05/28/jensen-huang-just-gave-ai-investors-great-news/?source=iedfolrf0000001,"Nvidia's CEO says that ""tokens are now profitable.""",fool.com,"('059A824B-Cc83-4B37-86Ca-89E6B7D74B1A', 'ETF', 'Investing', 'Meta', 'Nvda', 'Pltr', 'Stock', 'Technology', 'Technology And Telecom', 'Unknown Sector')",2026-05-28T10:24:48.910724Z,"('meta', 'meta', 'metv', 'nvda', 'pltr')"
