id,publishedDate,title,url,description,source,tags,crawlDate,tickers
96772466,2026-06-28T11:25:00Z,The OpenAI Trade Isn't Microsoft Anymore. Here's Where Smart Money May Be Looking.,https://www.fool.com/investing/2026/06/28/the-openai-trade-isnt-microsoft-anymore-heres-wher/?source=iedfolrf0000001,Microsoft is no longer the main character as investors await OpenAI's IPO.,fool.com,"('3Ed07320-Fe90-42Ba-9167-179D140E928B', 'Amd', 'Amzn', 'Avgo', 'Consumer Cyclical', 'ETF', 'Investing', 'Meta', 'Msft', 'Nvda', 'Stock', 'Technology', 'Technology And Telecom', 'Unknown Sector')",2026-06-28T11:54:35.242789Z,"('amd', 'amzn', 'amzn', 'avgo', 'avgo', 'meta', 'meta', 'meta', 'metv', 'msft', 'msft', 'nvda', 'nvda')"
96772536,2026-06-28T10:15:02Z,"OP Asset Management Ltd Makes New $238.94 Million Investment in Meta Platforms, Inc. $META",https://www.thelincolnianonline.com/2026/06/28/op-asset-management-ltd-makes-new-238-94-million-investment-in-meta-platforms-inc-meta.html,"OP Asset Management Ltd purchased a new stake in Meta Platforms, Inc. (NASDAQ:META – Free Report) during the first quarter, HoldingsChannel.com reports. The firm purchased 417,637 shares of the social networking company’s stock, valued at approximately $238,943,000. Meta Platforms accounts for 2.4% of OP Asset Management Ltd’s holdings, making the stock its 8th largest holding. […]",thelincolnianonline.com,"('13F', '30303M10', 'Computer And Technology', 'ETF', 'Financial Services', 'Hedge Fund Holdings', 'Institutional Investor Holdings', 'Meta', 'Meta Platforms', 'Nasdaq:Meta', 'Sec Filings', 'Stock', 'Technology', 'Unknown Sector')",2026-06-28T11:59:45.944021Z,"('bac', 'key', 'meta', 'meta', 'meta', 'metv', 'mhm', 'mpe', 'msft', 'wfc', 'wfc-ws')"
96771782,2026-06-28T09:50:00Z,Hold These 3 High-Yield Pipeline Stocks Forever and Let the Income Roll In,https://www.fool.com/investing/2026/06/28/hold-these-3-high-yield-pipeline-stocks-forever-an/?source=iedfolrf0000001,These three midstream leaders are income investors' dreams.,fool.com,"('01C8119E-0Aa4-4D77-Ad33-79198255523A', 'And Utilities', 'Consumer Cyclical', 'ETF', 'Enb', 'Energy', 'Epd', 'Et', 'Investing', 'Materials', 'Meta', 'Orcl', 'Stock', 'T', 'Technology', 'Tm', 'Unknown Sector')",2026-06-28T10:17:44.636104Z,"('enb', 'enb', 'epd', 'et', 'et', 'meta', 'meta', 'meta', 'metv', 'orcl', 'tm')"
96771818,2026-06-28T09:44:17Z,"Instagram wants to make algorithm customisation a core part of the app, not a buried setting",https://thenextweb.com/news/instagram-your-algorithm-central-experience-mosseri,"Adam Mosseri previewed new ways to access Your Algorithm, including pull-down menus and per-Reel buttons. The top user request remains: show us who we follow.",thenextweb.com,"('Apps', 'ETF', 'Meta', 'Social Media', 'Stock', 'Technology', 'Tiingo Top', 'Unknown Sector')",2026-06-28T10:20:19.381056Z,"('apps', 'apps', 'meta', 'meta', 'meta', 'metv')"
96771250,2026-06-28T09:14:00Z,3 Nuclear Stocks Worth Owning for the Entire Year as Power Demand Keeps Climbing,https://www.fool.com/investing/2026/06/28/3-nuclear-stocks-worth-owning-for-the-entire-year/?source=iedfolrf0000001,These nuclear energy stocks are sitting on generational growth opportunities. Buy them while you still can.,fool.com,"('Amzn', 'And Utilities', 'Basic Materials', 'Bwxt', 'Ccj', 'Ceg', 'Consumer Cyclical', 'ETF', 'Energy', 'F3E1888F-7033-4566-B212-73077A19C62B', 'Industrials', 'Investing', 'Materials', 'Meta', 'Stock', 'Technology', 'Unknown Sector', 'Utilities', 'Vst')",2026-06-28T09:41:45.433352Z,"('amzn', 'amzn', 'bwxt', 'ccj', 'ceg', 'ceg', 'meta', 'meta', 'meta', 'metv', 'vst', 'vst')"
96770977,2026-06-28T09:11:01.935000Z,The AI talent perk money can't buy,https://www.businessinsider.com/ai-talent-wars-google-deepmind-openai-anthropic-freedom-money-2026-6,"Everyone can pay AI engineers millions. The winners offer freedom, says Jason Lemkin, the ""Godfather of Saas.""",businessinsider.com,"('Ai', 'Anthropic', 'Careers', 'ETF', 'Financial Services', 'Google', 'Meta', 'Openai', 'Stock', 'Tech', 'Technology', 'Unknown Sector')",2026-06-28T09:12:14.857971Z,"('aaic', 'ai', 'ai', 'goog', 'googl', 'meta', 'meta', 'meta', 'metv', 'tech')"
96769859,2026-06-28T05:41:08Z,Google limits Meta’s use of its Gemini AI models: Report,https://www.livemint.com/technology/tech-news/google-limits-meta-s-use-of-its-gemini-ai-models-11782624880463.html,"Google has limited Meta's access to its Gemini AI models due to high demand. This has disrupted Meta's internal AI projects and affected other Google clients. Despite growing Google Cloud revenue, computing power constraints hindered further growth in the sector.",livemint.com,"('Computing Power', 'CryptoCurrency', 'ETF', 'Gemini Ai', 'Google', 'Meta', 'Online Advertising', 'Stock', 'Technology', 'Unknown Sector')",2026-06-28T05:42:28.955834Z,"('goog', 'googl', 'meta', 'meta', 'meta', 'metv')"
96769842,2026-06-28T05:23:02Z,"Google limits Meta’s use of its Gemini AI models, FT reports",https://finance.yahoo.com/technology/ai/articles/google-limits-meta-gemini-ai-052302903.html,"June 28 (Reuters) - Google has put limits on Meta’s use of its Gemini AI models after the social media company sought more computing capacity than the rival tech group could provide, the Financial",finance.yahoo.com,"('ETF', 'Google', 'Meta', 'Social Media Company', 'Stock', 'Technology', 'Unknown Sector')",2026-06-28T05:38:41.717029Z,"('goog', 'googl', 'meta', 'meta', 'meta', 'metv')"
96769843,2026-06-28T05:23:02Z,"Google limits Meta’s use of its Gemini AI models, FT reports",https://finance.yahoo.com/news/google-limits-meta-gemini-ai-052302903.html,"June 28 (Reuters) - Google has put limits on Meta’s use of its Gemini AI models after the social media company sought more computing capacity than the rival tech group could provide, the Financial",finance.yahoo.com,"('ETF', 'Google', 'Meta', 'Social Media Company', 'Stock', 'Technology', 'Unknown Sector')",2026-06-28T05:38:42.383166Z,"('goog', 'googl', 'meta', 'meta', 'meta', 'metv')"
96769841,2026-06-28T05:23:02Z,"Google limits Meta’s use of its Gemini AI models, FT reports",https://finance.yahoo.com/technology/ai/articles/google-limits-meta-gemini-ai-052302681.html,"Google has put limits on Meta’s use of its Gemini AI models after the ‌social media company sought more computing capacity than the ‌rival tech group could provide, the Financial Times reported on Sunday.  Google, owned ​by Alphabet, told Meta around March it could not meet the full Gemini capacity the company had sought to purchase, the newspaper said, adding that the shortfall disrupted and delayed some ‌of Meta’s internal ⁠AI projects.  Several other Google clients have also been affected, though to a lesser extent, according to ⁠the report.",finance.yahoo.com,"('ETF', 'Google', 'Meta', 'Social Media Company', 'Stock', 'Technology', 'Unknown Sector')",2026-06-28T05:38:41.070202Z,"('goog', 'googl', 'meta', 'meta', 'meta', 'metv')"
96769527,2026-06-28T04:15:07Z,Qualcomm (QCOM) Unveils AI Data Center Push With Meta Microsoft And Modular,https://finance.yahoo.com/technology/ai/articles/qualcomm-qcom-unveils-ai-data-041507851.html,"Qualcomm (NasdaqGS:QCOM) has outlined a broad AI data center plan that includes new partnerships with Meta and Microsoft. The company introduced its Dragonfly C1000 CPU and a new High Bandwidth Compute architecture for AI workloads. Qualcomm confirmed the acquisition of AI software company Modular to build an ecosystem that can compete with Nvidia’s CUDA. Qualcomm is best known for its smartphone processors, and the new AI data center push signals a wider focus on infrastructure and cloud...",finance.yahoo.com,"('Ai Data Center', 'Communication Services', 'Data Center', 'ETF', 'Hugging Face', 'Infrastructure', 'Meta', 'Microsoft', 'Modular', 'Nvidia', 'Qualcomm', 'Stock', 'Technology', 'Unknown Sector')",2026-06-28T04:42:25.254499Z,"('intc', 'iqnt', 'meta', 'meta', 'meta', 'metv', 'msft', 'nvda')"
96769106,2026-06-28T03:30:19Z,"Florida Lottery Fantasy 5, Cash Pop results for June 27, 2026",https://www.aol.com/news/florida-lottery-fantasy-5-cash-033019138.html,Check your tickets for Florida daily lottery draw games here.,aol.com,"('ETF', 'Fb', 'Florida Lottery', 'Stock', 'Technology', 'Unknown Sector', 'Winning Fantasy 5 Numbers', 'Winning Pick 3 Numbers', 'Winning Pick 4 Numbers')",2026-06-28T03:53:29.980551Z,"('fb', 'meta')"
96768642,2026-06-28T02:49:47Z,Meta's Astryx Gives AI Coding Agents a Design System They Can Actually Read,https://www.techtimes.com/articles/319202/20260627/metas-astryx-gives-ai-coding-agents-design-system-they-can-actually-read.htm,"Meta open-source React design system Astryx launched today in public beta, shipping a JSON manifest that works like an OpenAPI spec for its CLI — giving AI coding agents structured access to 90-plus components without scraping docs. Built on StyleX compile-time CSS and the Model Context Protocol,",techtimes.com,"('Ai Coding Agents', 'Astryx', 'Design System', 'ETF', 'Meta', 'Stock', 'Tech', 'Technology', 'Unknown Sector')",2026-06-28T02:51:39.114335Z,"('goog', 'googl', 'meta', 'meta', 'meta', 'metv', 'tech')"
96767907,2026-06-28T00:30:00Z,Wall Street Thinks AI Capex Is Unsustainable -- Here's Why Big Tech Keeps Spending Anyway,https://www.fool.com/investing/2026/06/27/wall-street-thinks-ai-capex-is-unsustainable-heres/?source=iedfolrf0000001,Is AI fatigue setting in?,fool.com,"('22E46Ce3-949F-424A-957C-980F5F2Dcb3C', 'Amzn', 'Consumer Cyclical', 'ETF', 'Goog', 'Googl', 'Investing', 'Meta', 'Msft', 'Mu', 'Stock', 'Technology', 'Technology And Telecom', 'Tiingo Top', 'Unknown Sector')",2026-06-28T00:52:37.472951Z,"('amzn', 'amzn', 'goog', 'goog', 'googl', 'meta', 'meta', 'meta', 'metv', 'msft', 'msft', 'mu', 'mu')"
96764015,2026-06-27T17:18:00Z,Where Will Nvidia Stock Be in 2030?,https://www.fool.com/investing/2026/06/27/where-will-nvidia-stock-be-in-2030/?source=iedfolrf0000001,The AI build-out turned the chipmaker into a giant -- but how much longer can the spending last?,fool.com,"('07C51Ebf-78F5-4519-9702-A8B0E6F99201', 'Amd', 'Amzn', 'Consumer Cyclical', 'ETF', 'Goog', 'Googl', 'Investing', 'Meta', 'Msft', 'Nvda', 'Stock', 'Technology', 'Technology And Telecom', 'Unknown Sector')",2026-06-27T17:43:50.142909Z,"('amd', 'amzn', 'amzn', 'goog', 'goog', 'googl', 'meta', 'meta', 'meta', 'metv', 'msft', 'msft', 'nvda', 'nvda')"
96763519,2026-06-27T16:39:52Z,The AI trade cooled and oil sank. A closer look at Wall Street's volatile week,https://www.cnbc.com/2026/06/27/the-ai-trade-cooled-and-oil-sank-a-closer-look-at-wall-streets-volatile-week.html,Micron finished the week in the red despite a blockbuster earnings report. But falling oil prices was good news for the fight against inflation.,cnbc.com,"('Basic Materials', 'Breaking News: Markets', 'Breaking News: Technology', 'Business', 'Computing', 'Consumer Cyclical', 'ETF', 'Healthcare', 'Industrials', 'Internet', 'Investment Strategy', 'Markets', 'Stock', 'Technology', 'Tiingo Top', 'Unknown Sector', 'Wireless')",2026-06-27T16:43:25.936550Z,"('aapl', 'aapl', 'amat', 'amat', 'amzn', 'amzn', 'arm', 'arm', 'avgo', 'avgo', 'cah', 'cat', 'cat', 'fdx', 'fdxf', 'glw', 'googl', 'hd', 'hxscl', 'ihf', 'intc', 'intc', 'iyt', 'jnj', 'jnj', 'lly', 'lly', 'lrcx', 'lrcx', 'meta', 'meta', 'meta', 'metv', 'msft', 'msft', 'mu', 'mu', 'nvda', 'nvda', 'shw', 'sndk', 'sndk', 'sndk', 'soxx', 'stx', 'unh', 'unh', 'wdc', 'wdc', 'xli', 'xlk', 'xsd', 'xtn')"
96762317,2026-06-27T14:45:54Z,Putting the social media genie back in the bottle will not be easy to do,https://www.scmp.com/opinion/article/3358617/putting-social-media-genie-back-bottle-will-not-be-easy-do,The determination around the world to crack down on the use of these platforms by children is a response to the mounting evidence of the harm it can do.,scmp.com,"('Anthony Albanese', 'Australia', 'Bbc', 'Brazil', 'Britain', 'British Government', 'Canada', 'Denmark', 'ETF', 'Facebook', 'France', 'Hong Kong', 'Instagram', 'John Lee Ka-Chiu', 'Malaysia', 'Meta', 'Stock', 'Technology', 'Unknown Sector')",2026-06-27T14:47:36.382872Z,"('meta', 'meta', 'meta', 'metv')"
96767257,2026-06-27T14:34:05Z,Meta’s USDC Creator Pay: Rails Beat Hype,https://cryptodaily.co.uk/2026/06/meta-creator-payouts-stablecoins-spending-rails,"Meta USDC payouts pilot spans Solana and Polygon, but off-ramps define success. Creators face wallet setup and cash‑out friction. A practical playbook.",cryptodaily.co.uk,"('Creator Economy', 'Cross-Border Payments', 'CryptoCurrency', 'ETF', 'Meta', 'Off-Ramps', 'Polygon', 'Solana', 'Spending Rails', 'Stablecoin Payouts', 'Stock', 'Technology', 'Unknown Sector', 'Usdc', 'Wallet Kyc')",2026-06-27T23:43:55.078477Z,"('meta', 'meta', 'meta', 'metv', 'usdc')"
96761966,2026-06-27T13:32:44Z,Meta Platforms (NASDAQ:META)  Shares Down 2.7%   – Here’s What Happened,https://www.thelincolnianonline.com/2026/06/27/meta-platforms-nasdaqmeta-shares-down-2-7-heres-what-happened.html,"Meta Platforms, Inc. (NASDAQ:META – Get Free Report) fell 2.7% on Thursday . The company traded as low as $540.18 and last traded at $542.87. Approximately 16,392,234 shares traded hands during trading, an increase of 1% from the average daily volume of 16,302,679 shares. The stock had previously closed at $557.67. Key Headlines Impacting Meta […]",thelincolnianonline.com,"('30303M10', 'Computer And Technology', 'ETF', 'Financial Services', 'Meta', 'Meta Platforms', 'Nasdaq:Meta', 'Stock', 'Stocks', 'Technicals', 'Technology', 'Unknown Sector')",2026-06-27T14:12:18.929097Z,"('barl', 'key', 'meta', 'meta', 'meta', 'metv', 'ms', 'msft', 'msk', 'mwg', 'mwo', 'mwr')"
96761471,2026-06-27T13:21:55Z,"Australia PM: ‘too many children on social media’, ban too easy to avoid",https://www.scmp.com/news/asia/australasia/article/3358615/australia-pm-too-many-children-social-media-ban-too-easy-avoid,"According to a British ‌study, 85 per cent of Australians aged 12 to 15 were still using social media three months after the ban took effect.",scmp.com,"('Anika Wells', 'Anthony Albanese', 'Australia', 'Britain', 'British Medical Journal', 'ETF', 'Esafety Commissioner', 'Facebook', 'Google', 'Instagram', 'Meta', 'Reddit', 'Snap', 'Snapchat', 'Stock', 'Technology', 'Tiktok', 'Unknown Sector', 'Youtube')",2026-06-27T13:23:57.187520Z,"('meta', 'meta', 'meta', 'metv', 'snap')"
96761445,2026-06-27T13:12:36Z,Alphabet burnishes one of its best weapons in the battle for AI supremacy,https://www.cnbc.com/2026/06/27/alphabet-burnishes-one-of-its-best-weapons-in-the-battle-for-ai-supremacy.html,The Google parent's homegrown silicon is a big advantage in the AI compute race.,cnbc.com,"('Breaking News: Markets', 'Consumer Cyclical', 'ETF', 'Financial Services', 'Investment Strategy', 'Markets', 'Stock', 'Technology', 'Tiingo Top', 'Unknown Sector')",2026-06-27T13:21:15.091350Z,"('amd', 'amzn', 'amzn', 'arm', 'arm', 'avgo', 'avgo', 'bx', 'bx', 'goog', 'googl', 'igv', 'intc', 'intc', 'meta', 'meta', 'meta', 'metv', 'msft', 'msft', 'nvda', 'nvda', 'skyy', 'skyy', 'soxx', 'xlk')"
96761265,2026-06-27T12:59:32Z,SpaceX stock has cooled. Hiring for jobs in the space economy hasn't,https://www.cnbc.com/2026/06/27/spacex-jobs-stem-careers-labor-economy.html,"The SpaceX IPO euphoria is over, but the bullish trend in space economy jobs remains in place within a labor market where many other sectors have slowed hiring.",cnbc.com,"('Aerospace And Defense Industry', 'Breaking News: Economy', 'ETF', 'Economy', 'Industrials', 'Jobs', 'Personnel', 'Space Industry', 'Stock', 'Technology', 'Tiingo Top', 'U.S. Economy', 'Unknown Sector')",2026-06-27T13:02:20.362513Z,"('fly', 'fly', 'googl', 'lmt', 'lmt', 'meta', 'meta', 'meta', 'metv', 'rklb', 'rtx', 'rtx', 'spcx', 'spcx')"
96761163,2026-06-27T12:42:57Z,Pinterest has taken a beating in recent years. This analyst thinks it's time to buy,https://www.cnbc.com/2026/06/27/pinterest-has-taken-a-beating-in-recent-years-this-analyst-thinks-its-time-to-buy.html,"Pinterest has been fallen 24% this year, but analysts are split whether to buy or sell this stock",cnbc.com,"('ETF', 'Investment Strategy', 'Stock', 'Stock Markets', 'Technology', 'Tiingo Top', 'Unknown Sector')",2026-06-27T12:48:20.718165Z,"('amc', 'meta', 'meta', 'meta', 'metv', 'pins', 'rddt', 'rddt', 'snap')"
96760981,2026-06-27T12:22:34Z,"Straight women can’t get enough of gay romance stories like ‘Heated Rivalry’ and ‘Red, White & Royal Blue’",https://www.cnbc.com/2026/06/27/heated-rivalry-red-white-royal-blue-rachel-reid-gay-romance-yaoi-mlm.html,"Women aren't the protagonists or love interests in a subgrenre of romance focused on gay men. Still, they're consuming these stories in droves.",cnbc.com,"('Breaking News: Business', 'Breaking News: Investing', 'Breaking News: Markets', 'Business', 'Consumer Cyclical', 'ETF', 'Entertainment', 'Financial Services', 'Investment Strategy', 'Life', 'Markets', 'Media', 'Movies', 'Publishing', 'Stock', 'Stock Markets', 'Technology', 'Television', 'Tiingo Top', 'Unknown Sector')",2026-06-27T12:27:33.939939Z,"('amzn', 'amzn', 'dis', 'dis', 'googl', 'life', 'life', 'life', 'lion', 'lion', 'lion', 'lion', 'meta', 'meta', 'meta', 'metv', 'nerd', 'nerd', 'nflx', 'nflx', 'sony', 'sony', 'wbd', 'wbd')"
96760332,2026-06-27T10:18:58Z,"Krilogy Financial LLC Buys 1,219 Shares of Meta Platforms, Inc. $META",https://www.thelincolnianonline.com/2026/06/27/krilogy-financial-llc-buys-1219-shares-of-meta-platforms-inc-meta.html,"Krilogy Financial LLC lifted its stake in Meta Platforms, Inc. (NASDAQ:META – Free Report) by 4.5% in the first quarter, according to the company in its most recent filing with the Securities and Exchange Commission. The institutional investor owned 28,145 shares of the social networking company’s stock after buying an additional 1,219 shares during the […]",thelincolnianonline.com,"('13F', '30303M10', 'Computer And Technology', 'ETF', 'Financial Services', 'Hedge Fund Holdings', 'Institutional Investor Holdings', 'Meta', 'Meta Platforms', 'Nasdaq:Meta', 'Sec Filings', 'Stock', 'Technology', 'Unknown Sector')",2026-06-27T11:56:56.262458Z,"('meta', 'meta', 'meta', 'metv', 'msft', 'rjd', 'rjf', 'stt')"
96759754,2026-06-27T10:15:00Z,2 Artificial Intelligence (AI) Stocks to Buy as Demand for Custom Chips Soars,https://www.fool.com/investing/2026/06/27/2-artificial-intelligence-ai-stocks-to-buy-as-dema/?source=iedfolrf0000001,It's not too late to invest in these high-flying stocks.,fool.com,"('8B111D98-177B-4465-B874-2C3Ae0C89474', 'Amzn', 'Avgo', 'Consumer Cyclical', 'ETF', 'Goog', 'Googl', 'Investing', 'Meta', 'Mrvl', 'Msft', 'Nvda', 'Stock', 'Technology', 'Technology And Telecom', 'Tiingo Top', 'Unknown Sector')",2026-06-27T10:38:45.159549Z,"('amzn', 'amzn', 'avgo', 'avgo', 'goog', 'goog', 'googl', 'meta', 'meta', 'meta', 'metv', 'mrvl', 'mrvl', 'msft', 'msft', 'nvda', 'nvda')"
96758489,2026-06-27T08:06:00Z,"The Sneaky Way SpaceX, Anthropic, and OpenAI Can Destroy the Trump Bull Market",https://www.fool.com/investing/2026/06/27/sneaky-way-spacex-anthropic-openai-destroy-trump/?source=iedfolrf0000001,Newly implemented rules can turn the tables on the artificial intelligence (AI)-driven bull market under President Donald Trump.,fool.com,"('73Eeff36-Ae41-4966-8850-6546Ee677F8B', 'ETF', 'Financial Services', 'Investing', 'Meta', 'Ndaq', 'Nvda', 'Spcx', 'Stock', 'Technology', 'Technology And Telecom', 'Tfc', 'Unknown Sector', '^Dji', '^Gspc', '^Ixic')",2026-06-27T08:47:50.201780Z,"('meta', 'meta', 'meta', 'metv', 'ndaq', 'nvda', 'nvda', 'spcx', 'spcx', 'tfc')"
96755984,2026-06-27T02:30:00Z,Can Meta's New $300 Glasses Turn Around the Stock?,https://www.fool.com/investing/2026/06/26/can-metas-new-300-glasses-turn-around-the-stock/?source=iedfolrf0000001,Meta just rolled out its cheapest pair of smart glasses yet. Will it make a difference?,fool.com,"('Amzn', 'C8A9Aa92-Edcc-4E68-A449-C97C6564E6B1', 'Consumer Cyclical', 'ETF', 'Goog', 'Googl', 'Investing', 'Meta', 'Msft', 'Stock', 'Technology', 'Technology And Telecom', 'Unknown Sector')",2026-06-27T03:00:59.121584Z,"('amzn', 'amzn', 'goog', 'goog', 'googl', 'meta', 'meta', 'meta', 'metv', 'msft', 'msft')"
96755415,2026-06-27T01:31:00Z,"Qualcomm Just Nearly Doubled Its Most Important Growth Target, Confirming Its Place as a Key AI Stock",https://www.fool.com/investing/2026/06/26/qualcomm-just-nearly-doubled-its-most-important-gr/?source=iedfolrf0000001,Can a company still known for smartphone chips really become a force in the data center?,fool.com,"('147D3B00-Db58-4B33-9529-1Cb0A7171Dba', 'Aapl', 'ETF', 'Investing', 'Meta', 'Nvda', 'Qcom', 'Stock', 'Technology', 'Technology And Telecom', 'Unknown Sector')",2026-06-27T02:00:39.953632Z,"('aapl', 'aapl', 'meta', 'meta', 'meta', 'metv', 'nvda', 'nvda', 'qcom', 'qcom')"
96755188,2026-06-27T01:30:52Z,Best of the Week: WhatsApp gets a new boss. India gets the spotlight,https://www.livemint.com/newsletters/best-of-the-week-whatsapp-gets-a-new-boss-india-gets-the-spotlight-11782482516239.html,"What's the government's backup plan for a week monsoon? How a rule tweak by the RBI saved Tata Sons an IPO. And, Indian millionaires' new investment targets - inspired by SpaceX",livemint.com,"(""Best Of Mint'S Work"", 'Best Of The Week', 'Cred', 'CryptoCurrency', 'ETF', 'India', 'Kunal Shah', 'Meta', 'Stock', 'Technology', 'Unknown Sector', 'Whatsapp')",2026-06-27T01:33:41.562211Z,"('cred', 'cred', 'cred', 'meta', 'meta', 'meta', 'metv')"
96753102,2026-06-26T22:52:00Z,OpenAI Is Building Its Own AI Chip With Broadcom. Should Nvidia Investors Be Worried?,https://www.fool.com/investing/2026/06/26/openai-is-building-its-own-ai-chip-with-broadcom-s/?source=iedfolrf0000001,A custom chip from the maker of ChatGPT takes aim at the AI chip leader's pricing power -- but maybe not its crown.,fool.com,"('1Ffe743A-B13A-4954-Ae4D-4695851E537E', 'Avgo', 'ETF', 'Goog', 'Googl', 'Investing', 'Meta', 'Nvda', 'Stock', 'Technology', 'Technology And Telecom', 'Tiingo Top', 'Unknown Sector')",2026-06-26T23:16:12.982742Z,"('avgo', 'avgo', 'brcm', 'goog', 'goog', 'googl', 'meta', 'meta', 'meta', 'metv', 'nvda', 'nvda')"
96751742,2026-06-26T22:08:09Z,China's Zhipu is closing in on top U.S. AI models with Anthropic and OpenAI held back,https://www.cnbc.com/2026/06/26/china-zhipu-z-ai-open-source-anthropic-openai.html,"Zhipu's GLM 5.2 shows the AI fight is shifting to who delivers the most intelligence per dollar, making open source suddenly a real contender.",cnbc.com,"('Breaking News: Technology', 'Business', 'China', 'Computing', 'Consumer Cyclical', 'ETF', 'Enterprise', 'Financials', 'Internet', 'Software', 'Stock', 'Technology', 'Unknown Sector', 'Wireless')",2026-06-26T22:18:19.925805Z,"('amzn', 'amzn', 'crm', 'dell', 'dell', 'fig', 'fig', 'fig', 'fig', 'googl', 'meta', 'meta', 'meta', 'metv', 'msft', 'msft', 'mu', 'mu', 'nflx', 'nflx', 'nvda', 'nvda', 'obdc', 'orcl', 'pins', 'shop', 'shop', 'spot', 'spot')"
96751261,2026-06-26T21:31:01Z,"Zuckerberg asks Meta to explore working with Polymarket and Kalshi, NYT reports",https://finance.yahoo.com/technology/articles/zuckerberg-asks-meta-explore-working-213101350.html,"Meta CEO Mark Zuckerberg has urged his lieutenants to explore partnerships with the popular prediction markets ‌Polymarket and Kalshi as his company builds a similar ‌app, the New York Times said on Friday, citing three employees with knowledge ​of the matter.  Meta and Kalshi did not immediately respond to requests for comment, while Polymarket declined to comment when contacted by Reuters.  The social media company's executives ‌have said Arena, Meta's ⁠new prediction market app under development, will differ from Polymarket and Kalshi, which accept real-money wagers, because ⁠it will instead rely on video-game-like ""points"", the report said.",finance.yahoo.com,"('ETF', 'Kalshi', 'Mark Zuckerberg', 'Meta', 'Polymarket', 'Social Media Company', 'Stock', 'Technology', 'Unknown Sector')",2026-06-26T21:52:05.514534Z,"('meta', 'meta', 'meta', 'metv')"
96750402,2026-06-26T21:15:07Z,Qualcomm Closes $3.9 Billion Modular Deal: Meta Validates Full-Stack CUDA Challenge,https://www.techtimes.com/articles/319166/20260626/qualcomm-closes-39-billion-modular-deal-meta-validates-full-stack-cuda-challenge.htm,"Qualcomm Modular acquisition: Qualcomm confirmed a $3.92 billion all-stock deal to buy AI software startup Modular, paired with a Meta Platforms CPU partnership at the same Investor Day. Modular built its MAX compiler without any Nvidia vendor libraries — a structural first among CUDA challengers —",techtimes.com,"('Business Tech', 'Communication Services', 'Cuda', 'ETF', 'Financial Services', 'Full-Stack Cuda Challenge', 'Meta', 'Qualcomm', 'Stock', 'Technology', 'Tiingo Top', 'Unknown Sector')",2026-06-26T21:17:53.234887Z,"('bcs', 'cuda', 'goog', 'googl', 'intc', 'iqnt', 'meta', 'meta', 'meta', 'metv', 'nvda', 'qcom')"
96750193,2026-06-26T19:56:05Z,META announces community development regional manager position for El Paso,https://www.aol.com/news/meta-announces-community-development-regional-195605310.html,"EL PASO, Texas (KTSM) – After months of requests for an interview, META spoke with KTSM 9 News about its data center project in Northeast El Paso and about an announcement of a new position made to provide a connection with the community. META’s public policy Director, Ana Martinez, shared some details about a “community […]",aol.com,"('Ana Martinez', 'Community Development', 'Community Regional Development Manager', 'ETF', 'Ktsm', 'Meta', 'Northeast El Paso', 'Public Policy Director', 'Stock', 'Technology', 'Unknown Sector')",2026-06-26T21:10:49.513828Z,"('ep', 'meta', 'meta', 'meta', 'metv')"
