id,publishedDate,title,url,description,source,tags,crawlDate,tickers
96914005,2026-07-02T23:52:04.159000Z,Alexandr Wang says Meta's coming AI has caught up with OpenAI's flagship model,https://www.businessinsider.com/meta-ai-model-catches-up-openai-gpt-5-says-2026-7,Meta's superintelligence chief says its upcoming Watermelon model now matches GPT-5.5 on key AI benchmarks.,businessinsider.com,"('Ai', 'ETF', 'Exclusive', 'Financial Services', 'Generative Ai', 'Meta', 'Openai', 'Stock', 'Tech', 'Technology', 'Unknown Sector')",2026-07-02T23:54:27.600823Z,"('aaic', 'ai', 'ai', 'goog', 'googl', 'meta', 'meta', 'meta', 'metv', 'tech')"
96915095,2026-07-02T23:52:04Z,Alexandr Wang says Meta's coming AI has caught up with OpenAI's flagship model,https://www.aol.com/news/alexandr-wang-says-metas-coming-235204979.html,Meta's superintelligence chief says its upcoming Watermelon model now matches GPT-5.5 on key AI benchmarks.,aol.com,"('Alexandr Wang', 'ETF', 'Financial Services', 'Mark Zuckerberg', 'Meta', 'Openai', 'Stock', 'Technology', 'Unknown Sector')",2026-07-03T00:45:59.478909Z,"('aaba', 'goog', 'googl', 'meta', 'meta', 'meta', 'metv', 'yhoo')"
96914003,2026-07-02T23:27:30Z,My 12 Top Ranked Stocks to Buy Right Now in July (2026),https://www.fool.com/investing/2026/07/02/my-12-top-ranked-stocks-to-buy-right-now-in-july-2/?source=iedfolrf0000001,"Whether you're looking for semiconductor stocks, growth stocks, or dividend stocks, there is something for everyone in this excellent list.",fool.com,"('0A43999E-E3Af-47Af-8Fc2-9018A81Bae02', 'Adbe', 'Amzn', 'Consumer Cyclical', 'ETF', 'Investing', 'Lulu', 'Mcd', 'Meta', 'Msft', 'Nflx', 'Nvda', 'Pins', 'Stock', 'Technology', 'Technology And Telecom', 'Ttd', 'Uber', 'Unknown Sector', 'V')",2026-07-02T23:54:41.874344Z,"('adbe', 'adbe', 'amzn', 'amzn', 'lulu', 'lulu', 'mcd', 'meta', 'meta', 'meta', 'metv', 'msft', 'msft', 'nflx', 'nflx', 'nvda', 'nvda', 'pins', 'ttd', 'uber', 'uber')"
96911594,2026-07-02T22:13:05.391000Z,Mark Zuckerberg said that Meta's AI progress has been slower than expected in an internal town hall,https://www.businessinsider.com/zuckerberg-said-metas-ai-progress-has-been-slower-than-expected-2026-7,"Superintelligence will take time, Zuckerberg tells Meta staff, as the company makes its AI training program opt-in after a data leak.",businessinsider.com,"('Ai', 'Artificial Intelligence', 'ETF', 'Financial Services', 'Mark Zuckerberg', 'Meta', 'Stock', 'Tech', 'Technology', 'Unknown Sector')",2026-07-02T22:15:37.302634Z,"('aaic', 'ai', 'ai', 'meta', 'meta', 'meta', 'metv', 'tech')"
96911225,2026-07-02T22:01:05.726272Z,A Look at Meta Platforms Inc (META) After 4.9% Decline -- GF Value $812.66 vs Price $582.88,https://www.gurufocus.com/news/8943649/a-look-at-meta-platforms-inc-meta-after-49-decline-gf-value-81266-vs-price-58288,,gurufocus.com,"('ETF', 'Stock', 'Technology', 'Unknown Sector')",2026-07-02T22:01:06.081474Z,"('meta', 'meta', 'meta', 'metv')"
96911238,2026-07-02T21:55:59Z,Meta (META) CEO Acknowledges AI Development Challenges Amid Workforce Changes,https://www.gurufocus.com/news/8943596/meta-meta-ceo-acknowledges-ai-development-challenges-amid-workforce-changes,,gurufocus.com,"('ETF', 'Stock', 'Technology', 'Unknown Sector')",2026-07-02T22:01:11.049070Z,"('meta', 'meta', 'meta', 'metv')"
96910476,2026-07-02T21:06:00Z,Intel Stock Fell 9% in a Day After Soaring About 270% in the First Half. Buy the Dip Before July 23?,https://www.fool.com/investing/2026/07/02/intel-stock-fell-9-in-a-day-after-soaring-about-27/?source=iedfolrf0000001,The chipmaker's massive rerating just met its first serious stress test.,fool.com,"('Aapl', 'Communication Services', 'E60121Db-4792-4A46-807C-8Ed1E834B0Eb', 'ETF', 'Intc', 'Investing', 'Meta', 'Nvda', 'Stock', 'Technology', 'Technology And Telecom', 'Tsm', 'Unknown Sector')",2026-07-02T21:30:55.964954Z,"('aapl', 'aapl', 'intc', 'intc', 'iqnt', 'meta', 'meta', 'meta', 'metv', 'nvda', 'nvda', 'tsm')"
96906496,2026-07-02T18:36:05Z,Meta Eyes Cloud Business for AI Capacity,https://www.gurufocus.com/news/8942892/meta-eyes-cloud-business-for-ai-capacity,,gurufocus.com,"('ETF', 'Stock', 'Technology', 'Unknown Sector')",2026-07-02T19:00:43.144013Z,"('meta', 'meta', 'meta', 'metv')"
96906362,2026-07-02T18:33:22Z,Mark Zuckerberg Almost Made a Disastrous Acquisition. Walking Away From Kalshi May Have Been His Best Bet of 2026.,https://finance.yahoo.com/technology/articles/mark-zuckerberg-almost-made-disastrous-183322319.html,"Mark Zuckerberg just dodged a bullet. Zuckerberg, whom speculators give 32% odds of becoming the next trillionaire, came eerily close to steering Meta Platforms (NASDAQ:META) into one of the most legally and ethically fraught corners of consumer tech. According to NPR reporting from June 30, Zuckerberg personally floated an acquisition of prediction market platform Kalshi. ... Mark Zuckerberg Almost Made a Disastrous Acquisition. Walking Away From Kalshi May Have Been His Best Bet of 2026.",finance.yahoo.com,"('ETF', 'Kalshi', 'Meta', 'Meta Compute', 'Stock', 'Technology', 'Unknown Sector', 'Zuckerberg')",2026-07-02T18:57:13.858663Z,"('meta', 'meta', 'meta', 'metv', 'nvda')"
96904870,2026-07-02T18:00:08Z,"Telegram, Signal asked by IT Ministry to explain anti-fraud measures in username features after WhatsApp notice",https://www.livemint.com/news/india/telegram-signal-asked-by-it-ministry-to-explain-anti-fraud-measures-in-username-features-after-whatsapp-notice-11783012871653.html,"The government has sought explanations from these platforms on how they are addressing risks of fraud, impersonation, and misuse associated with usernames that enable users to connect without sharing phone numbers.",livemint.com,"('CryptoCurrency', 'Cybercrime', 'Digital Arrest Scams', 'ETF', 'Encrypted Messaging Apps', 'Identity Spoofing', 'Impersonation', 'India Government Notice', 'Meity', 'Meta', 'Ministry Of Electronics And It', 'Online Fraud', 'Signal', 'Stock', 'Technology', 'Telegram', 'Unknown Sector', 'Username Feature', 'Whatsapp', 'Whatsapp Username Feature')",2026-07-02T18:01:20.948691Z,"('meta', 'meta', 'meta', 'metv', 'sgnl')"
96905632,2026-07-02T17:48:00Z,Report: Meta Mulled Kalshi Purchase Before Opting to Develop Own Prediction Market App,https://finance.yahoo.com/technology/ai/articles/report-meta-mulled-kalshi-purchase-174800013.html,Mark Zuckerberg reportedly discussed acquiring Kalshi in 2025 before Meta shifted to developing an in-house platform.,finance.yahoo.com,"('ETF', 'Kalshi', 'Mark Zuckerberg', 'Meta', 'Prediction Market', 'Stock', 'Technology', 'Unknown Sector')",2026-07-02T18:26:35.500492Z,"('goog', 'googl', 'meta', 'meta', 'meta', 'metv')"
96904540,2026-07-02T17:44:06Z,GE Vernova's gas turbines aren't the only way it's winning from the AI boom,https://www.cnbc.com/2026/07/02/ge-vernovas-gas-turbines-arent-the-only-way-its-winning-from-the-ai-boom.html,"Electrification secured $2.4 billion in data center equipment orders during the first quarter of 2026, beating the segment's total for all of 2025.",cnbc.com,"('Breaking News: Markets', 'Consumer Cyclical', 'ETF', 'Energy', 'Investment Strategy', 'Markets', 'Stock', 'Technology', 'Tiingo Top', 'Unknown Sector')",2026-07-02T17:47:24.854029Z,"('amzn', 'amzn', 'cvx', 'ge', 'gev', 'gev', 'googl', 'grid', 'grid', 'ifra', 'meta', 'meta', 'meta', 'metv', 'msft', 'msft', 'qcln', 'qcln', 'qqq', 'qqq', 'tan', 'xli')"
96905024,2026-07-02T17:39:57Z,Price Prediction: Meta Stock Will Hit $900 on This Date,https://finance.yahoo.com/markets/stocks/articles/price-prediction-meta-stock-hit-173957774.html,"Meta Platforms (NASDAQ:META | META Price Prediction) is the AI story hiding in plain sight. The stock trades at $612.91, down 6.99% year to date, while the underlying business just posted 33% revenue growth and a 41% operating margin. Mark Zuckerberg told investors “we are on track to build a leading lab” after releasing Muse ... Price Prediction: Meta Stock Will Hit $900 on This Date",finance.yahoo.com,"('ETF', 'Eps Estimates', 'Meta', 'Reality Labs', 'Revenue Growth', 'Stock', 'Stock Trades', 'Technology', 'Unknown Sector')",2026-07-02T18:04:42.299514Z,"('meta', 'meta', 'meta', 'metv', 'nvda')"
96903913,2026-07-02T17:30:40.713423Z,Meta (META) Explores Cloud Computing Amidst Stock Surge,https://www.gurufocus.com/news/8943403/meta-meta-explores-cloud-computing-amidst-stock-surge,,gurufocus.com,"('ETF', 'Stock', 'Technology', 'Unknown Sector')",2026-07-02T17:30:41.090416Z,"('meta', 'meta', 'meta', 'metv')"
96904400,2026-07-02T17:15:16Z,"Senior Analyst: Meta Is Chasing A $2 Trillion AI Compute Opportunity, But It’s Years Behind",https://finance.yahoo.com/technology/ai/articles/senior-analyst-meta-chasing-2-171516070.html,"Jefferies Senior Internet Analyst Brent Thill recently appeared on a CNBC Squawk Box segment to argue that Meta Platforms (NASDAQ:META) is making the right strategic move by entering the enterprise AI infrastructure market, even if it’s arriving years after established competitors. Meta’s planning to launch a cloud infrastructure business selling excess AI computing capacity, sending ... Senior Analyst: Meta Is Chasing A $2 Trillion AI Compute Opportunity, But It’s Years Behind",finance.yahoo.com,"('Amazon', 'Brent Thill', 'Cloud Infrastructure', 'ETF', 'Meta', 'Stock', 'Technology', 'Unknown Sector')",2026-07-02T17:43:39.737684Z,"('goog', 'googl', 'meta', 'meta', 'meta', 'metv', 'msft', 'nvda')"
96903756,2026-07-02T17:10:55Z,"Meta Wants to Sell You Its AI Compute. AWS, Azure, and Google Just Got a New Rival",https://finance.yahoo.com/technology/ai/articles/meta-wants-sell-ai-compute-171055420.html,"The most expensive infrastructure buildout in corporate history just found a possible second act. On Wednesday, CNBC’s Julia Boorstin reported that “Sources close to the situation do confirm that META is working on building a cloud infrastructure business to sell AI compute.” The stock responded, jumping 7.56% on July 1 as investors digested the idea ... Meta Wants to Sell You Its AI Compute. AWS, Azure, and Google Just Got a New Rival",finance.yahoo.com,"('Business Line', 'Consumer Cyclical', 'ETF', 'Google Cloud', 'Meta', 'Nvidia', 'Stock', 'Technology', 'Top 10 Ai Stocks', 'Unknown Sector')",2026-07-02T17:24:46.198539Z,"('amzn', 'goog', 'googl', 'meta', 'meta', 'meta', 'metv', 'msft', 'nvda')"
96902809,2026-07-02T16:23:00Z,CoreWeave and Nebius Plunged 14% and 17% in a Single Day. Which Beaten-Down AI Cloud Stock Is the Better Rebound Bet?,https://www.fool.com/investing/2026/07/02/coreweave-and-nebius-plunged-14-and-17-in-a-single/?source=iedfolrf0000001,The most concerning part of Wednesday's sell-off wasn't the size of the drops -- it was who caused them.,fool.com,"('B1F22269-E589-4Aeb-8De4-5Fe357Ed5C6D', 'Crwv', 'ETF', 'Investing', 'Meta', 'Nbis', 'Nvda', 'Stock', 'Technology', 'Technology And Telecom', 'Unknown Sector')",2026-07-02T16:51:49.933926Z,"('crwv', 'crwv', 'meta', 'meta', 'meta', 'metv', 'nbis', 'nvda', 'nvda')"
96904016,2026-07-02T16:14:00Z,META's Bets on Privacy to Expand WhatsApp's Growth: What's Ahead?,https://www.zacks.com/stock/news/2947232/meta-s-bets-on-privacy-to-expand-whatsapp-s-growth-what-s-ahead?cid=CS-ZC-FT-analyst_blog%7Cquick_take-2947232,,zacks.com,"('Analyst Blog', 'Consumer Cyclical', 'ETF', 'Stock', 'Technology', 'Unknown Sector')",2026-07-02T17:32:34.726824Z,"('amzn', 'amzn', 'googl', 'meta', 'meta', 'meta', 'metv')"
96902767,2026-07-02T16:13:52Z,Meta Makes Cloud Play To Sell Excess AI,https://finance.yahoo.com/technology/ai/articles/meta-makes-cloud-play-sell-161352717.html,"Meta's AI cloud expansion boosts investor sentiment, but threatens neocloud rivals, reshaping competition, partnerships, and AI infrastructure markets globally.",finance.yahoo.com,"('Cloud Service', 'Coreweave', 'ETF', 'Facebook', 'Meta', 'Stock', 'Technology', 'Unknown Sector')",2026-07-02T16:50:53.622242Z,"('meta', 'meta', 'meta', 'metv', 'msft', 'nbis', 'nvda')"
96901753,2026-07-02T16:13:52Z,Meta Makes Cloud Play To Sell Excess AI,https://www.forbes.com/sites/johnwerner/2026/07/02/meta-makes-cloud-play-to-sell-excess-ai/,"Meta's AI cloud expansion boosts investor sentiment, but threatens neocloud rivals, reshaping competition, partnerships, and AI infrastructure markets globally.

",forbes.com,"('Ai', 'Coreweave', 'ETF', 'Financial Services', 'Linkedin', 'Meta', 'Nebius', 'Stock', 'Technology', 'Unknown Sector')",2026-07-02T16:16:13.865565Z,"('aaic', 'ai', 'ai', 'meta', 'meta', 'meta', 'metv')"
96901611,2026-07-02T16:05:59.463000Z,Meta is rolling out a new app with a social feed of vibe-coded mini games,https://www.businessinsider.com/meet-meta-new-vibe-coding-app-pocket-gizmo-ai-games-2026-7,"Pocket is a new app from Meta that lets you create and share interactive content, like mini games, with friends. It's powered by Meta's AI.",businessinsider.com,"('Ai', 'Apps', 'ETF', 'Exclusive', 'Financial Services', 'Media', 'Meta', 'Stock', 'Tech', 'Technology', 'Unknown Sector')",2026-07-02T16:10:14.964441Z,"('aaic', 'ai', 'ai', 'apps', 'apps', 'goog', 'googl', 'meta', 'meta', 'meta', 'metv', 'tech')"
96904049,2026-07-02T16:02:00Z,Meta Platforms (META) Surges 8.8%: Is This an Indication of Further Gains?,https://www.zacks.com/stock/news/2947191/meta-platforms-meta-surges-8-8-is-this-an-indication-of-further-gains?cid=CS-ZC-FT-tale_of_the_tape%7Cdaily_price_change_3%25-2947191,,zacks.com,"('ETF', 'Stock', 'Tale Of The Tape', 'Technology', 'Unknown Sector')",2026-07-02T17:32:44.685830Z,"('meta', 'meta', 'meta', 'metv', 'nice')"
96901139,2026-07-02T16:00:52.576141Z,Meta's Cloud Business Plans Spark Analyst Optimism (META),https://www.gurufocus.com/news/8943318/metas-cloud-business-plans-spark-analyst-optimism-meta,,gurufocus.com,"('ETF', 'Stock', 'Technology', 'Unknown Sector')",2026-07-02T16:00:52.938636Z,"('meta', 'meta', 'meta', 'metv')"
96904772,2026-07-02T15:30:51Z,Meta's possible move into cloud computing may point to a bursting AI infrastructure bubble,https://finance.yahoo.com/technology/ai/articles/metas-possible-move-cloud-computing-153051722.html,This space for rent.,finance.yahoo.com,"('Ai Infrastructure', 'ETF', 'Excess Capacity', 'Meta', 'Stock', 'Technology', 'Unknown Sector')",2026-07-02T17:55:56.722718Z,"('meta', 'meta', 'meta', 'metv')"
96900061,2026-07-02T15:00:12Z,Why Meta Platforms Stock Crashed Thursday Morning,https://www.fool.com/investing/2026/07/02/why-meta-platforms-stock-crashed-thursday-morning/?source=iedfolrf0000001,The company's proposed new business line could require costly capital outlays.,fool.com,"('21618793-92Ad-4573-Af98-91230Cd56219', 'Amzn', 'Consumer Cyclical', 'Crwv', 'ETF', 'Goog', 'Googl', 'Investing', 'Meta', 'Msft', 'Nbis', 'Stock', 'Technology', 'Technology And Telecom', 'Unknown Sector')",2026-07-02T15:25:33.086182Z,"('amzn', 'amzn', 'crwv', 'crwv', 'goog', 'goog', 'googl', 'meta', 'meta', 'meta', 'metv', 'msft', 'msft', 'nbis')"
96906713,2026-07-02T14:47:06Z,Anthropic’s Fable model is back. But U.S. AI policy is still a mess,https://fortune.com/2026/07/02/anthropic-fable-and-mythos-are-restored-but-us-ai-policy-is-still-a-mess/,The U.S. government lifted export controls on Anthropic's Fable and Mythos models. But it has not created transparent rules for future AI model releases.,fortune.com,"('Anthropic', 'Cyber', 'Donald Trump', 'ETF', 'Eye On Ai', 'Meta', 'Open Source', 'Openai', 'Stock', 'Tech Regulation', 'Technology', 'Unknown Sector')",2026-07-02T19:08:28.787095Z,"('meta', 'meta', 'meta', 'metv')"
96898404,2026-07-02T14:36:22.871000Z,"CMOs need to show results, but they also need inspire their brand and teams, says Meta's Alex Schultz",https://www.businessinsider.com/meta-alex-schultz-cannes-lions-2026-7,"Meta's Alex Schultz said that some brands will never use AI for creative work, but most will use some, calibrated to their community and message.",businessinsider.com,"('Advertising', 'ETF', 'Marketing', 'Meta', 'Stock', 'Technology', 'Tiingo Top', 'Unknown Sector')",2026-07-02T14:39:12.725208Z,"('meta', 'meta', 'meta', 'metv')"
96898001,2026-07-02T14:30:36.592855Z,Meta Faces India Delay on WhatsApp Feature for 600 Million Users,https://www.gurufocus.com/news/8942717/meta-faces-india-delay-on-whatsapp-feature-for-600-million-users,,gurufocus.com,"('ETF', 'India', 'Stock', 'Technology', 'Unknown Sector')",2026-07-02T14:30:36.980736Z,"('meta', 'meta', 'meta', 'metv')"
96898964,2026-07-02T14:21:47Z,Why Meta Can Outmuscle its Hyperscaler Peers in the Great AI Buildout,https://finance.yahoo.com/technology/ai/articles/why-meta-outmuscle-hyperscaler-peers-142147675.html,"It’s official, Meta Platforms (NASDAQ:META) is getting into the business of selling extra AI compute to others. The big news sent shares of the social-media and AI fast-mover up close to 9% in a single session of trade. While shares were incredibly cheap going into the session, the news shouldn’t have come as such a ... Why Meta Can Outmuscle its Hyperscaler Peers in the Great AI Buildout",finance.yahoo.com,"('ETF', 'Meta', 'Meta Compute', 'Stock', 'Technology', 'Top 10 Ai Stocks', 'Unknown Sector', 'Zuckerberg')",2026-07-02T14:54:22.939633Z,"('meta', 'meta', 'meta', 'metv', 'nbis', 'nvda')"
96897386,2026-07-02T14:06:19Z,What's behind the volatility in memory chip stocks this week?,https://www.cnbc.com/2026/07/02/whats-behind-the-volatility-in-memory-chip-stocks-this-week.html,New chip designs suited to query response are gaining a foothold.,cnbc.com,"('ETF', 'Investment Strategy', 'Stock', 'Stock Markets', 'Technology', 'Tiingo Top', 'Unknown Sector')",2026-07-02T14:12:09.627635Z,"('cbrs', 'meta', 'meta', 'meta', 'metv', 'mu', 'mu', 'soxx')"
96896682,2026-07-02T13:41:03Z,Meta's Stock Jumped After Announcing a New Business Venture. But Analysts Warn There Is a Caveat,https://www.ibtimes.com/metas-stock-jumped-after-announcing-new-business-venture-analysts-warn-there-caveat-3804820,Analysts are warning that Meta's new venture into cloud infrastructure could provide smaller margins than its lucrative ad business.,ibtimes.com,"('Ads', 'Businesses', 'ETF', 'Economy & Markets', 'Financial Services', 'Meta', 'Stock', 'Technology', 'Tiingo Top', 'Unknown Sector')",2026-07-02T13:47:19.926087Z,"('bfh', 'goog', 'googl', 'meta', 'meta', 'meta', 'metv', 'msft')"
96896150,2026-07-02T13:22:17Z,"The two mounting market risks this summer, according to JPMorgan",https://www.cnbc.com/2026/07/02/the-two-mounting-market-risks-this-summer-according-to-jpmorgan.html,JPMorgan thinks the stock market could run into some trouble this summer.,cnbc.com,"('Consumer Cyclical', 'ETF', 'Financial Services', 'Investment Strategy', 'Stock', 'Stock Markets', 'Technology', 'Tiingo Top', 'Unknown Sector')",2026-07-02T13:27:27.449206Z,"('aapl', 'aapl', 'amzn', 'amzn', 'googl', 'jpm', 'jpm-ws', 'mags', 'meta', 'meta', 'meta', 'metv', 'mu', 'mu', 'nvda', 'nvda', 'sndk', 'sndk', 'sndk', 'tsla', 'tsla')"
96902819,2026-07-02T13:14:48Z,Meta’s cloud compute reports: Why build AI data centers in a cornfield when Saudi Arabia has cheap oil and cheaper power?,https://finance.yahoo.com/technology/ai/articles/meta-cloud-compute-reports-why-131448553.html,"""Data center capacity in the United States is not going to age well,"" MNTN CEO Mark Douglas told Fortune. He gives it two years.",finance.yahoo.com,"('Aws', 'Data Center', 'ETF', 'Google Cloud', 'Mark Douglas', 'Meta', 'Saudi Arabia', 'Stock', 'Technology', 'United States', 'Unknown Sector')",2026-07-02T16:51:44.911440Z,"('aws', 'goog', 'googl', 'meta', 'meta', 'meta', 'metv', 'msft')"
96898248,2026-07-02T13:13:00Z,"Zacks Investment Ideas feature highlights: JPMorgan, Sandisk, Micron Technology, Nvidia, Broadcom, AMD, Taiwan Semiconductor, Arista Networks, Meta Platforms and Microsoft",https://www.zacks.com/stock/news/2947031/zacks-investment-ideas-feature-highlights-jpmorgan-sandisk-micron-technology-nvidia-broadcom-amd-taiwan-semiconductor-arista-networks-meta-platforms-and-microsoft?cid=CS-ZC-FT-press_releases-2947031,,zacks.com,"('ETF', 'Financial Services', 'Press Releases', 'Stock', 'Taiwan', 'Technology', 'Unknown Sector')",2026-07-02T14:33:30.202346Z,"('amd', 'anet', 'anet', 'avgo', 'avgo', 'brcm', 'jpm', 'jpm', 'jpm-ws', 'meta', 'meta', 'meta', 'metv', 'msft', 'msft', 'mu', 'mu', 'nvda', 'nvda', 'sndk', 'sndk', 'sndk', 'tsm')"
96895582,2026-07-02T13:01:14Z,Jim Cramer's top 10 things to watch in the stock market Thursday,https://www.cnbc.com/2026/07/02/jim-cramers-top-10-things-to-watch-in-the-stock-market-thursday.html,"The June jobs report came in weak, and Palantir landed a big upgrade.",cnbc.com,"('Basic Materials', 'Breaking News: Markets', 'Consumer Cyclical', 'Consumer Defensive', 'ETF', 'Energy', 'Financial Services', 'Healthcare', 'Industrials', 'Investment Strategy', 'Markets', 'Materials', 'Stock', 'Technology', 'Tiingo Top', 'Unknown Sector')",2026-07-02T13:06:33.009530Z,"('amzn', 'amzn', 'ba', 'ba', 'bac', 'bac', 'botz', 'cah', 'cvx', 'dal', 'dd', 'dd', 'dd', 'gis', 'hon', 'hon', 'hona', 'hona', 'igv', 'meta', 'meta', 'meta', 'metv', 'msft', 'msft', 'nvda', 'nvda', 'pltr', 'pltr', 'qqq', 'qqq', 'soxx', 'ual', 'wfc', 'wfc', 'xli', 'xlk', 'xlv')"
96895304,2026-07-02T13:01:01.764665Z,META Maintained by Wells Fargo -- Price Target Raised to $767,https://www.gurufocus.com/news/8942863/meta-maintained-by-wells-fargo-price-target-raised-to-767,,gurufocus.com,"('ETF', 'Financial Services', 'Stock', 'Technology', 'Unknown Sector')",2026-07-02T13:01:02.111734Z,"('meta', 'meta', 'meta', 'metv', 'wfc', 'wfc-ws')"
96895254,2026-07-02T13:00:45.942196Z,Positive Outlook for Meta (META) Cloud Offering and CapEx Impact,https://www.gurufocus.com/news/8942914/positive-outlook-for-meta-meta-cloud-offering-and-capex-impact,,gurufocus.com,"('ETF', 'Stock', 'Technology', 'Unknown Sector')",2026-07-02T13:00:46.279847Z,"('meta', 'meta', 'meta', 'metv')"
96898295,2026-07-02T13:00:00Z,Does PENG Stock's Lower Valuation Signal a Smart Buying Opportunity?,https://www.zacks.com/stock/news/2947015/does-peng-stock-s-lower-valuation-signal-a-smart-buying-opportunity?cid=CS-ZC-FT-analyst_blog%7Cmost_popular_stocks-2947015,,zacks.com,"('Analyst Blog', 'Consumer Discretionary', 'ETF', 'Stock', 'Technology', 'Unknown Sector')",2026-07-02T14:33:45.748985Z,"('afrm', 'meta', 'meta', 'meta', 'metv', 'peng', 'peng', 'snow', 'snow')"
96904185,2026-07-02T12:58:46Z,Mark Zuckerberg feeds his cows macadamia nuts and beer to create the ‘highest-quality beef in the world’ on his $300 million estate in Hawaii,https://fortune.com/2026/07/02/mark-zuckerberg-cattle-ranch-hawaii-complex-macadamia-nuts-beer/,"“I'm very into the genetics of the cattle,” the Meta CEO said.",fortune.com,"('Beef', 'Billionaire', 'ETF', 'Farming', 'Mark Zuckerberg', 'Meta', 'Stock', 'Technology', 'Unknown Sector')",2026-07-02T17:35:18.920598Z,"('beef', 'meta', 'meta', 'meta', 'metv')"
96895331,2026-07-02T12:51:26Z,Meta Jumps 9.3% on Plans for AI Cloud Infrastructure Business,https://www.gurufocus.com/news/8942617/meta-jumps-93-on-plans-for-ai-cloud-infrastructure-business,,gurufocus.com,"('ETF', 'Stock', 'Technology', 'Unknown Sector')",2026-07-02T13:01:11.353951Z,"('crwv', 'crwv', 'meta', 'meta', 'meta', 'metv', 'nbis')"
96895787,2026-07-02T12:28:44Z,CRWV Stock Saw Its Worst Selloff In Over 4 Months On META's Cloud Computing Plans — Wall Street Now Thinks It's A Buying Opportunity,https://finance.yahoo.com/markets/stocks/articles/crwv-stock-saw-worst-selloff-122844001.html,Rosenblatt said its channel checks show no change in hyperscalers' demand for GPU computing capacity.,finance.yahoo.com,"('Business Plans', 'Cloud Computing', 'Consumer Cyclical', 'ETF', 'Meta', 'Rohit Kulkarni', 'Roth Capital', 'Stock', 'Technology', 'Unknown Sector')",2026-07-02T13:15:56.054445Z,"('amzn', 'meta', 'meta', 'meta', 'metv', 'msft')"
96894876,2026-07-02T12:23:00Z,3 Stocks Due for a Major Rally in July,https://www.fool.com/investing/2026/07/02/3-stocks-due-for-a-major-rally-in-july/?source=iedfolrf0000001,"The market is due for a big rally, and these three could lead it.",fool.com,"('7Ec05C9F-Ffdc-48Ae-913A-22C1Ab4C2Ca9', 'ETF', 'Investing', 'Meta', 'Msft', 'Nvda', 'Stock', 'Technology', 'Technology And Telecom', 'Unknown Sector')",2026-07-02T12:47:30.567385Z,"('meta', 'meta', 'meta', 'metv', 'msft', 'msft', 'nvda', 'nvda')"
96897640,2026-07-02T12:22:46Z,"My Personal CFO LLC Has $225,000 Position in Meta Platforms, Inc. $META",https://www.thelincolnianonline.com/2026/07/02/my-personal-cfo-llc-has-225000-position-in-meta-platforms-inc-meta.html,"My Personal CFO LLC cut its stake in Meta Platforms, Inc. (NASDAQ:META – Free Report) by 71.8% during the 1st quarter, according to its most recent Form 13F filing with the Securities and Exchange Commission (SEC). The firm owned 394 shares of the social networking company’s stock after selling 1,001 shares during the quarter. My […]",thelincolnianonline.com,"('13F', '30303M10', 'Computer And Technology', 'ETF', 'Financial Services', 'Hedge Fund Holdings', 'Institutional Investor Holdings', 'Meta', 'Meta Platforms', 'Nasdaq:Meta', 'Sec Filings', 'Stock', 'Technology', 'Unknown Sector')",2026-07-02T14:18:39.535957Z,"('gs', 'gsf', 'gsj', 'meta', 'meta', 'meta', 'metv', 'stt', 'wfc', 'wfc-ws')"
