id,publishedDate,title,url,description,source,tags,crawlDate,tickers
96382865,2026-06-12T22:28:39Z,Jim Cramer says SpaceX’s blockbuster IPO could have major implications for the week ahead,https://www.cnbc.com/2026/06/12/jim-cramer-spacex-ipo-implications-week-ahead.html,CNBC’s Jim Cramer said the successful debut of SpaceX could pave the way for more AI-related offerings and help create a more constructive backdrop for stocks.,cnbc.com,"('Breaking News: Technology', 'Business', 'Communication Services', 'Computing', 'Consumer Cyclical', 'Consumer Defensive', 'ETF', 'Energy', 'Healthcare', 'Industrials', 'Internet', 'Investment Strategy', 'Markets', 'Space Industry', 'Stock', 'Stock Markets', 'Technology', 'Tiingo Top', 'Unknown Sector', 'Wireless')",2026-06-12T22:36:21.577140Z,"('acn', 'alab', 'alab', 'amzn', 'amzn', 'chtr', 'crwv', 'crwv', 'ctsh', 'googl', 'insm', 'kr', 'meta', 'meta', 'meta', 'metv', 'msft', 'msft', 'nbis', 'play', 'play', 'rklb', 'slb', 'slb', 'spcx', 'spcx', 'ter', 'vrsk', 'zs')"
96382688,2026-06-12T22:23:37Z,"Chase launches limited-time business card offers: Earn up to 200,000 bonus points",https://www.cnbc.com/select/chase-sapphire-ink-business-card-limited-time-welcome-bonus-offers/,Chase has launched limited-time welcome bonus increases on its Ink Business and Sapphire Reserve for Business cards.,cnbc.com,"('ETF', 'Financial Services', 'Labor Economy', 'Personal Finance', 'Social Issues', 'Stock', 'Technology', 'Tiingo Top', 'Unknown Sector')",2026-06-12T22:31:21.493026Z,"('dash', 'googl', 'jpm', 'jpm', 'lyft', 'meta', 'meta', 'meta', 'metv', 'zip', 'zip')"
96380936,2026-06-12T20:36:00Z,My Top 5 Artificial Intelligence (AI) Stocks to Buy Right Now,https://www.fool.com/investing/2026/06/12/my-top-5-artificial-intelligence-ai-stocks-to-buy/?source=iedfolrf0000001,There are several strong AI stock picks available right now.,fool.com,"('Amzn', 'Consumer Cyclical', 'ETF', 'Eaf4Bf99-Ac48-4Bec-8A5C-76D667A39A4F', 'Investing', 'Meta', 'Msft', 'Nvda', 'Sndk', 'Stock', 'Technology', 'Technology And Telecom', 'Unknown Sector')",2026-06-12T21:00:44.090268Z,"('amzn', 'amzn', 'meta', 'meta', 'meta', 'metv', 'msft', 'msft', 'nvda', 'nvda', 'sndk', 'sndk', 'sndk')"
96379212,2026-06-12T19:38:02Z,Rural Louisiana teachers set to get $50K bonuses — all thanks to Meta's AI data center,https://nypost.com/2026/06/12/business/meta-data-center-fuels-50k-teacher-bonuses-in-rural-louisiana/,"Richland Parish School Board said teachers will receive bonuses of up to $50,935 this year, a staggering jump from last year’s maximum of $10,200.",nypost.com,"('Data', 'ETF', 'Louisiana', 'Meta', 'Stock', 'Teachers', 'Technology', 'Unknown Sector')",2026-06-12T19:38:55.858551Z,"('data', 'goog', 'googl', 'meta', 'meta', 'meta', 'metv')"
96378506,2026-06-12T18:52:10Z,"Goldman nets a big payday for SpaceX IPO. Plus, what drove our winners and losers this week",https://www.cnbc.com/2026/06/12/goldman-nets-a-big-payday-for-spacex-ipo-plus-what-drove-our-winners-and-losers-this-week.html,"Every weekday, the Investing Club releases the Homestretch; an actionable afternoon update just in time for the last hour of trading.",cnbc.com,"('Breaking News: Markets', 'Consumer Cyclical', 'Consumer Defensive', 'ETF', 'Financial Services', 'Healthcare', 'Investment Strategy', 'Markets', 'Stock', 'Technology', 'Tiingo Top', 'Unknown Sector')",2026-06-12T19:01:52.278608Z,"('aapl', 'aapl', 'acn', 'amat', 'amat', 'amzn', 'amzn', 'arm', 'arm', 'cah', 'crm', 'entg', 'googl', 'gs', 'gs', 'gsf', 'gsj', 'gvip', 'intc', 'intc', 'kmx', 'kr', 'lrcx', 'lrcx', 'meta', 'meta', 'meta', 'metv', 'ms', 'ms', 'msft', 'msft', 'nvda', 'nvda', 'pgr', 'pgr', 'sbux', 'sbux', 'spcx', 'tsm')"
96377955,2026-06-12T18:26:31Z,What comes next for SpaceX after the IPO will be in focus for investors. Here's what's ahead,https://www.cnbc.com/2026/06/12/stock-market-next-week-outlook-for-june-15-19-2026.html,Whether SpaceX can maintain the early enthusiasm in the coming days will be telling.,cnbc.com,"('Consumer Defensive', 'ETF', 'Investment Strategy', 'Stock', 'Stock Markets', 'Technology', 'Tiingo Top', 'Unknown Sector')",2026-06-12T18:32:39.351865Z,"('acn', 'cbrs', 'kr', 'meta', 'meta', 'meta', 'metv', 'qqq', 'qqq', 'rsp', 'soxx', 'spcx')"
96377852,2026-06-12T18:00:12Z,SpaceX Investors Beware: IPOs Significantly Underperform the Market in Year 1,https://www.fool.com/investing/2026/06/12/spacex-investors-beware-ipos-significantly-underpe/?source=iedfolrf0000001,IPOs have a history of disappointing early investors.,fool.com,"('0A496D63-C09A-4135-Ab58-5Ae92657454F', 'Consumer Cyclical', 'ETF', 'Investing', 'Meta', 'Pltr', 'Spcx', 'Stock', 'Technology', 'Technology And Telecom', 'Tsla', 'Unknown Sector')",2026-06-12T18:27:06.828188Z,"('meta', 'meta', 'meta', 'metv', 'pltr', 'pltr', 'spcx', 'tsla', 'tsla')"
96376831,2026-06-12T17:32:29Z,Meta Begins Unwinding $2 Billion Manus Deal After Beijing Orders Breakup,https://www.ibtimes.com/meta-begins-unwinding-2-billion-manus-deal-after-beijing-orders-breakup-3804021,Meta has reportedly completed an operational separation from Manus and halted data sharing between the two companies as it works to comply with a directive issued by Chinese authorities.,ibtimes.com,"('Acquisition', 'Ai', 'Beijing', 'Business', 'Canceled', 'China', 'ETF', 'Financial Services', 'Manus', 'Meta', 'Stock', 'Takeover', 'Technology', 'Tiingo Top', 'Unknown Sector')",2026-06-12T17:38:28.183719Z,"('aaic', 'ai', 'ai', 'meta', 'meta', 'meta', 'metv')"
96377095,2026-06-12T17:07:21Z,Is Meta (META) Quietly Building an AI Labor Moat With Its India Data Center and Training Push?,https://finance.yahoo.com/markets/stocks/articles/meta-meta-quietly-building-ai-170721277.html,"In recent weeks, Reliance Industries announced it will build a 168 MW AI‑ready data centre in Jamnagar, Gujarat for Meta to lease, while Meta committed $115 million to America’s Workforce Academy to train and place thousands of data‑centre construction and operations workers in the US. Together, these moves highlight how Meta is pairing massive AI infrastructure build‑outs with control over the skilled labour pipeline, potentially tightening its grip on the broader AI hardware and services...",finance.yahoo.com,"('Ai Infrastructure', 'Basic Materials', 'ETF', 'India', 'Jamnagar', 'Meta', 'Reliance India', 'Reliance Industries', 'Revenue Growth', 'Stock', 'Technology', 'Unknown Sector', 'Workforce Academy')",2026-06-12T17:50:34.473990Z,"('meta', 'meta', 'meta', 'metv', 'rs')"
96375407,2026-06-12T16:44:30Z,"57% of kids ages 9 to 17 who use AI get body advice from it—here's why that could be problematic, experts say",https://www.cnbc.com/2026/06/12/57percent-of-kids-ages-9-to-17-who-use-ai-get-body-advice-from-itwhy-it-could-be-problematic.html,"Nearly a third, 29% of 13-to 17-year-olds use AI daily, according to new data by Common Sense Media.",cnbc.com,"('ETF', 'Meta Platforms Inc', 'Stock', 'Technology', 'Unknown Sector')",2026-06-12T16:47:35.244273Z,"('meta', 'meta', 'meta', 'metv')"
96374587,2026-06-12T16:15:59Z,Meta platforms recover after brief outage disrupts services for thousands,https://www.livemint.com/news/world/meta-platforms-recover-after-brief-outage-disrupts-services-for-thousands-facebook-instagram-11781278386289.html,"Meta's social networks experienced outages affecting thousands of users, with over 62,000 reports for Facebook and 8,000 for Instagram. ",livemint.com,"('CryptoCurrency', 'ETF', 'Facebook', 'Instagram', 'Meta', 'Outage', 'Stock', 'Technology', 'Unknown Sector', 'Users')",2026-06-12T16:16:40.737673Z,"('meta', 'meta', 'meta', 'metv')"
96374316,2026-06-12T15:44:08Z,Prediction: Can Meta Stock Reach $700 by Year-End?,https://finance.yahoo.com/markets/stocks/articles/prediction-meta-stock-reach-700-154408092.html,"Meta Platforms (NASDAQ:META) just delivered Q1 revenue of $56.31 billion, up 33% YoY, and EPS of $10.44 against a $6.66 consensus. CEO Mark Zuckerberg said the company is “on track to deliver personal superintelligence to billions of people.” Shares responded by dropping 13.81% YTD to $568.43. The bull case calls for $700 by year-end. I ... Prediction: Can Meta Stock Reach $700 by Year-End?",finance.yahoo.com,"('ETF', 'Forward Earnings', 'Meta', 'Reality Labs', 'Stock', 'Technology', 'Unknown Sector')",2026-06-12T16:06:31.504051Z,"('meta', 'meta', 'meta', 'metv', 'nvda')"
96374615,2026-06-12T15:13:23Z,Meta provides military veterans with AI smart glasses,https://www.aol.com/news/meta-provides-military-veterans-ai-151323316.html,Tech giant Meta is donating smart glasses to blind veterans. Meta President Dina Powell McCormick and UFC president and Meta board member Dana White share how they believe the glasses could help veterans with vision impairments.,aol.com,"('Blind Veterans', 'Dana White', 'Dina Powell Mccormick', 'ETF', 'Meta', 'Smart Glasses', 'Stock', 'Technology', 'Unknown Sector')",2026-06-12T16:17:57.930630Z,"('meta', 'meta', 'meta', 'metv')"
96374380,2026-06-12T15:11:37Z,Meta's Instagram and Facebook hit by outages,https://www.aol.com/news/metas-instagram-facebook-hit-outages-151137788.html,"Facebook and Instagram users reported issues with accessing the platforms, according to the third-party outage-tracking website DownDetector.com.",aol.com,"('ETF', 'Facebook', 'Financial Services', 'Instagram', 'Messenger', 'Meta', 'Platform Issues', 'Stock', 'Technology', 'Unknown Sector')",2026-06-12T16:08:25.339623Z,"('aaba', 'meta', 'meta', 'meta', 'metv', 'yhoo')"
96373455,2026-06-12T15:05:00Z,SpaceX Stock Is Now Trading. Should You Buy SPCX Today?,https://www.fool.com/investing/2026/06/12/spacex-stock-is-now-trading-should-you-buy-spcx-to/?source=iedfolrf0000001,SpaceX has finally gone public in the largest IPO in U.S. history.,fool.com,"('Consumer Cyclical', 'ETF', 'F9E32112-9177-4A39-A807-Fb1F3193B530', 'Industrials', 'Investing', 'Meta', 'Nvda', 'Spcx', 'Stock', 'Technology', 'Tsla', 'Unknown Sector')",2026-06-12T15:32:50.946178Z,"('meta', 'meta', 'meta', 'metv', 'nvda', 'nvda', 'spcx', 'tsla', 'tsla')"
96373372,2026-06-12T15:03:44Z,"Facebook, Instagram, and WhatsApp hit by a major Meta outage",https://thenextweb.com/news/meta-outage-facebook-instagram-whatsapp-down,"A major Meta outage hit Facebook, Instagram, WhatsApp and Messenger worldwide. Down Detector logged 130,000+ reports before service began to return.",thenextweb.com,"('Apps', 'ETF', 'Meta', 'Social For Business', 'Social Media', 'Stock', 'Technology', 'Tiingo Top', 'Unknown Sector')",2026-06-12T15:28:58.470709Z,"('apps', 'apps', 'meta', 'meta', 'meta', 'metv')"
96372428,2026-06-12T14:52:01.010000Z,Meta's Facebook and Instagram hit by outages,https://www.businessinsider.com/meta-facebook-instagram-messenger-outage-issues-2026-6,"Facebook and Instagram users reported issues with accessing the platforms, according to the third-party outage-tracking website DownDetector.com.",businessinsider.com,"('ETF', 'Facebook', 'Instagram', 'Meta', 'Stock', 'Tech', 'Technology', 'Unknown Sector')",2026-06-12T14:54:25.450547Z,"('meta', 'meta', 'meta', 'metv', 'tech')"
96373373,2026-06-12T14:34:49Z,Meta is giving free AI glasses to every blind veteran in America,https://thenextweb.com/news/meta-free-ai-glasses-blind-veterans,"Meta will give free Meta AI glasses to every blind US veteran, Zuckerberg says. Over 130,000 qualify, with training via the Blinded Veterans Association.",thenextweb.com,"('Artificial Intelligence', 'ETF', 'Health Tech', 'Meta', 'North America', 'Plugged', 'Stock', 'Technology', 'Tiingo Top', 'United States', 'Unknown Sector')",2026-06-12T15:28:59.193023Z,"('meta', 'meta', 'meta', 'metv')"
96371896,2026-06-12T14:33:57Z,"Facebook Down for 100,000-Plus Users: Instagram and Meta Ads Hit in Global Outage",https://www.techtimes.com/articles/318282/20260612/facebook-down-100000-plus-users-instagram-meta-ads-hit-global-outage.htm,"Facebook down today? Downdetector logged over 100,000 user reports by 10 a.m. ET on June 12, 2026, as a server-side failure logged users out of Facebook and partially disrupted Instagram. Meta Ads Manager showed high disruptions — advertisers should pause campaigns immediately — while Meta issued",techtimes.com,"('Advertising', 'Apps', 'Downdetector', 'ETF', 'Facebook', 'Facebook Down', 'Instagram Down', 'Meta', 'Platform Reliability', 'Social Media', 'Software', 'Stock', 'Technology', 'Unknown Sector')",2026-06-12T14:35:51.163284Z,"('csco', 'goog', 'googl', 'meta', 'meta', 'meta', 'metv')"
96372466,2026-06-12T14:28:48Z,Is Facebook down right now? Users report issues with online platform,https://www.aol.com/news/facebook-down-now-users-report-142848126.html,Thousands of users are experiencing Facebook errors Friday morning due to reported Meta outage.,aol.com,"('ETF', 'Facebook', 'Facebook Messenger', 'Meta', 'Stock', 'Technology', 'Unknown Sector')",2026-06-12T14:56:34.314510Z,"('meta', 'meta', 'meta', 'metv')"
96372224,2026-06-12T14:28:48Z,Is Facebook down right now? Users report issues with online platform,https://www.aol.com/news/facebook-down-now-users-report-142848612.html,Thousands of users are experiencing Facebook errors Friday morning due to reported Meta outage.,aol.com,"('ETF', 'Facebook', 'Meta', 'Stock', 'Technology', 'Tens Of Thousands', 'Tiingo Top', 'Unknown Sector')",2026-06-12T14:46:22.498475Z,"('meta', 'meta', 'meta', 'metv')"
96371593,2026-06-12T14:13:07Z,Is Instagram down right now? Users report issues with social media app,https://www.aol.com/news/instagram-down-now-users-report-141307829.html,Thousands of Instagram users are reporting errors with the social media platform on Friday morning.,aol.com,"('ETF', 'Instagram', 'Meta', 'Stock', 'Technology', 'Unknown Sector')",2026-06-12T14:26:06.467502Z,"('meta', 'meta', 'meta', 'metv')"
96372192,2026-06-12T14:13:07Z,Is Instagram down right now? Users report issues with social media app,https://www.aol.com/news/instagram-down-now-users-report-141307245.html,Thousands of Instagram users are reporting errors with the social media platform on Friday morning.,aol.com,"('ETF', 'Instagram', 'Meta', 'Stock', 'Technology', 'Unknown Sector')",2026-06-12T14:44:35.974870Z,"('meta', 'meta', 'meta', 'metv')"
96378115,2026-06-12T14:06:25Z,Facebook and Instagram down as Meta products hit with widespread outage,https://www.aol.com/news/facebook-instagram-down-meta-products-140625257.html,"Thousands of users appeared to be affected by a widespread outage impacting Meta’s Instagram, Facebook and Messenger on Friday, with reports flooding social media and outage-tracking site Downdetector. Downdetector showed...",aol.com,"('ETF', 'Facebook', 'Instagram', 'Messenger', 'Meta', 'Stock', 'Technology', 'Unknown Sector')",2026-06-12T18:41:30.684507Z,"('meta', 'meta', 'meta', 'metv')"
96370994,2026-06-12T14:06:25Z,Instagram and Facebook hit with widespread outage,https://nypost.com/2026/06/12/business/instagram-and-facebook-hit-with-widespread-outage/,"Thousands of users appeared to be affected by a widespread outage impacting Instagram, Facebook and Messenger on Friday, with reports flooding social media and outage-tracking site Downdetector. Do…",nypost.com,"('ETF', 'Facebook', 'Instagram', 'Meta', 'Stock', 'Technology', 'Unknown Sector')",2026-06-12T14:07:32.349671Z,"('meta', 'meta', 'meta', 'metv')"
96371143,2026-06-12T13:50:56Z,Meta unwinds $2 billion Manus acquisition after China order,https://finance.yahoo.com/sectors/technology/articles/meta-unwinds-2-billion-manus-135056109.html,"Meta has cut Manus off from its internal data systems and told staff to stop using the platform, taking the most concrete steps yet toward reversing the deal",finance.yahoo.com,"('Beijing', 'China', 'ETF', 'Internal Data Systems', 'Manus', 'Meta', 'National Development And Reform Commission', 'Stock', 'Technology', 'Unknown Sector', 'Xiao Hong')",2026-06-12T14:13:56.678452Z,"('meta', 'meta', 'meta', 'metv', 'tcehy')"
96373121,2026-06-12T13:45:04Z,Here's Why Meta Platforms (META) is a Strong Growth Stock,https://www.zacks.com/stock/news/2936471/here-s-why-meta-platforms-meta-is-a-strong-growth-stock?cid=CS-ZC-FT-tale_of_the_tape%7Czacks_education_growth_score-2936471,,zacks.com,"('ETF', 'Stock', 'Tale Of The Tape', 'Technology', 'Unknown Sector')",2026-06-12T15:17:41.565606Z,"('meta', 'meta', 'meta', 'metv')"
96370860,2026-06-12T13:36:00Z,"7 Reasons I'm Avoiding the SpaceX IPO Like the Plague -- and You Should, Too!",https://www.fool.com/investing/2026/06/12/7-reasons-avoiding-the-spacex-ipo-like-the-plague/?source=iedfolrf0000001,"Structural, operational, valuation, and historical headwinds all point to SpaceX stock being a disaster.",fool.com,"('33Bcf621-9881-4D36-A65F-9C087C043410', 'Consumer Cyclical', 'ETF', 'Financial Services', 'Goog', 'Googl', 'Industrials', 'Investing', 'Meta', 'Spcx', 'Stock', 'Technology', 'Tfc', 'Tsla', 'Unknown Sector', '^Gspc')",2026-06-12T14:02:46.801823Z,"('goog', 'goog', 'googl', 'meta', 'meta', 'meta', 'metv', 'spcx', 'tfc', 'tsla', 'tsla')"
96369946,2026-06-12T13:05:00Z,'Practically every major industry is desperate': Mike Rowe and Meta team up to offer paid training for trades jobs,https://finance.yahoo.com/economy/policy/articles/practically-every-major-industry-desperate-130500181.html,"Trades jobs are especially in demand now, in no small part because of the AI data center explosion.",finance.yahoo.com,"('ETF', 'Financial Services', 'Meta', 'Mike Rowe', 'Robert Kiyosaki', 'Skilled Workers', 'Stock', 'Technology', 'Trades', 'Unknown Sector')",2026-06-12T13:25:27.717773Z,"('bcf', 'bgio', 'blk', 'goog', 'googl', 'meta', 'meta', 'meta', 'metv')"
96369482,2026-06-12T13:00:00Z,Aymer AI Announces Venture to Develop 90-Acre Powered Land Bank in Texas,https://www.globenewswire.com/news-release/2026/06/12/3311070/0/en/Aymer-AI-Announces-Venture-to-Develop-90-Acre-Powered-Land-Bank-in-Texas.html,"Aymer AI, led by Gautam Garg, launches Project Macedonia to transform a 90 acre land parcel into a 100 MW AI data center in Texas for HPC applications ...",globenewswire.com,"('Ai', 'Amazon', 'Anthropic', 'Artificial Intelligence', 'Data Centers', 'ETF', 'Energy', 'Fermi', 'Financial Services', 'Gas', 'Google', 'Grid', 'Macedonia', 'Meta', 'Nuclear', 'Nvidia', 'Openai', 'Power', 'Reit', 'Spacex', 'Stock', 'Technology', 'Texas', 'Unknown Sector', 'Utilities')",2026-06-12T13:05:49.313017Z,"('aaic', 'ai', 'ai', 'gas', 'grid', 'grid', 'meta', 'meta', 'meta', 'metv', 'nvda', 'reit', 'reit')"
96369479,2026-06-12T12:59:27Z,Jim Cramer's top 10 things to watch in the stock market Friday,https://www.cnbc.com/2026/06/12/jim-cramers-top-10-things-to-watch-in-the-stock-market-friday.html,The biggest IPO of all time is finally here.,cnbc.com,"('Breaking News: Markets', 'Communication Services', 'Consumer Cyclical', 'ETF', 'Financials', 'Healthcare', 'Industrials', 'Investment Strategy', 'Markets', 'Stock', 'Technology', 'Tiingo Top', 'Unknown Sector')",2026-06-12T13:05:47.732751Z,"('adbe', 'adbe', 'alab', 'alab', 'amd', 'bdx', 'bsx', 'bsx', 'cbrs', 'chtr', 'crwv', 'crwv', 'ctsh', 'fdx', 'fdxf', 'fig', 'fig', 'fig', 'fig', 'googl', 'insm', 'isrg', 'isrg', 'mdt', 'meta', 'meta', 'meta', 'metv', 'mrvl', 'mrvl', 'nbis', 'nok', 'nvda', 'nvda', 'qqq', 'qqq', 'rklb', 'syk', 'syk', 'ter', 'tjx', 'tjx', 'vrsk', 'wsm', 'zs')"
96368954,2026-06-12T12:35:04Z,SpaceX's supersized starting valuation could limit future returns,https://www.cnbc.com/2026/06/12/spacexs-supersized-starting-valuation-could-limit-future-returns.html,SpaceX’s planned IPO is unprecedented both in deal size and valuation.,cnbc.com,"('Breaking News: Investing', 'Breaking News: Markets', 'Consumer Cyclical', 'ETF', 'Investment Strategy', 'Markets', 'Stock', 'Stock Markets', 'Technology', 'Tiingo Top', 'Unknown Sector')",2026-06-12T12:44:40.739629Z,"('aapl', 'aapl', 'amzn', 'amzn', 'googl', 'meta', 'meta', 'meta', 'metv', 'msft', 'msft', 'nvda', 'nvda', 'spcx', 'tsla', 'tsla')"
96368847,2026-06-12T12:33:52Z,Is Meta Overspending On AI?,https://www.forbes.com/sites/greatspeculations/2026/06/12/is-meta-overspending-on-ai/,"The narrative is unmistakable: Meta is investing heavily to secure a leading role in AI, from foundational models to personal superintelligence. ",forbes.com,"('Ai', 'ETF', 'Financial Services', 'Foundational Mod', 'Goog', 'Meta', 'Stock', 'Technology', 'Unknown Sector')",2026-06-12T12:36:50.612952Z,"('aaic', 'ai', 'ai', 'goog', 'goog', 'meta', 'meta', 'meta', 'metv')"
96367826,2026-06-12T12:03:49Z,"Here are Friday's biggest analyst calls: Nvidia, SpaceX, AMD, Broadcom, Warby Parker, Adobe, Kratos & more",https://www.cnbc.com/2026/06/12/fridays-biggest-analyst-calls-like-spacex.html,Here are Friday's biggest calls on Wall Street.,cnbc.com,"('Breaking News: Investing', 'Breaking News: Markets', 'Consumer Cyclical', 'Consumer Defensive', 'ETF', 'Healthcare', 'Industrials', 'Investment Strategy', 'Markets', 'Real Estate', 'Stock', 'Technology', 'Tiingo Top', 'Unknown Sector', 'Utilities')",2026-06-12T12:08:36.893517Z,"('adbe', 'adbe', 'aiir', 'amd', 'avgo', 'avgo', 'avtx', 'brcm', 'ccep', 'celh', 'edu', 'edu', 'epr', 'epr', 'frvo', 'gh', 'gh', 'googl', 'kdp', 'ktos', 'meta', 'meta', 'meta', 'metv', 'nvda', 'nvda', 'ogs', 'phin', 'spcx', 'wrby', 'wsm')"
96368070,2026-06-12T11:39:10Z,"ICICI Prudential Asset Management Co Ltd Grows Stake in Meta Platforms, Inc. $META",https://www.thelincolnianonline.com/2026/06/12/icici-prudential-asset-management-co-ltd-grows-stake-in-meta-platforms-inc-meta.html,"ICICI Prudential Asset Management Co Ltd boosted its stake in shares of Meta Platforms, Inc. (NASDAQ:META – Free Report) by 26.1% during the 4th quarter, according to its most recent Form 13F filing with the SEC. The institutional investor owned 17,073 shares of the social networking company’s stock after purchasing an additional 3,534 shares during […]",thelincolnianonline.com,"('13F', '30303M10', 'Computer And Technology', 'ETF', 'Hedge Fund Holdings', 'Institutional Investor Holdings', 'Meta', 'Meta Platforms', 'Nasdaq:Meta', 'Sec Filings', 'Stock', 'Technology', 'Unknown Sector')",2026-06-12T12:18:20.276176Z,"('goog', 'googl', 'meta', 'meta', 'meta', 'metv')"
96366067,2026-06-12T10:36:07Z,"Buy AMD shares as graphics chip sales boost earnings, says Citi",https://www.cnbc.com/2026/06/12/buy-amd-shares-as-graphics-chip-sales-boost-earnings-says-citi.html,"The bank thinks Advanced Micro Devices is set to see an improving AI outlook, with both a stronger GPU business and increasing demand for CPUs.",cnbc.com,"('ETF', 'Investment Strategy', 'Stock', 'Stock Markets', 'Technology', 'Tiingo Top', 'Unknown Sector')",2026-06-12T10:42:36.566863Z,"('amd', 'amd', 'meta', 'meta', 'meta', 'metv', 'nvda', 'nvda', 'soxx')"
96363812,2026-06-12T09:00:01Z,SpaceX's Gwynne Shotwell says IPO is one small step in 'very futuristic' journey,https://www.cnbc.com/2026/06/12/spacex-coo-gwynne-shotwell-spcx-ipo.html,"Gwynne Shotwell, long Elon Musk's second-in-command at SpaceX, spoke exclusively with CNBC ahead of her company's highly anticipated IPO.",cnbc.com,"('Autos', 'Breaking News: Technology', 'Business', 'Computing', 'Consumer Cyclical', 'ETF', 'Industrials', 'Internet', 'Ipo', 'Social Media', 'Stock', 'Technology', 'Unknown Sector', 'Wireless')",2026-06-12T09:01:35.734717Z,"('avgo', 'avgo', 'googl', 'intc', 'intc', 'ipo', 'meta', 'meta', 'meta', 'metv', 'pl', 'rokt', 'sats', 'spcx', 'tsla', 'tsla', 'unp', 'unp', 'xar', 'xlf')"
96363985,2026-06-12T08:44:00Z,How Backlash Against Data Centers Could Start Showing Up in Hyperscalers' Earnings Reports,https://www.fool.com/investing/2026/06/12/how-backlash-against-data-centers-could-start-show/?source=iedfolrf0000001,"As states like Ohio move to increase their regulation of data centers and reduce their subsidies for the businesses behind them, the costs of building and operating them could increase significantly.",fool.com,"('12D53C44-Ff0E-406A-Af8D-A3F53D868Fba', 'Amzn', 'Consumer Cyclical', 'ETF', 'Investing', 'Meta', 'Msft', 'Stock', 'Technology', 'Technology And Telecom', 'Unknown Sector')",2026-06-12T09:10:29.180357Z,"('amzn', 'amzn', 'meta', 'meta', 'meta', 'metv', 'msft', 'msft')"
96363481,2026-06-12T08:30:02.081000Z,Mark Zuckerberg says you only need at least a dozen 'strong' AI researchers to make breakthroughs,https://www.businessinsider.com/mark-zuckerberg-dozen-ai-researchers-drive-breakthroughs-biohub-2026-6,"Mark Zuckerberg also said the current AI moment has left him feeling a ""combination of invigorated and exhausted.""",businessinsider.com,"('Ai', 'ETF', 'Financial Services', 'Mark Zuckerberg', 'Meta', 'Science', 'Stock', 'Tech', 'Technology', 'Unknown Sector')",2026-06-12T08:34:14.454944Z,"('aaic', 'ai', 'ai', 'meta', 'meta', 'meta', 'metv', 'tech')"
96364132,2026-06-12T08:00:00Z,"Bull of the Day: Quanta Services, Inc. (PWR)",https://www.zacks.com/commentary/2936116/bull-of-the-day-quanta-services-inc-pwr?cid=CS-ZC-FT-bull_of_the_day-2936116,,zacks.com,"('Bull Of The Day', 'ETF', 'Industrials', 'Stock', 'Technology', 'Unknown Sector')",2026-06-12T09:18:17.483507Z,"('meta', 'meta', 'meta', 'metv', 'msft', 'msft', 'pwr', 'pwr')"
96363068,2026-06-12T07:41:11Z,Meta reportedly begins dismantling $2 billion Manus deal on Beijing's orders,https://www.cnbc.com/2026/06/12/meta-reportedly-begins-dismantling-2-billion-manus-deal-on-beijings-orders.html,"Meta has reportedly begun dismantling its acquisition of Manus, moving to comply with Beijing's unprecedented order to hand back the Chinese-founded AI startup.",cnbc.com,"('Asia Economy', 'Business', 'ETF', 'Stock', 'Technology', 'Tiingo Top', 'Unknown Sector')",2026-06-12T07:51:35.971795Z,"('meta', 'meta', 'meta', 'metv', 'shop', 'shop', 'smwb')"
