id,publishedDate,title,url,description,source,tags,crawlDate,tickers
96362228,2026-06-12T06:07:18Z,ChatGPT hits a billion monthly app users despite souring public AI sentiment,https://www.cnbc.com/2026/06/12/chatgpt-a-billion-monthly-app-users-despite-souring-public-ai-sentiment.html,ChatGPT reached a billion monthly users in May despite growing unease over its ethical and environmental impacts.,cnbc.com,"('Artificial Intelligence', 'Breaking News: Markets', 'Breaking News: Technology', 'Business', 'Computing', 'ETF', 'Internet', 'Markets', 'Stock', 'Technology', 'Tiingo Top', 'Unknown Sector', 'Wireless')",2026-06-12T06:13:14.846697Z,"('googl', 'meta', 'meta', 'meta', 'metv', 'xlk')"
96360553,2026-06-12T03:30:04Z,"Virginia Lottery Pick 3 Night, Pick 3 Day results for June 11, 2026",https://www.aol.com/news/virginia-lottery-pick-3-night-033004454.html,Check your tickets for Virginia daily lottery draw games here.,aol.com,"('ETF', 'Fb', 'Stock', 'Technology', 'Unknown Sector', 'Virginia Lottery')",2026-06-12T03:49:30.811823Z,"('fb', 'meta')"
96360727,2026-06-12T03:30:04Z,"Virginia Lottery Pick 3 Night, Pick 3 Day results for June 11, 2026",https://www.aol.com/news/virginia-lottery-pick-3-night-033004307.html,Check your tickets for Virginia daily lottery draw games here.,aol.com,"('ETF', 'Fb', 'Stock', 'Technology', 'Unknown Sector', 'Virginia Lottery')",2026-06-12T04:01:16.115019Z,"('fb', 'meta')"
96357271,2026-06-12T00:00:00Z,"This Dirt-Cheap ""Magnificent Seven"" Stock Is Priced Lower Than the S&P 500",https://www.fool.com/investing/2026/06/11/this-dirt-cheap-magnificent-seven-stock-is-priced/?source=iedfolrf0000001,Meta Platforms looks like a screaming bargain right now.,fool.com,"('41F54D9D-Bb8A-40F2-8B4B-D159A960Cb8A', 'ETF', 'Investing', 'Meta', 'Stock', 'Technology', 'Technology And Telecom', 'Unknown Sector')",2026-06-12T00:26:39.253966Z,"('meta', 'meta', 'meta', 'metv')"
96357138,2026-06-11T23:51:00Z,SpaceX Is Set to Start Trading Friday in What Could Be the Biggest IPO in History. Here's What Market History Says About Buying Day 1.,https://www.fool.com/investing/2026/06/11/spacex-is-set-to-start-trading-friday-in-what-coul/?source=iedfolrf0000001,"Friday will bring the largest market debut ever. Before buying in, it's worth knowing how history's biggest IPOs treated day-one buyers.",fool.com,"('Arm', 'Baba', 'Consumer Cyclical', 'ETF', 'F67C68E7-3D4D-460A-Bcf9-9B73529338Ce', 'Industrials', 'Investing', 'Meta', 'Spck', 'Spcx', 'Stock', 'Technology', 'Unknown Sector', 'V')",2026-06-12T00:16:48.978765Z,"('arm', 'arm', 'baba', 'meta', 'meta', 'meta', 'metv', 'spck', 'spcx', 'spcx')"
96357209,2026-06-11T22:59:00Z,3 Juggernaut IPOs: Did Investors Get Rich or Not?,https://www.zacks.com/stock/news/2936188/3-juggernaut-ipos-did-investors-get-rich-or-not?cid=CS-ZC-FT-market_edge-2936188,,zacks.com,"('Consumer Cyclical', 'ETF', 'Market Edge', 'Stock', 'Technology', 'Unknown Sector')",2026-06-12T00:20:29.767260Z,"('baba', 'meta', 'meta', 'meta', 'metv', 'tsla', 'tsla')"
96357210,2026-06-11T22:34:00Z,Are Investors Overlooking Meta Platforms Stock?,https://www.zacks.com/commentary/2936121/are-investors-overlooking-meta-platforms-stock?cid=CS-ZC-FT-investment_ideas-2936121,,zacks.com,"('ETF', 'Investment Ideas', 'Stock', 'Technology', 'Unknown Sector')",2026-06-12T00:20:30.106591Z,"('googl', 'meta', 'meta', 'meta', 'metv', 'msft', 'msft')"
96360214,2026-06-11T22:13:48Z,Blast off on Wall Street: record SpaceX IPO could make Musk a trillionaire,https://www.scmp.com/news/world/united-states-canada/article/3356821/spacex-prices-record-ipo-could-make-musk-trillionaire,"At US$135 a share, the offering will raise US$75 billion, making it the biggest market debut in history.",scmp.com,"('Bank Of America', 'Bloomberg', 'ETF', 'Elon Musk', 'Forbes', 'Goldman Sachs', 'Grok', 'Meta', 'Morgan Stanley', 'Nasdaq', 'New York', 'Oxfam America', 'Saudi Aramco', 'Spacex', 'Stock', 'Technology', 'Tesla', 'Unknown Sector', 'Wall Street')",2026-06-12T03:29:38.747213Z,"('meta', 'meta', 'meta', 'metv')"
96353649,2026-06-11T21:00:00Z,"Here's How Much a $1,000 Investment Could Get You When SpaceX Goes Public June 12",https://www.fool.com/investing/2026/06/11/heres-how-much-a-1000-investment-could-get-you-whe/?source=iedfolrf0000001,SpaceX finally goes public on June 12 with a $1.77 trillion valuation and a $135 offer price -- but that's not the price you'll pay.,fool.com,"('A6E4A266-2D5F-4385-85E1-1A5557264089', 'Baba', 'Consumer Cyclical', 'ETF', 'Industrials', 'Investing', 'Meta', 'Rivn', 'Spcx', 'Stock', 'Technology', 'Tsla', 'Tsll', 'Uber', 'Unknown Sector')",2026-06-11T21:25:45.066111Z,"('baba', 'meta', 'meta', 'meta', 'metv', 'rivn', 'spcx', 'spcx', 'tsla', 'tsla', 'tsll', 'uber', 'uber')"
96350167,2026-06-11T18:46:35.509000Z,The workers Meta and Google desperately need aren't in Silicon Valley,https://www.businessinsider.com/google-meta-invest-trades-training-ai-data-center-boom-2026-6,"As AI drives a data center boom, tech giants are backing trade programs to help fill a growing construction labor shortage.",businessinsider.com,"('Ai', 'Careers', 'Data Centers', 'ETF', 'Financial Services', 'Google', 'Meta', 'Microsoft', 'Oracle', 'Stock', 'Technology', 'Unknown Sector')",2026-06-11T18:48:18.691608Z,"('aaic', 'ai', 'ai', 'goog', 'googl', 'meta', 'meta', 'meta', 'metv', 'msft')"
96350612,2026-06-11T18:43:00Z,"Got $1,500? 3 No-Brainer Artificial Intelligence (AI) Semiconductor Stocks to Buy Before They Soar Once Again",https://www.fool.com/investing/2026/06/11/got-1500-3-no-brainer-artificial-intelligence-ai-s/?source=iedfolrf0000001,"The semiconductor sector has taken a beating of late, but that is good news for investors looking to buy top chip stocks at attractive valuations.",fool.com,"('A3Acf22E-24F2-4Cfb-906B-2241667C8815', 'Amd', 'Avgo', 'ETF', 'Investing', 'Meta', 'Nvda', 'Qcom', 'Stock', 'Technology', 'Technology And Telecom', 'Tsm', 'Unknown Sector', '^Ixic')",2026-06-11T19:08:09.381934Z,"('amd', 'avgo', 'avgo', 'meta', 'meta', 'meta', 'metv', 'nvda', 'nvda', 'qcom', 'qcom', 'tsm')"
96349601,2026-06-11T18:12:00Z,Meta navigates AI investment cycle as Street weighs costs against returns,https://finance.yahoo.com/sectors/technology/articles/meta-navigates-ai-investment-cycle-181200146.html,"Meta Platforms Inc (NASDAQ:META, XETRA:FB2A, SIX:FB) is at a crossroads, pouring capital into artificial intelligence infrastructure while investors wait for signs that the spending will pay off, according to Bank of America analysts. The report comes after Meta's third-quarter 2025 earnings...",finance.yahoo.com,"('Artificial Intelligence', 'Bank Of America', 'Capital Expenditures', 'ETF', 'Financial Services', 'Meta', 'Model Development', 'Stock', 'Technology', 'Unknown Sector')",2026-06-11T18:23:25.696999Z,"('bac', 'meta', 'meta', 'meta', 'metv', 'mhm', 'mpe')"
96349268,2026-06-11T17:45:38Z,What Rising AI Model Prices and Semiconductor Cycles Mean for Investors,https://www.fool.com/investing/2026/06/11/what-rising-ai-model-prices-and-semiconductor-cycl/?source=iedfolrf0000001,"AI's land grab is ending as costs rise, making unit economics and chip-cycle risks crucial.",fool.com,"('81Cad5B1-00B3-410E-B995-9Ffd93E54Ca0', 'ETF', 'Investing', 'Meta', 'Stock', 'Technology', 'Technology And Telecom', 'Uber', 'Unknown Sector')",2026-06-11T18:10:57.715868Z,"('meta', 'meta', 'meta', 'metv', 'uber', 'uber')"
96348317,2026-06-11T17:28:37Z,From startup to $1.8 trillion: The investors who took a chance on SpaceX now reap the rewards,https://www.cnbc.com/2026/06/11/spacex-investors-reap-rewards-1-8-trillion-valuation.html,"With SpaceX seeking a valuation of nearly $1.8 trillion in IPO, early bets are poised to generate some of the biggest paper gains in venture capital history.",cnbc.com,"('Breaking News: Business', 'Breaking News: Investing', 'Breaking News: Markets', 'Consumer Cyclical', 'ETF', 'Investment Strategy', 'Markets', 'Mutual Fund', 'Stock', 'Stock Markets', 'Technology', 'Tiingo Top', 'Unknown Sector', 'Wall Street')",2026-06-11T17:33:24.651909Z,"('arkk', 'arkvx', 'arkw', 'googl', 'meta', 'meta', 'meta', 'metv', 'sats', 'spcx', 'spcx', 'tsla', 'tsla', 'xar')"
96347302,2026-06-11T16:52:02.564000Z,TikTok's 'Computah' guy is the best use of Meta's Ray-Bans,https://www.businessinsider.com/computah-guy-tiktok-meta-ray-bans-2026-6,"I met up with the TikTok ""Computah"" guy who ""programs"" people with his Meta Ray-Ban glasses. Now I understand why he's gone viral.",businessinsider.com,"('Culture', 'ETF', 'Meta', 'Social Media', 'Stock', 'Tech', 'Technology', 'Tiktok', 'Unknown Sector', 'Viral')",2026-06-11T16:55:10.044110Z,"('goog', 'googl', 'meta', 'meta', 'meta', 'metv', 'tech')"
96347378,2026-06-11T16:51:27Z,Oracle shares tumble on earnings. But there's a silver lining for our AI chip and power stocks,https://www.cnbc.com/2026/06/11/oracle-shares-tumble-on-earnings-but-theres-a-silver-lining-for-our-ai-chip-and-power-stocks.html,Oracle investors didn't get what they wanted. But its earnings report was a good sign for other stocks in the AI trade.,cnbc.com,"('Breaking News: Markets', 'Consumer Cyclical', 'ETF', 'Investment Strategy', 'Markets', 'Stock', 'Technology', 'Tiingo Top', 'Unknown Sector')",2026-06-11T16:58:47.515277Z,"('amzn', 'amzn', 'arm', 'arm', 'avgo', 'avgo', 'crm', 'gev', 'gev', 'glw', 'googl', 'intc', 'intc', 'meta', 'meta', 'meta', 'metv', 'msft', 'msft', 'nvda', 'nvda', 'orcl')"
96345892,2026-06-11T16:00:01Z,"Elections advertising spend for 2026 expected to reach record high, outpacing presidential years",https://www.cnbc.com/2026/06/11/2026-elections-ad-spend-adimpact.html,"High-profile 2026 midterm races in California, Texas and other key states are driving higher spend earlier in the cycle, AdImpact found.",cnbc.com,"('Advertising', 'Breaking News: Business', 'Breaking News: Politics', 'Business', 'ETF', 'Politics', 'Stock', 'Technology', 'Unknown Sector')",2026-06-11T16:04:38.051643Z,"('googl', 'meta', 'meta', 'meta', 'metv', 'snap')"
96346385,2026-06-11T16:00:00Z,Should You Buy Meta Platforms Stock While It's Below $600?,https://www.fool.com/investing/2026/06/11/should-you-buy-meta-platforms-stock-while-its-belo/?source=iedfolrf0000001,"As of Wednesday's close, Meta's stock was within 10% of its 52-week low.",fool.com,"('ETF', 'F5Db6Eac-C88C-45B5-A9Bf-Df7Efe3Cb218', 'Investing', 'Meta', 'Stock', 'Technology', 'Technology And Telecom', 'Unknown Sector')",2026-06-11T16:23:40.397342Z,"('meta', 'meta', 'meta', 'metv')"
96342794,2026-06-11T14:00:00Z,"Reddit Is Down 28% This Year, but It Won't Stay That Way For Long",https://www.fool.com/investing/2026/06/11/reddit-is-down-28-this-year-but-it-wont-stay-that/?source=iedfolrf0000001,Reddit's year-to-date drop presents a compelling buying opportunity for patient investors.,fool.com,"('Bd063252-Aeec-41Cd-Bd47-Aeac323Caf7E', 'ETF', 'Investing', 'Meta', 'Rddt', 'Stock', 'Technology', 'Technology And Telecom', 'Unknown Sector')",2026-06-11T14:27:27.347121Z,"('meta', 'meta', 'meta', 'metv', 'rddt', 'rddt')"
96342778,2026-06-11T14:00:00Z,Could These 4 Tech Stocks Be the Buys You'll Regret Skipping?,https://www.fool.com/investing/2026/06/11/could-these-4-tech-stocks-be-the-buys-youll-regret/?source=iedfolrf0000001,"While the SpaceX IPO is grabbing every headline, four tech stocks may be quietly setting up a better opportunity for long-term investors.",fool.com,"('Amzn', 'Consumer Cyclical', 'ETF', 'Fe36F7Ce-B660-4D5A-8565-7336C3618250', 'Goog', 'Googl', 'Investing', 'Meta', 'Msft', 'Rddt', 'Stock', 'Technology', 'Technology And Telecom', 'Uber', 'Unknown Sector')",2026-06-11T14:26:53.819945Z,"('amzn', 'amzn', 'goog', 'goog', 'googl', 'meta', 'meta', 'meta', 'metv', 'msft', 'msft', 'rddt', 'rddt', 'uber', 'uber')"
96341880,2026-06-11T13:23:00Z,Better Artificial Intelligence (AI) Stock: Marvell Technology vs. Broadcom,https://www.fool.com/investing/2026/06/11/better-artificial-intelligence-ai-stock-marvell-te/?source=iedfolrf0000001,Investors looking to add one of these AI stocks to their portfolios right now have an easy choice to make.,fool.com,"('9852092F-Ab09-4542-Be37-3292E8Db8D91', 'Avgo', 'ETF', 'Investing', 'Meta', 'Mrvl', 'Nvda', 'Stock', 'Technology', 'Technology And Telecom', 'Unknown Sector')",2026-06-11T13:57:56.380562Z,"('avgo', 'avgo', 'meta', 'meta', 'meta', 'metv', 'mrvl', 'mrvl', 'nvda', 'nvda')"
96340428,2026-06-11T12:44:03Z,SpaceX IPOs on Friday. The 55% rule says don’t chase it.,https://finance.yahoo.com/markets/stocks/articles/spacex-ipos-friday-55-rule-124403163.html,"For much of the past month, Wall Street has been chanting the same three letters: SPCX, the Nasdaq ticker SpaceX intends to use when it begins trading on June 12, 2026. Retail investors have piled into the Destiny Tech100 vehicle, prediction markets have lit up, and r/wallstreetbets has turned a single post titled “$8 to ... SpaceX IPOs on Friday. The 55% rule says don’t chase it.",finance.yahoo.com,"('Austin Hankwitz', 'ETF', 'Hankwitz', 'Meta', 'Spacex', 'Stock', 'Technology', 'Top 10 Ai Stocks', 'Unknown Sector')",2026-06-11T13:11:22.273274Z,"('meta', 'meta', 'meta', 'metv', 'mu', 'nvda', 'pins', 'snap', 'uber')"
96339258,2026-06-11T12:42:13Z,"Here are Thursday's biggest analyst calls: SpaceX, Nvidia, Tesla, Intel, Micron, Oracle, Meta, AMD & more",https://www.cnbc.com/2026/06/11/thursdays-biggest-wall-street-analyst-calls-include-nvidia-tesla.html,Here are the biggest calls on Wall Street on Thursday.,cnbc.com,"('Breaking News: Markets', 'Communication Services', 'Consumer Cyclical', 'ETF', 'Financial Services', 'Healthcare', 'Industrials', 'Investment Strategy', 'Markets', 'Stock', 'Technology', 'Tiingo Top', 'Unknown Sector', 'Utilities')",2026-06-11T12:48:01.180701Z,"('aeis', 'ajg', 'amd', 'bkh', 'chwy', 'cnmtf', 'gd', 'hsic', 'intc', 'intc', 'iqnt', 'meta', 'meta', 'meta', 'metv', 'mu', 'mu', 'nflx', 'nflx', 'nvda', 'nvda', 'nwe', 'orcl', 'sepn', 'snse', 'spcx', 'spcx', 'tsla', 'tsla', 'twst', 'voyg', 'wms')"
96339640,2026-06-11T12:34:45Z,"State of Wyoming Decreases Position in Meta Platforms, Inc. $META",https://www.thelincolnianonline.com/2026/06/11/state-of-wyoming-decreases-position-in-meta-platforms-inc-meta.html,"State of Wyoming lowered its stake in shares of Meta Platforms, Inc. (NASDAQ:META – Free Report) by 42.4% in the 4th quarter, according to the company in its most recent 13F filing with the Securities & Exchange Commission. The fund owned 5,705 shares of the social networking company’s stock after selling 4,203 shares during the […]",thelincolnianonline.com,"('13F', '30303M10', 'Computer And Technology', 'ETF', 'Financial Services', 'Hedge Fund Holdings', 'Institutional Investor Holdings', 'Meta', 'Meta Platforms', 'Nasdaq:Meta', 'Sec Filings', 'Stock', 'Technology', 'Unknown Sector')",2026-06-11T13:01:24.073531Z,"('barl', 'bny', 'dnskf', 'meta', 'meta', 'meta', 'metv', 'ms', 'msk', 'mwg', 'mwo', 'mwr', 'stt')"
96339057,2026-06-11T12:15:00Z,4 Top Stocks I'm Buying In June,https://www.fool.com/investing/2026/06/11/4-top-stocks-im-buying-in-june/?source=iedfolrf0000001,"Three major AI and cybersecurity names just sold off after earnings, and the next move could decide whether the bull run continues.",fool.com,"('Consumer Cyclical', 'E6Ac137A-9Db4-45De-B482-7618De339F37', 'ETF', 'Goog', 'Googl', 'Investing', 'Meta', 'Nflx', 'Rddt', 'Sofi', 'Stock', 'Technology', 'Technology And Telecom', 'Unknown Sector')",2026-06-11T12:39:41.096477Z,"('goog', 'goog', 'googl', 'meta', 'meta', 'meta', 'metv', 'nflx', 'nflx', 'rddt', 'rddt', 'sofi')"
96338439,2026-06-11T12:10:22Z,SpaceX IPO won’t ‘break’ the bull market. But investors are worried about what comes next,https://www.cnbc.com/2026/06/11/spacex-ipo-wont-break-the-bull-market-but-investors-are-worried-about-what-comes-next.html,"As far as Wall Street is concerned, the stock market has what it takes to absorb the new supply.",cnbc.com,"('Breaking News: Investing', 'Breaking News: Markets', 'Business', 'Consumer Cyclical', 'ETF', 'Markets', 'Stock', 'Stock Markets', 'Technology', 'Tiingo Top', 'Unknown Sector', 'Wall Street')",2026-06-11T12:18:29.043489Z,"('amzn', 'amzn', 'googl', 'meta', 'meta', 'meta', 'metv', 'nvda', 'nvda', 'spcx', 'spcx', 'ssssl')"
96338115,2026-06-11T12:00:02Z,"As OpenAI leans into enterprise business, Apple and Google set sights on the masses",https://www.cnbc.com/2026/06/11/as-openai-leans-into-enterprise-apple-and-google-target-consumer-ai.html,"OpenAI's aggressive push into the enterprise, where it competes with Anthropic, coincides with efforts by Apple and Google to bring advanced AI to consumers.",cnbc.com,"('Breaking News: Technology', 'Business', 'Computing', 'ETF', 'Entertainment', 'Financial Services', 'Internet', 'Stock', 'Technology', 'Unknown Sector', 'Wireless')",2026-06-11T12:06:22.968064Z,"('aapl', 'aapl', 'goog', 'goog', 'googl', 'igv', 'jpm', 'jpm', 'meta', 'meta', 'meta', 'metv', 'msft', 'msft', 'nvda', 'nvda', 'xlk')"
96338114,2026-06-11T12:00:02Z,"SpaceX soon-to-be millionaires are set to spend big on luxury homes, watches and private jet travel",https://www.cnbc.com/2026/06/11/spacex-millionaires-wealth-spending.html,"SpaceX employees have to wait to sell their shares, but many are already planning how to spend their windfalls.",cnbc.com,"('Breaking News: Technology', 'Business', 'Computing', 'Consumer Cyclical', 'ETF', 'Internet', 'Ipo', 'Stock', 'Technology', 'Unknown Sector', 'Wireless')",2026-06-11T12:06:22.248126Z,"('ipo', 'meta', 'meta', 'meta', 'metv', 'spcx', 'tsla', 'tsla')"
96354167,2026-06-11T11:59:00Z,Meta launches $115M data center construction training pilot in Houston,https://finance.yahoo.com/sectors/technology/articles/meta-launches-115m-data-center-115900342.html,Houston is among four cities part of Meta's new pilot program.,finance.yahoo.com,"('Arsenal', 'Construction', 'Construction Workers', 'Data Center', 'ETF', 'Meta', 'Pilot Training Program', 'Stock', 'Technology', 'Training Program', 'Unknown Sector')",2026-06-11T21:45:46.019283Z,"('meta', 'meta', 'meta', 'metv')"
96336946,2026-06-11T11:19:51Z,Canada considering social media ban for kids under 16 in global effort to tighten online protections,https://nypost.com/2026/06/11/world-news/canada-considering-social-media-ban-for-kids-under-16-in-global-effort-to-tighten-online-protections/,Canada is joining a growing global effort to tighten safety protections.,nypost.com,"('Canada', 'Children', 'Cyber Bullying', 'ETF', 'Meta', 'Social Media', 'Stock', 'Technology', 'Unknown Sector')",2026-06-11T11:20:51.368925Z,"('meta', 'meta', 'meta', 'metv')"
96337304,2026-06-11T11:03:45Z,Wall Street’s $800 Billion AI Data Center Bet Is Showing Cracks. Only 84 of 157 Gigawatts Will Be Built by 2030,https://finance.yahoo.com/sectors/technology/articles/wall-street-800-billion-ai-110345432.html,"Although Wall Street has rewarded every hyperscaler willing to pledge more silicon, more concrete, and more megawatts over the past 24 months, the math behind the AI data center boom is finally drawing scrutiny. Combined 2026 capital expenditure guidance from Alphabet (NASDAQ:GOOGL), Meta Platforms (NASDAQ:META), Amazon (NASDAQ:AMZN), and Microsoft (NASDAQ:MSFT) now sums to roughly $800 ... Wall Street’s $800 Billion AI Data Center Bet Is Showing Cracks. Only 84 of 157 Gigawatts Will Be Built by",finance.yahoo.com,"('Amazon', 'Consumer Cyclical', 'Data Centers', 'ETF', 'Earnings Report', 'Earnings Reports', 'Father Robert Balassare', 'Financial Services', 'Free Cash Flow', 'Meta', 'Microsoft', 'Nvidia', 'Stock', 'Technology', 'Top 10 Ai Stocks', 'Unknown Sector', 'Wall Street')",2026-06-11T11:34:39.242383Z,"('amzn', 'brk-a', 'brk-b', 'csco', 'goog', 'googl', 'jhg', 'meta', 'meta', 'meta', 'metv', 'msft', 'nvda')"
96335418,2026-06-11T10:19:29Z,"Anthropic, OpenAI, other U.S. AI giants launch major London expansions amid talent and revenue scramble",https://www.cnbc.com/2026/06/11/anthropic-openai-london-expansions-big-tech.html,The U.K. capital has become a key growth target for many of the world's most talked about AI companies.,cnbc.com,"('Breaking News: Technology', 'Business', 'Computing', 'ETF', 'Entertainment', 'Internet', 'Stock', 'Technology', 'Unknown Sector', 'Wireless')",2026-06-11T10:25:27.355824Z,"('crm', 'googl', 'meta', 'meta', 'meta', 'metv', 'msft', 'msft', 'pltr', 'pltr', 'rivn')"
96334812,2026-06-11T09:56:19Z,Meta Smartwatch Due September 23: Malibu 2 Doubles as Gesture Hub for Ray-Ban AI Glasses,https://www.techtimes.com/articles/318198/20260611/meta-smartwatch-due-september-23-malibu-2-doubles-gesture-hub-ray-ban-ai-glasses.htm,"Meta smartwatch Malibu 2 is scheduled to debut at Meta Connect 2026 on September 23, paired with updated Hypernova 2 Ray-Ban AI glasses. The watch is expected to absorb the sEMG gesture-control function of the Neural Band, add continuous wearable health tracking, and work across both iOS and",techtimes.com,"('Ai', 'Apple Watch', 'ETF', 'Financial Services', 'Meta', 'Meta Connect', 'Meta Malibu 2', 'Ray-Ban', 'Smartwatch', 'Stock', 'Technology', 'Unknown Sector', 'Wearable Tech', 'Wearables')",2026-06-11T09:58:06.635626Z,"('aaic', 'ai', 'ai', 'goog', 'googl', 'grmn', 'meta', 'meta', 'meta', 'metv')"
96334308,2026-06-11T09:06:00Z,History Offers a $974 Billion Warning Ahead of the Game-Changing SpaceX IPO,https://www.fool.com/investing/2026/06/11/history-offer-974-billion-warning-ahead-spacex-ipo/?source=iedfolrf0000001,"Caveat emptor, retail investors!",fool.com,"('Arm', 'Consumer Cyclical', 'Crwv', 'E6174054-9521-4976-A5Fb-C78Cb2024B2B', 'ETF', 'Financial Services', 'Industrials', 'Investing', 'Meta', 'Ndaq', 'Pltr', 'Stock', 'Technology', 'Tfc', 'Tsla', 'Unknown Sector', '^Dji', '^Gspc', '^Ixic')",2026-06-11T09:33:32.698560Z,"('arm', 'arm', 'crwv', 'crwv', 'meta', 'meta', 'meta', 'metv', 'ndaq', 'pltr', 'pltr', 'tfc', 'tsla', 'tsla')"
96334202,2026-06-11T09:00:08Z,Inside Meta’s Indianapolis bootcamp for data center technicians,https://finance.yahoo.com/sectors/technology/articles/inside-meta-indianapolis-bootcamp-data-090008113.html,Meta pledged $115 million Tuesday toward a bootcamp in Indianapolis where the company will train thousands of technicians to build the physical infrastructure of AI. The company calls it the “largest private-sector commitment to the skilled trades with a job guarantee in American history.” America’s Workforce Academy will pay trainees while they earn industry-recognized credentials […],finance.yahoo.com,"('America’S Workforce Academy', 'Arsenal', 'Construction', 'Data Center', 'ETF', 'India', 'Indianapolis', 'Installation Technicians', 'Meta', 'North America', 'Skilled Trades', 'Skilled Workers', 'Stock', 'Technology', 'Unknown Sector', 'Workforce Academy')",2026-06-11T09:27:58.015608Z,"('meta', 'meta', 'meta', 'metv')"
96333495,2026-06-11T08:12:00Z,Should You Buy the SpaceX IPO? History Says the Stock Will Make a Big Move in the First Year.,https://www.fool.com/investing/2026/06/11/buy-spacex-ipo-stock-make-big-move-first-year/?source=iedfolrf0000001,"Historically, large IPO stocks have often declined during their first year on the public market.",fool.com,"('20977Bbe-D982-485D-Af0A-6F58F0F76078', 'Coin', 'Communication Services', 'Consumer Defensive', 'Cpng', 'ETF', 'Gm', 'Goog', 'Googl', 'Investing', 'Kvue', 'Mdlz', 'Meta', 'Pltr', 'Spcx', 'Stock', 'Technology', 'Technology And Telecom', 'Uber', 'Unknown Sector', 'Ups', 'V', 'Vg', '^Gspc', '^Ixic')",2026-06-11T08:37:31.030351Z,"('coin', 'coin', 'cpng', 'goog', 'goog', 'googl', 'kvue', 'mdlz', 'meta', 'meta', 'meta', 'metv', 'pltr', 'pltr', 'spcx', 'spcx', 'uber', 'uber', 'ups', 'vg', 'vg', 'vg')"
96330436,2026-06-11T03:30:11Z,"Virginia Lottery Powerball, Pick 3 Night results for June 10, 2026",https://www.aol.com/news/virginia-lottery-powerball-pick-3-033011518.html,Check your tickets for Virginia daily lottery draw games here.,aol.com,"('ETF', 'Fb', 'Powerball Drawings', 'Stock', 'Technology', 'Unknown Sector', 'Virginia Lottery')",2026-06-11T04:05:15.399911Z,"('fb', 'meta')"
96330444,2026-06-11T03:30:11Z,"Virginia Lottery Powerball, Pick 3 Night results for June 10, 2026",https://www.aol.com/news/virginia-lottery-powerball-pick-3-033011663.html,Check your tickets for Virginia daily lottery draw games here.,aol.com,"('ETF', 'Fb', 'Powerball Drawings', 'Stock', 'Technology', 'Unknown Sector', 'Virginia Lottery')",2026-06-11T04:05:22.710719Z,"('fb', 'meta')"
96330401,2026-06-11T03:30:07Z,"Florida Lottery Powerball, Fantasy 5 results for June 10, 2026",https://www.aol.com/news/florida-lottery-powerball-fantasy-5-033007071.html,Check your tickets for Florida daily lottery draw games here.,aol.com,"('ETF', 'Fb', 'Florida Lottery', 'Stock', 'Technology', 'Unknown Sector', 'Winning Fantasy 5 Numbers', 'Winning Pick 3 Numbers', 'Winning Pick 4 Numbers')",2026-06-11T04:03:23.692119Z,"('fb', 'meta')"
96330323,2026-06-11T03:22:00Z,3 Beaten-Down AI Chip Stocks Worth a Closer Look After the Sell-Off,https://www.fool.com/investing/2026/06/10/3-beaten-down-ai-chip-stocks-worth-a-closer-look-a/?source=iedfolrf0000001,"After one of the sharpest pullbacks the AI chip trade has ever seen, three of the sector's leaders are suddenly trading well below their recent highs.",fool.com,"('3Cddad2F-313C-40B0-Aac9-8C280Cf7F062', 'Amd', 'Avgo', 'ETF', 'Investing', 'Meta', 'Nvda', 'Stock', 'Technology', 'Technology And Telecom', 'Unknown Sector')",2026-06-11T03:53:37.472535Z,"('amd', 'avgo', 'avgo', 'meta', 'meta', 'meta', 'metv', 'nvda', 'nvda')"
