id,publishedDate,title,url,description,source,tags,crawlDate,tickers
96865257,2026-07-01T14:58:19.740508Z,Meta Platforms (META) Sees Stock Surge Amid Cloud Infrastructure Plans,https://www.gurufocus.com/news/8941214/meta-platforms-meta-sees-stock-surge-amid-cloud-infrastructure-plans,,gurufocus.com,"('ETF', 'Stock', 'Technology', 'Unknown Sector')",2026-07-01T14:58:20.579037Z,"('meta', 'meta', 'meta', 'metv')"
96865554,2026-07-01T14:58:14Z,A Social Media Company Just Settled With a Teen Who Claimed The App Made Him An Addict. More Are Coming Next.,https://www.ibtimes.com/social-media-company-just-settled-teen-who-claimed-app-made-him-addict-more-are-coming-next-3804783,TikTok has settled a lawsuit brought by a Florida 15-year-old who claimed the platform contributed to serious mental health problems.,ibtimes.com,"('ETF', 'Google', 'Law', 'Meta', 'Social Media', 'Social Media Ban', 'Social Media Lawsuit', 'Stock', 'Technology', 'Tiktok', 'Unknown Sector', 'Youtube')",2026-07-01T15:01:31.109528Z,"('goog', 'googl', 'law', 'meta', 'meta', 'meta', 'metv')"
96866260,2026-07-01T14:57:21Z,Meta Stock Price Prediction: The Forecast Sees a Path to $800+,https://finance.yahoo.com/markets/stocks/articles/meta-stock-price-prediction-forecast-145721941.html,"Meta Platforms (NASDAQ:META) has had a rough first half of 2026, but our model sees a compelling risk-reward setup in mega-cap tech. With shares down 16.5% year to date and the AI capex narrative dividing investors, the pullback has gone too far. Our 24/7 Wall St. price target for Meta is $796.59, implying 44.77% upside ... Meta Stock Price Prediction: The Forecast Sees a Path to $800+",finance.yahoo.com,"('ETF', 'Meta', 'Price Target', 'Stock', 'Technology', 'Top 10 Ai Stocks', 'Unknown Sector', 'Wall St.')",2026-07-01T15:19:22.805780Z,"('brcm', 'meta', 'meta', 'meta', 'metv', 'nvda')"
96865372,2026-07-01T14:55:36Z,Meta Platforms (META) Shares Surge on Cloud Business Development News,https://www.gurufocus.com/news/8941040/meta-platforms-meta-shares-surge-on-cloud-business-development-news,,gurufocus.com,"('ETF', 'Stock', 'Technology', 'Unknown Sector')",2026-07-01T14:58:58.879464Z,"('meta', 'meta', 'meta', 'metv')"
96865498,2026-07-01T14:46:24Z,"Meta Is Looking To Go The SpaceX Way, Could Rent Out AI Infrastructure – META Stock Sees Biggest Single-Day Gains In Over 5 Months",https://finance.yahoo.com/technology/ai/articles/meta-looking-spacex-way-could-144624368.html,"According to a Bloomberg report, Meta is preparing to enter the AI cloud infrastructure market by selling AI computing power, in a bid to take on Amazon and Microsoft.",finance.yahoo.com,"('Cloud Computing', 'Computing Power', 'ETF', 'Mark Zuckerberg', 'Meta', 'Stock', 'Technology', 'Unknown Sector')",2026-07-01T15:00:27.787036Z,"('meta', 'meta', 'meta', 'metv', 'msft')"
96866671,2026-07-01T14:45:49Z,"Meta’s AI reads typed sentences from the brain, no surgery required",https://thenextweb.com/news/meta-brain2qwerty-v2-non-invasive-brain-to-text,"Meta's Brain2Qwerty v2 decodes typed sentences from brain scans at 61% accuracy with no implant. The catch: it's room-sized, not real-time, and lab-bound.",thenextweb.com,"('Artificial Intelligence', 'Deep Tech', 'ETF', 'Health Tech', 'Meta', 'Neural Basics', 'Science', 'Stock', 'Technology', 'Tiingo Top', 'United States', 'Unknown Sector')",2026-07-01T15:32:35.583884Z,"('meta', 'meta', 'meta', 'metv')"
96873111,2026-07-01T14:28:09Z,"Meta contractors posed as teens to test rival AI chatbots on suicide, sex and drugs: report",https://www.aol.com/news/meta-contractors-posed-teens-test-142809092.html,"The covert effort was managed by Meta contractor Covalen and targeted OpenAI’s ChatGPT, Google’s Gemini and Character.AI, according to Wired.",aol.com,"('Contractors', 'ETF', 'Meta', 'Stock', 'Technology', 'Unknown Sector')",2026-07-01T18:55:53.246645Z,"('goog', 'googl', 'meta', 'meta', 'meta', 'metv')"
96864375,2026-07-01T14:28:09Z,"Meta contractors posed as teens to test rival AI chatbots on suicide, sex and drugs: report",https://nypost.com/2026/07/01/business/meta-contractors-posed-as-teens-to-test-rival-ai-chatbots-on-suicide-sex-and-drugs-report/,"The covert effort was managed by Meta contractor Covalen and targeted OpenAI’s ChatGPT, Google’s Gemini and Character.AI, according to Wired.",nypost.com,"('Artificial Intelligence', 'Chatgpt', 'ETF', 'Facebook', 'Meta', 'Openai', 'Stock', 'Technology', 'Unknown Sector')",2026-07-01T14:29:22.286476Z,"('goog', 'googl', 'meta', 'meta', 'meta', 'metv')"
96873617,2026-07-01T14:28:09Z,"Meta contractors posed as teens to test rival AI chatbots on suicide, sex and drugs: report",https://www.aol.com/news/meta-contractors-posed-teens-test-142809386.html,"The covert effort was managed by Meta contractor Covalen and targeted OpenAI’s ChatGPT, Google’s Gemini and Character.AI, according to Wired.",aol.com,"('Contractors', 'ETF', 'Meta', 'Stock', 'Technology', 'Unknown Sector')",2026-07-01T19:16:57.830094Z,"('goog', 'googl', 'meta', 'meta', 'meta', 'metv')"
96863936,2026-07-01T14:15:03Z,Meta pops 8% as company makes cloud push to sell excess AI compute power capacity,https://www.cnbc.com/2026/07/01/meta-stock-cloud-ai-compute.html,The new business is a welcome signal for some investors who have been uneasy about the company's infrastructure spending plans.,cnbc.com,"('Breaking News: Business', 'Breaking News: Technology', 'Business', 'Consumer Cyclical', 'ETF', 'Enterprise', 'Entertainment', 'Internet', 'Media', 'Publishing', 'Stock', 'Technology', 'Television', 'Unknown Sector')",2026-07-01T14:18:21.809605Z,"('amzn', 'amzn', 'crwv', 'crwv', 'googl', 'meta', 'meta', 'meta', 'metv', 'msft', 'msft', 'spcx', 'spcx')"
96864763,2026-07-01T14:11:41Z,CoreWeave and Nebius shares slide after Meta cloud expansion report (CRWV),https://finance.yahoo.com/technology/ai/articles/coreweave-nebius-shares-slide-meta-141141929.html,Meta’s reported plans weigh on AI infrastructure providersShares of CoreWeave (NASDAQ:CRWV) and Nebius Group (NASDAQ:NBIS) fell more than 6% on Wednesday after a Bloomberg report suggested that Meta Platforms is preparing to expand into the cloud infrastructure market. The report indicated that Meta is exploring ways to commercialise its artificial intelligence infrastructure by offering customers access to AI computing resources and foundation models.,finance.yahoo.com,"('Cloud Computing', 'Computing Resources', 'ETF', 'Meta', 'Nebius Group', 'Stock', 'Technology', 'Unknown Sector')",2026-07-01T14:40:20.927980Z,"('crwv', 'meta', 'meta', 'meta', 'metv', 'nbis')"
96866167,2026-07-01T13:45:06Z,Here's Why Meta Platforms (META) is a Strong Growth Stock,https://www.zacks.com/stock/news/2946147/here-s-why-meta-platforms-meta-is-a-strong-growth-stock?cid=CS-ZC-FT-tale_of_the_tape%7Czacks_education_growth_score-2946147,,zacks.com,"('ETF', 'Stock', 'Tale Of The Tape', 'Technology', 'Unknown Sector')",2026-07-01T15:17:51.800355Z,"('meta', 'meta', 'meta', 'metv')"
96866171,2026-07-01T13:44:00Z,Will Nebius' Strong Customer Pipeline Drive Future Growth?,https://www.zacks.com/stock/news/2946156/will-nebius-strong-customer-pipeline-drive-future-growth?cid=CS-ZC-FT-analyst_blog%7Cquick_take-2946156,,zacks.com,"('Analyst Blog', 'ETF', 'Stock', 'Technology', 'Unknown Sector')",2026-07-01T15:17:53.386610Z,"('crwv', 'crwv', 'meta', 'meta', 'meta', 'metv', 'msft', 'msft', 'nbis')"
96863455,2026-07-01T13:37:43Z,Meta shares jump on plans to commercialise excess AI computing capacity,https://finance.yahoo.com/technology/ai/articles/meta-shares-jump-plans-commercialise-133743750.html,"Report says Meta is preparing a move into cloud infrastructureShares of Meta Platforms (NASDAQ:META) climbed as much as 8% on Wednesday after a Bloomberg report said the company is preparing to enter the cloud infrastructure market by offering customers access to surplus artificial intelligence computing resources. If launched, the initiative would place Meta in direct competition with leading cloud providers including Amazon Web Services (AWS), Microsoft Azure and Google Cloud Platform (GCP), w",finance.yahoo.com,"('Amazon Web Services', 'Cloud Infrastructure', 'Computing Resources', 'ETF', 'Meta', 'Stock', 'Technology', 'Unknown Sector')",2026-07-01T14:05:13.451277Z,"('goog', 'googl', 'meta', 'meta', 'meta', 'metv', 'msft')"
96863126,2026-07-01T13:32:28Z,Meta Is About to Make Its Next Billion-Dollar Bet. Wall Street Thinks It Could Be Huge,https://finance.yahoo.com/technology/ai/articles/meta-next-billion-dollar-bet-133228818.html,"The artificial intelligence race has become a contest of infrastructure as much as software. Amazon (NASDAQ:AMZN), Microsoft (NASDAQ:MSFT), and Alphabet (NASDAQ:GOOG) have each built cloud businesses that generate tens of billions of dollars in annual revenue by renting computing power to other companies. Meta Platforms (NASDAQ:META) has taken a different approach, spending heavily to build ... Meta Is About to Make Its Next Billion-Dollar Bet. Wall Street Thinks It Could Be Huge",finance.yahoo.com,"('Ai Company', 'Consumer Cyclical', 'ETF', 'Infrastructure', 'Mark Zuckerberg', 'Meta', 'Stock', 'Technology', 'Top 10 Ai Stocks', 'Unknown Sector')",2026-07-01T13:54:43.053768Z,"('amzn', 'goog', 'googl', 'meta', 'meta', 'meta', 'metv', 'msft', 'nvda')"
96862602,2026-07-01T13:21:00Z,Meta turns its AI spending spree into a business of its own,https://finance.yahoo.com/technology/ai/articles/meta-turns-ai-spending-spree-132100296.html,"Meta Platforms Inc's (NASDAQ:META, XETRA:FB2A, SIX:FB) plan to sell spare computing power is less a bold expansion than an admission, that the company has built so much AI capacity it now needs somewhere to put the surplus. The Facebook and Instagram owner has spent heavily on data centres...",finance.yahoo.com,"('Cloud Infrastructure', 'Data Centres', 'ETF', 'Meta', 'Service Business', 'Spending Spree', 'Stock', 'Technology', 'Unknown Sector')",2026-07-01T13:39:39.236428Z,"('meta', 'meta', 'meta', 'metv', 'msft')"
96861705,2026-07-01T13:19:13Z,Jim Cramer's top 10 things to watch in the stock market Wednesday,https://www.cnbc.com/2026/07/01/jim-cramers-top-10-things-to-watch-in-the-stock-market-wednesday.html,"Meta reportedly plans a cloud business, and Micron expect more long-term memory agreements.",cnbc.com,"('Basic Materials', 'Breaking News: Markets', 'Consumer Cyclical', 'ETF', 'Financial Services', 'Industrials', 'Investment Strategy', 'Markets', 'Stock', 'Technology', 'Tiingo Top', 'Unknown Sector')",2026-07-01T13:21:25.920239Z,"('afrm', 'bld', 'crm', 'crwd', 'crwd', 'fdx', 'fdxf', 'meta', 'meta', 'meta', 'metv', 'mu', 'mu', 'nke', 'nke', 'panw', 'panw', 'payx', 'qxo', 'wfc', 'wfc')"
96862278,2026-07-01T13:05:24Z,"Microsoft Plans to Cut 5,500 Jobs in Latest Cost-Cutting Round",https://www.gurufocus.com/news/8940399/microsoft-plans-to-cut-5500-jobs-in-latest-costcutting-round,,gurufocus.com,"('Consumer Cyclical', 'ETF', 'Stock', 'Technology', 'Unknown Sector')",2026-07-01T13:31:33.141934Z,"('amzn', 'amzn', 'meta', 'meta', 'meta', 'metv', 'msft', 'msft')"
96861186,2026-07-01T12:57:00Z,Micron’s Run Looks Unstoppable. Here’s the One Number We’re Watching.,https://investorplace.com/hypergrowthinvesting/2026/07/microns-run-looks-unstoppable-heres-the-one-number-were-watching/,"Luke Lango breaks down the AI memory boom with Matt Weinschenk, including why this cycle differs from past ones, and the single signal that will tell him when it's time to get out.",investorplace.com,"(':Sndk', 'Amd', 'Amzn', 'Consumer Cyclical', 'Dell', 'ETF', 'Googl', 'Hot Stocks', 'Intc', 'Meta', 'Msft', 'Mu', 'Nasdaq:Amd', 'Nasdaq:Amzn', 'Nasdaq:Googl', 'Nasdaq:Intc', 'Nasdaq:Meta', 'Nasdaq:Msft', 'Nasdaq:Mu', 'Nasdaq:Nvda', 'Nasdaq:Qcom', 'Nasdaq:Smci', 'Nasdaq:Stx', 'Nvda', 'Nyse:Dell', 'Qcom', 'Smci', 'Stock', 'Stx', 'Technology', 'Unknown Sector')",2026-07-01T13:09:18.376043Z,"('amd', 'amd', 'amzn', 'amzn', 'dell', 'dell', 'googl', 'intc', 'intc', 'meta', 'meta', 'meta', 'metv', 'msft', 'msft', 'mu', 'mu', 'nvda', 'nvda', 'qcom', 'qcom', 'smci', 'smci', 'stx')"
96858607,2026-07-01T11:31:23Z,Meta Explores Acquiring Kalshi for Prediction Market Development,https://www.gurufocus.com/news/8940438/meta-explores-acquiring-kalshi-for-prediction-market-development,,gurufocus.com,"('ETF', 'Stock', 'Technology', 'Unknown Sector')",2026-07-01T12:01:28.104239Z,"('meta', 'meta', 'meta', 'metv')"
96860966,2026-07-01T10:25:02Z,"Meta Platforms, Inc. $META Shares Sold by Venturi Wealth Management LLC",https://www.thelincolnianonline.com/2026/07/01/meta-platforms-inc-meta-shares-sold-by-venturi-wealth-management-llc.html,"Venturi Wealth Management LLC lowered its stake in shares of Meta Platforms, Inc. (NASDAQ:META – Free Report) by 36.7% during the first quarter, according to the company in its most recent disclosure with the Securities and Exchange Commission. The institutional investor owned 29,963 shares of the social networking company’s stock after selling 17,388 shares during […]",thelincolnianonline.com,"('13F', '30303M10', 'Computer And Technology', 'ETF', 'Financial Services', 'Hedge Fund Holdings', 'Institutional Investor Holdings', 'Meta', 'Meta Platforms', 'Nasdaq:Meta', 'Sec Filings', 'Stock', 'Technology', 'Unknown Sector')",2026-07-01T13:06:00.131472Z,"('meta', 'meta', 'meta', 'metv', 'mfg', 'rjd', 'rjf')"
96853976,2026-07-01T08:00:00Z,Bull of the Day: Quanta Services (PWR),https://www.zacks.com/commentary/2945546/bull-of-the-day-quanta-services-pwr?cid=CS-ZC-FT-bull_of_the_day-2945546,,zacks.com,"('Bull Of The Day', 'ETF', 'Industrials', 'Stock', 'Technology', 'Unknown Sector')",2026-07-01T09:19:20.110345Z,"('googl', 'meta', 'meta', 'meta', 'metv', 'msft', 'msft', 'nvda', 'nvda', 'pwr', 'pwr')"
96852488,2026-07-01T07:29:00Z,Here's Where Oklo Will Be in 5 Years (And Why You Should Buy Right Now),https://www.fool.com/investing/2026/07/01/heres-where-oklo-will-be-in-5-years-and-why-you-sh/?source=iedfolrf0000001,"With a large backlog of orders and skyrocketing demand for energy, Oklo is well-positioned to takeoff in the next half-decade.",fool.com,"('70Ea9864-20Cb-4540-99Ae-A8A7De91C7E0', 'And Utilities', 'ETF', 'Energy', 'Investing', 'Materials', 'Meta', 'Oklo', 'Stock', 'Technology', 'Unknown Sector')",2026-07-01T08:02:38.442676Z,"('meta', 'meta', 'meta', 'metv', 'oklo')"
96852125,2026-07-01T07:26:21Z,Judge clears states to try claim that Meta hooked children on Facebook and Instagram,https://thenextweb.com/news/meta-addiction-states-lawsuit-dismissal-denied,"A US judge refused to toss claims from 29 states that Meta addicted children, and handed the states an early win on child-privacy law.",thenextweb.com,"('ETF', 'Legal', 'Meta', 'Stock', 'Technology', 'Tiingo Top', 'Unknown Sector')",2026-07-01T07:37:20.351172Z,"('goog', 'googl', 'meta', 'meta', 'meta', 'metv')"
96851411,2026-07-01T06:33:43Z,"Corruption cases, investibility warnings, fiscal woes: Indonesia continues to test investors",https://www.cnbc.com/2026/07/01/corruption-cases-investibility-warnings-indonesia-tests-investors.html,This comes amid a high-profile corruption sentencing and an MSCI warning Indonesia could be downgraded to frontier-market status.,cnbc.com,"('Asia Economy', 'ETF', 'Indonesia', 'Stock', 'Technology', 'Tiingo Top', 'Unknown Sector')",2026-07-01T06:37:15.653403Z,"('googl', 'meta', 'meta', 'meta', 'metv')"
96853905,2026-07-01T04:58:49Z,Microsoft may cut thousands more jobs in a bid to control costs,https://fortune.com/2026/07/01/microsoft-may-cut-thousands-more-jobs-control-costs/,"Plus: Amazon, Anthropic, Apple, Cognite, Epic Games, Google, Meta, OpenAI, Schneider Electric, SpaceX.",fortune.com,"('Affirm', 'Alphabet', 'Amazon', 'American Express', 'Anthropic', 'Apple', 'Blackrock', 'Discover', 'ETF', 'Epic Games', 'Fortune Tech', 'Google', 'Ibm', 'Industrials', 'Intercontinental Exchange', 'Klarna', 'Mastercard', 'Mental Health', 'Meta', 'Microsoft', 'Microsoft Xbox', 'No Copyright', 'Openai', 'Ripple', 'Schneider Electric', 'Shopify', 'Snap', 'Social Media', 'Sofi', 'Spacex', 'Stablecoin', 'Stablecoins', 'Stock', 'Stripe', 'Technology', 'Tiktok', 'Unknown Sector', 'Visa', 'Western Union')",2026-07-01T09:16:17.304872Z,"('goog', 'googl', 'ibm', 'meta', 'meta', 'meta', 'metv', 'msft', 'sbgsy', 'snap', 'sofi', 'visa')"
96848268,2026-07-01T02:31:15Z,Fear and anger brew inside Meta amid AI frenzy,https://finance.yahoo.com/technology/ai/articles/fear-anger-brew-inside-meta-023115225.html,"A frenzied push for artificial intelligence dominance comes with a different kind of cost for Meta, where massive layoffs, employee surveillance and departures have fueled reports of a heated internal climate.For those who remain, an internal AI training initiative has drawn accusations of surveillance.",finance.yahoo.com,"('Ai Capabilities', 'Artificial Intelligence', 'ETF', 'Meta', 'Stock', 'Technology', 'Unknown Sector')",2026-07-01T02:49:08.461271Z,"('goog', 'googl', 'meta', 'meta', 'meta', 'metv')"
96848109,2026-07-01T02:29:20Z,5 Phrases That Quietly Damage Employee Morale,https://www.forbes.com/sites/katewieczorek/2026/06/30/5-phrases-that-quietly-damage-employee-morale/,"Meta's CTO recently acknowledged the company's ""worst-ever"" morale, highlighting how leadership communication impacts employee sentiment. ",forbes.com,"('Andrew Bosworth', 'Business', 'C-Suite', 'Corporations', 'Cto', 'ETF', 'Leadership', 'Leadership Strategy', 'Meta', 'Stock', 'Technology', 'Toxic Workplace', 'Unknown Sector', 'Work Culture')",2026-07-01T02:30:40.732508Z,"('meta', 'meta', 'meta', 'metv')"
96848038,2026-07-01T02:23:55Z,Daily Open: AI demand fuels investors' portfolios while oil posts biggest monthly decline,https://www.cnbc.com/2026/07/01/cnbc-daily-open-ai-demand-fuels-investors-portfolio-while-oil-posts-biggest-monthly-decline.html,"The tech space continues to be fueled by rising artificial intelligence demand, with investors piling their portfolios in the technology, while Amazon Web Services dabbles with Forward Deployed Engineering units to better compete with  OpenAI and Anthropic.",cnbc.com,"('Consumer Cyclical', 'ETF', 'Markets', 'Stock', 'Technology', 'Tiingo Top', 'Unknown Sector', 'World Markets')",2026-07-01T02:26:35.455502Z,"('amd', 'amzn', 'amzn', 'arm', 'arm', 'botz', 'googl', 'intc', 'intc', 'lit', 'lit', 'meta', 'meta', 'meta', 'metv', 'mrvl', 'mrvl', 'msft', 'msft', 'mu', 'mu', 'nke', 'nke', 'nvda', 'nvda', 'soxx', 'xlk', 'xsd')"
96847905,2026-07-01T01:52:13Z,"The Best ""Magnificent Seven"" Stock to Buy Right Now?",https://www.fool.com/investing/2026/06/30/the-best-magnificent-seven-stock-to-buy-right-now/?source=iedfolrf0000001,Investors are hopeful the performance of this group of stocks will improve.,fool.com,"('33Ff6A3B-Ee09-4A24-892E-F5114Fd805Bb', 'Aapl', 'Amzn', 'Consumer Cyclical', 'ETF', 'Goog', 'Googl', 'Investing', 'Meta', 'Msft', 'Nvda', 'Stock', 'Technology', 'Technology And Telecom', 'Tsla', 'Unknown Sector')",2026-07-01T02:20:28.382999Z,"('aapl', 'aapl', 'amzn', 'amzn', 'goog', 'goog', 'googl', 'meta', 'meta', 'meta', 'metv', 'msft', 'msft', 'nvda', 'nvda', 'tsla', 'tsla')"
96847141,2026-07-01T01:32:41Z,"South Korea ‘fake news’ law triggers free speech, censorship fears",https://www.scmp.com/news/asia/east-asia/article/3358967/south-korea-fake-news-law-triggers-free-speech-censorship-fears,"The scope extends beyond social media to malicious reviews and defamatory posts on online communities, delivery apps and shopping platforms.",scmp.com,"('Article 58', 'Coupang', 'Daejang-Dong Development Scandal', 'Digital Services Act', 'ETF', 'Europe', 'Facebook', 'Google', 'Heimtuckegesetz', 'Instagram', 'Kakao', 'Korea Media And Communications Commission', 'Meta', 'Naver', 'South Korea', 'Stock', 'Technology', 'The Korea Times', 'Unknown Sector')",2026-07-01T01:33:53.808982Z,"('goog', 'googl', 'meta', 'meta', 'meta', 'metv')"
96845587,2026-07-01T00:01:00Z,"NIPPON KINZOKU Introduces New ""Decorative Stainless Steel Finishes for Exterior Use"" Achieving Diverse Metallic Designs from Mirror-Like to Jet Black",https://finance.yahoo.com/technology/articles/nippon-kinzoku-introduces-decorative-stainless-000100380.html,"TOKYO, July 01, 2026--NIPPON KINZOKU CO., LTD. (Headquarters: Minato-ku, Tokyo; President: Yasushi Shimokawa; TOKYO: 5491), a leading manufacturer of cold-rolled stainless steel, today introduced its new ""Decorative Stainless Steel Finishes for Exterior Use."" These premium cold-rolled stainless steel strips—extensively used in automotive moldings and telecommunications enclosures—are engineered to help manufacturers eliminate post-processing steps such as polishing and painting, while significan",finance.yahoo.com,"('Business Wire', 'ETF', 'Fb', 'Fine Black', 'Nippon Kinzoku', 'Pearly White', 'Proprietary Technology', 'Stock', 'Technology', 'Unknown Sector')",2026-07-01T00:15:57.001624Z,"('fb', 'meta')"
