id,publishedDate,title,url,description,source,tags,crawlDate,tickers
97229799,2026-07-15T08:50:10Z,"26 Meta employees accuse Mark Zuckerberg of using AI to target 8,000 layoffs against workers on medical, parental or family leave",https://fortune.com/2026/07/15/meta-workers-sue-over-ai-layoff-math/,"They went on parental and medical leave, then watched AI‑fed dashboards mark their output down, the lawsuit claims.",fortune.com,"('ETF', 'Layoffs', 'Meta', 'Stock', 'Technology', 'Unknown Sector')",2026-07-15T12:59:21.360521Z,"('meta', 'meta', 'meta', 'metv')"
97223323,2026-07-15T08:37:50Z,Meta sued over claims AI penalized workers who took maternity leave,https://www.aol.com/news/meta-sued-over-claims-ai-083750301.html,"A group of 26 Meta employees has sued the company, claiming it used artificial intelligence systems that disproportionately targeted those on medical or family leave for layoffs",aol.com,"('Artificial Intelligence', 'Bereavement Leave', 'Disability Accommodations', 'ETF', 'Family Caregiving', 'Family Leave', 'Meta', 'Performance Rankings', 'Pregnancy Discrimination Act', 'Stock', 'Technology', 'Unknown Sector')",2026-07-15T09:02:00.771663Z,"('meta', 'meta', 'meta', 'metv')"
97222856,2026-07-15T08:30:30.574409Z,Meta Faces Legal Action Over Alleged AI Discrimination in Layoffs,https://www.gurufocus.com/news/8959487/meta-faces-legal-action-over-alleged-ai-discrimination-in-layoffs,,gurufocus.com,"('ETF', 'Stock', 'Technology', 'Unknown Sector')",2026-07-15T08:30:30.892765Z,"('meta', 'meta', 'meta', 'metv')"
97223000,2026-07-15T08:05:00Z,"The U.S. Has Accumulated 100,000 Metric Tons of Used Nuclear Fuel. Oklo Sees It as a Massive Potential Energy Resource.",https://www.fool.com/investing/2026/07/15/the-us-has-accumulated-100000-metric-tons-of-used/?source=iedfolrf0000001,Oklo's advanced nuclear reactors could make use of America's massive stockpile of used nuclear fuel.,fool.com,"('64Bed2F4-5F8A-4Eae-9B82-C8Bfa4E46713', 'And Utilities', 'Basic Materials', 'ETF', 'Energy', 'Investing', 'Leu', 'Materials', 'Meta', 'Oklo', 'Stock', 'Technology', 'Unknown Sector')",2026-07-15T08:40:48.115176Z,"('leu', 'meta', 'meta', 'meta', 'metv', 'oklo')"
97222764,2026-07-15T08:02:00Z,"SpaceX Fell Below Its Debut Price. History Says a $10,000 Investment Will be Worth This Much in a Year.",https://www.fool.com/investing/2026/07/15/spacex-fell-below-its-debut-price-history-says-a-1/?source=iedfolrf0000001,The space and AI giant recently completed a historic IPO.,fool.com,"('51D31275-De1C-4D00-92Bd-F73905102990', 'ETF', 'Investing', 'Meta', 'Spcx', 'Stock', 'Technology', 'Technology And Telecom', 'Uber', 'Unknown Sector')",2026-07-15T08:26:28.355947Z,"('meta', 'meta', 'meta', 'metv', 'spcx', 'spcx', 'uber', 'uber')"
97222487,2026-07-15T07:54:17Z,Inside India newsletter: Modi is exporting India's workforce to a world turning against immigration,https://www.cnbc.com/2026/07/15/modi-export-india-workforce-anti-immigration.html,"With its vast working-age population, India is signing labor mobility deals with several of its trading partners even as sentiment turns against immigration.",cnbc.com,"('Asia Economy', 'Consumer Cyclical', 'Consumer Defensive', 'ETF', 'Economic Events', 'Financial Services', 'Foreign Policy', 'Healthcare', 'Immigration', 'India', 'Ipo', 'Oil And Gas', 'Personnel', 'Prices', 'Stock', 'Technology', 'Tiingo Top', 'Trade', 'Travel', 'Unknown Sector', 'World Economy')",2026-07-15T08:01:30.395382Z,"('adbe', 'adbe', 'amzn', 'amzn', 'bcs', 'botz', 'btai', 'ewt', 'ezra', 'googl', 'hsbc', 'hxscl', 'inda', 'ipo', 'ko', 'meta', 'meta', 'meta', 'metv', 'ms', 'ms', 'nvda', 'nvda', 'skhy', 'skhy', 'ssnhz', 'tsm', 'wmt', 'wmt')"
97220870,2026-07-15T04:45:00Z,"Prediction: Down 4% in a Month, This ETF Will Still Be the Best-Performing Tech ETF This Year",https://www.fool.com/investing/2026/07/15/prediction-down-4-in-a-month-this-etf-will-still/?source=iedfolrf0000001,Semiconductor stocks still have plenty of runway in front of them.,fool.com,"('Aapl', 'Amzn', 'Avgo', 'C779A7Ef-0F8A-4B40-976E-C72Fc10D80D4', 'Consumer Cyclical', 'ETF', 'Goog', 'Googl', 'Investing', 'Markets', 'Meta', 'Msft', 'Mu', 'Nvda', 'Qqqm', 'Soxx', 'Stock', 'Technology', 'Tsla', 'Tsm', 'Unknown Sector', 'Vgt', 'Xlk')",2026-07-15T05:12:28.343101Z,"('aapl', 'aapl', 'amzn', 'amzn', 'avgo', 'avgo', 'goog', 'goog', 'googl', 'meta', 'meta', 'meta', 'metv', 'msft', 'msft', 'mu', 'mu', 'nvda', 'nvda', 'qqqm', 'soxx', 'tsla', 'tsla', 'tsm', 'vgt', 'xlk')"
97219891,2026-07-15T03:14:00Z,Gupshup Named Meta's 'Partner of the Year' for the Third Time,https://finance.yahoo.com/technology/ai/articles/gupshup-named-metas-partner-third-031400723.html,"Gupshup, the world's leading conversational AI platform and one of Meta's largest Solution Partners, has been named Meta's 'Partner of the Year'. This is the third time Gupshup has received the award, underscoring its continued leadership in helping businesses leverage the latest innovations across the WhatsApp Business Platform to deliver AI-powered customer experiences at scale. Gupshup was also featured prominently at recent Meta events in London and Mumbai to help educate business leaders on",finance.yahoo.com,"('Businesses', 'Conversational Ai Platform', 'Customer Engagement', 'Customer Experiences', 'Customer Interactions', 'ETF', 'Gupshup', 'Latest Innovations', 'Meta', 'Stock', 'Technology', 'Unknown Sector')",2026-07-15T03:43:16.141499Z,"('meta', 'meta', 'meta', 'metv')"
97218133,2026-07-15T01:01:09.928930Z,Meta Employees Sue Over AI-Driven Layoff Practices,https://www.gurufocus.com/news/8958900/meta-employees-sue-over-aidriven-layoff-practices,,gurufocus.com,"('ETF', 'Stock', 'Technology', 'Unknown Sector')",2026-07-15T01:01:10.325227Z,"('meta', 'meta', 'meta', 'metv')"
97218093,2026-07-15T01:00:57.430517Z,Polar Capital Holdings Plc Reduces Stake in Verastem Inc: A Strategic Portfolio Adjustment,https://www.gurufocus.com/news/8958934/polar-capital-holdings-plc-reduces-stake-in-verastem-inc-a-strategic-portfolio-adjustment,,gurufocus.com,"('ETF', 'Healthcare', 'Stock', 'Technology', 'Unknown Sector')",2026-07-15T01:00:57.801318Z,"('amd', 'avgo', 'avgo', 'meta', 'meta', 'meta', 'metv', 'nvda', 'nvda', 'sndk', 'sndk', 'sndk', 'vstm')"
