id,publishedDate,title,url,description,source,tags,crawlDate,tickers
96011791,2026-05-28T09:39:27Z,Meta launches subscription push to ease investor concerns over soaring AI costs,https://finance.yahoo.com/markets/stocks/articles/meta-launches-subscription-push-ease-093927285.html,"Meta on Wednesday launched paid subscription plans for its flagship apps, marking a major push by the tech giant to diversify beyond its long-standing reliance on advertising revenue.View on euronews",finance.yahoo.com,"('ETF', 'Facebook', 'Facebook Plus', 'Instagram', 'Instagram Plus', 'Meta', 'Stock', 'Subscriptions', 'Technology')",2026-05-28T10:01:20.365012Z,"('meta', 'meta', 'metv')"
96011361,2026-05-28T09:30:01Z,This AI stock is surging after an ex-OpenAI employee's fund disclosed a stake. Here's why,https://www.cnbc.com/2026/05/28/nebius-situational-awareness-ai-stock-ex-openai-stake.html,"Dutch cloud provider Nebius popped in premarket trading after an ex-OpenAI employee's fund took a sizeable stake in the firm, ",cnbc.com,"('Artificial Intelligence', 'Breaking News: Markets', 'Breaking News: Technology', 'Business', 'Computing', 'ETF', 'Internet', 'Markets', 'Stock', 'Technology', 'Tiingo Top', 'Wireless')",2026-05-28T09:36:22.742782Z,"('meta', 'meta', 'metv', 'nbis', 'nvda')"
96012028,2026-05-28T09:21:01Z,"Envestnet Portfolio Solutions Inc. Has $108.78 Million Stake in Meta Platforms, Inc. $META",https://www.thelincolnianonline.com/2026/05/28/envestnet-portfolio-solutions-inc-has-108-78-million-stake-in-meta-platforms-inc-meta.html,"Envestnet Portfolio Solutions Inc. raised its position in Meta Platforms, Inc. (NASDAQ:META – Free Report) by 10.8% during the fourth quarter, according to its most recent filing with the SEC. The firm owned 164,799 shares of the social networking company’s stock after purchasing an additional 16,001 shares during the period. Envestnet Portfolio Solutions Inc.’s holdings […]",thelincolnianonline.com,"('13F', '30303M10', 'Computer And Technology', 'ETF', 'Financial Services', 'Hedge Fund Holdings', 'Institutional Investor Holdings', 'Meta', 'Meta Platforms', 'Nasdaq:Meta', 'Sec Filings', 'Stock', 'Technology')",2026-05-28T10:07:27.409940Z,"('key', 'meta', 'meta', 'metv', 'tfc')"
96012031,2026-05-28T09:21:01Z,"Gambit Capital Management LLC Invests $766,000 in Meta Platforms, Inc. $META",https://www.thelincolnianonline.com/2026/05/28/gambit-capital-management-llc-invests-766000-in-meta-platforms-inc-meta.html,"Gambit Capital Management LLC bought a new position in Meta Platforms, Inc. (NASDAQ:META – Free Report) in the fourth quarter, HoldingsChannel.com reports. The fund bought 1,161 shares of the social networking company’s stock, valued at approximately $766,000. A number of other hedge funds have also modified their holdings of the stock. Lutz Financial Services LLC […]",thelincolnianonline.com,"('13F', '30303M10', 'Computer And Technology', 'ETF', 'Financial Services', 'Hedge Fund Holdings', 'Institutional Investor Holdings', 'Meta', 'Meta Platforms', 'Nasdaq:Meta', 'Sec Filings', 'Stock', 'Technology')",2026-05-28T10:07:30.359950Z,"('jef', 'meta', 'meta', 'metv')"
96011384,2026-05-28T09:12:00Z,"Warren Buffett's Successor, Greg Abel, Buys an AI Stock That Poses a Threat to Nvidia",https://www.fool.com/investing/2026/05/28/warren-buffett-abel-buys-ai-stock-threat-to-nvidia/?source=iedfolrf0000001,"Berkshire Hathaway tripled its stake in Alphabet, a company whose AI chips threaten to take market share from Nvidia GPUs.",fool.com,"('9E6603C5-9Ac8-4B67-9Dfa-09Efa8C0D11D', 'Brka', 'Brkb', 'Bx', 'ETF', 'Financial Services', 'Goog', 'Googl', 'Investing', 'Meta', 'Nvda', 'Stock', 'Technology', 'Technology And Telecom', 'Unknown Sector', '^Gspc')",2026-05-28T09:37:32.639455Z,"('brk-a', 'brk-b', 'brka', 'brkb', 'bx', 'goog', 'googl', 'meta', 'meta', 'metv', 'nvda')"
96012229,2026-05-28T09:11:01Z,"I got laid off from Meta as a low performer. I wish people told me to budget, downsize, and create a plan immediately.",https://finance.yahoo.com/economy/policy/articles/got-laid-off-meta-low-091101376.html,"A laid off Meta employee says budgeting for a year of unemployment, downsizing, and creating an action plan would've saved her grief after her layoff.",finance.yahoo.com,"('Action Plan', 'Brittney Ball', 'Budget', 'ETF', 'Financial Services', 'Job Market', 'Meta', 'Stock', 'Streams Of Income', 'Technology')",2026-05-28T10:11:12.315800Z,"('aaba', 'meta', 'meta', 'metv', 'yhoo')"
96012240,2026-05-28T09:11:01Z,"I got laid off from Meta as a low performer. I wish people told me to budget, downsize, and create a plan immediately.",https://www.aol.com/news/got-laid-off-meta-low-091101769.html,"A laid off Meta employee says budgeting for a year of unemployment, downsizing, and creating an action plan would've saved her grief after her layoff.",aol.com,"('Action Plan', 'Brittney Ball', 'Budget', 'ETF', 'Financial Services', 'Job Market', 'Meta', 'Stock', 'Streams Of Income', 'Technology')",2026-05-28T10:11:41.728268Z,"('aaba', 'meta', 'meta', 'metv', 'yhoo')"
96010754,2026-05-28T09:00:04.602000Z,What It Takes to Get a Job at Anthropic,https://www.bloomberg.com/news/features/2026-05-28/anthropic-job-recruiting-brings-in-diverse-careers-to-build-claude,,bloomberg.com,"('Consumer Cyclical', 'Stock', 'Technology', 'Tiingo Top')",2026-05-28T09:04:18.544611Z,"('googl', 'meta', 'nflx', 'tsla', 'wday')"
96010755,2026-05-28T09:00:02.822000Z,Fight the SpaceX FOMO. You'll Be Glad You Did,https://www.bloomberg.com/opinion/articles/2026-05-28/fight-the-spacex-fomo-you-ll-be-glad-you-did,,bloomberg.com,"('Consumer Cyclical', 'Stock', 'Technology', 'Tiingo Top')",2026-05-28T09:04:18.896118Z,"('googl', 'meta', 'tsla')"
96010662,2026-05-28T08:45:39.555000Z,Mistral Signs Airbus and BMW as it Brings AI to Manufacturing,https://www.bloomberg.com/news/articles/2026-05-28/mistral-signs-airbus-and-bmw-as-it-brings-ai-to-manufacturing,,bloomberg.com,"('Consumer Cyclical', 'Stock', 'Technology', 'Tiingo Top')",2026-05-28T08:56:29.830617Z,"('amzn', 'meta')"
96010649,2026-05-28T08:45:14Z,"Mistral to explore designing own chips, CEO says, as it ramps up infrastructure build",https://www.cnbc.com/2026/05/28/mistral-arthur-mensch-design-chips-ai-data-centers.html,Mistral's semiconductor ambitions underscore the French startup's bid to control more of its infrastructure as it competes with OpenAI and Anthropic.,cnbc.com,"('Breaking News: Technology', 'Business', 'Computing', 'Consumer Cyclical', 'ETF', 'Enterprise', 'Internet', 'Semiconductor Device Manufacturing', 'Stock', 'Technology', 'Wireless')",2026-05-28T08:55:26.832395Z,"('amzn', 'asml', 'googl', 'meta', 'meta', 'metv', 'nvda')"
96010527,2026-05-28T08:28:49Z,Meta repeatedly snubs EU body over Facebook and Instagram user bans,https://www.aol.com/news/meta-repeatedly-snubs-eu-body-082849692.html,The BBC has been contacted by hundreds of users who claimed they had been wrongly banned from the sites.,aol.com,"('Appeals Centre', 'ETF', 'Europe', 'Facebook', 'Hate Speech', 'Meta', 'Relevant Content', 'Social Media', 'Stock', 'Technology', 'Transparency Report')",2026-05-28T08:44:46.674532Z,"('goog', 'googl', 'meta', 'meta', 'metv')"
96010355,2026-05-28T08:25:00Z,How To Invest in Artificial Intelligence Stocks: A Canadian Guide,https://kalkinemedia.com/ca/news/stock-market/how-to-invest-in-artificial-intelligence-stocks-a-canadian-guide,"A practical Canadian guide to investing in artificial intelligence stocks, covering Canadian AI exposure, US mega-caps, ETFs, and tax-efficient account placement.",kalkinemedia.com,"('Consumer Cyclical', 'ETF', 'How To Invest In Artificial Intelligence Stocks: A Canadian Guide', 'Stock', 'Technology')",2026-05-28T08:29:39.618750Z,"('aapl', 'amd', 'amzn', 'anet', 'avgo', 'googl', 'ivv', 'meta', 'msft', 'mu', 'nvda', 'tsm')"
96010517,2026-05-28T08:18:00Z,Q1 Earnings Season Is Winding Down. Here Are the 5 Stocks That Defined It.,https://finance.yahoo.com/markets/stocks/articles/q1-earnings-season-winding-down-081800310.html,These companies' recent results collectively tell most of the market's overall story right now.,finance.yahoo.com,"('Artificial Intelligence', 'Communication Services', 'Consumer Cyclical', 'Consumer Defensive', 'Earnings Reports', 'Earnings Season', 'Financial Services', 'Google', 'Investors', 'Nasdaq', 'Q1 Earnings Season', 'Stock', 'Technology', 'Unknown Sector')",2026-05-28T08:44:28.551769Z,"('bac', 'fds', 'goog', 'googl', 'intc', 'iqnt', 'meta', 'mhm', 'mpe', 'nflx', 'nvda', 'wmt')"
96010377,2026-05-28T07:58:00Z,Q1 Earnings Season Is Winding Down. Here Are the 5 Stocks That Defined It.,https://www.fool.com/investing/2026/05/28/q1-earnings-season-winding-down-stocks-nvda/?source=iedfolrf0000001,These companies' recent results collectively tell most of the market's overall story right now.,fool.com,"('6A19F2A3-5E50-4580-Be31-4B2227Ff4844', 'Bac', 'Consumer Defensive', 'ETF', 'Financial Services', 'Goog', 'Googl', 'Investing', 'Markets', 'Meta', 'Nvda', 'Stock', 'Technology', 'Wmt', '^Gspc')",2026-05-28T08:32:01.603596Z,"('bac', 'goog', 'googl', 'meta', 'meta', 'metv', 'nvda', 'wmt')"
96010104,2026-05-28T07:43:46.651000Z,Nvidia Server Maker WiWynn Expects AI Bottlenecks Beyond Memory,https://www.bloomberg.com/news/articles/2026-05-28/nvidia-server-maker-wiwynn-expects-ai-bottlenecks-beyond-memory,,bloomberg.com,"('Stock', 'Technology', 'Tiingo Top')",2026-05-28T08:06:51.554641Z,"('meta', 'msft')"
96008952,2026-05-28T05:40:24Z,Is Meta’s Next Big Bet Cloud Computing? Zuckerberg Drops Big Hint Amid AI Spending Boom,https://finance.yahoo.com/markets/stocks/articles/meta-next-big-bet-cloud-054024049.html,"Meta also announced the global rollout of the subscription plans for its flagship apps, Instagram, Facebook, and WhatsApp.",finance.yahoo.com,"('Ai Chatbot', 'Annual Shareholder Meeting', 'Cloud Computing Infrastructure', 'Data Centers', 'ETF', 'Facebook', 'Facebook Plus', 'Financial Services', 'Mark Zuckerberg', 'Meta', 'Meta Ai', 'Meta Stock', 'Real Estate', 'Stock', 'Technology')",2026-05-28T06:02:34.035748Z,"('ihit', 'ivr', 'ivz', 'meta', 'meta', 'metv', 'msft')"
96011294,2026-05-28T05:02:27Z,"With subscription plans, Meta finally moves to diversify its revenue",https://fortune.com/2026/05/28/subscription-plans-meta-finally-moves-diversify-revenue/,"Plus: Dell, Last.fm, Salesforce, Snowflake, Uber, Valve.",fortune.com,"('Cftc', 'Dell Technologies', 'ETF', 'Ecommerce', 'Fortune Tech', 'Illinois', 'Meta', 'No Copyright', 'Polymarket', 'Robinhood', 'Salesforce', 'Snowflake Computing', 'Stock', 'Technology', 'Tiingo Top', 'Uber Technologies', 'United Kingdom', 'Valve')",2026-05-28T09:33:20.372509Z,"('meta', 'meta', 'metv')"
96007280,2026-05-28T03:30:08Z,"Virginia Lottery Powerball, Pick 3 Night results for May 27, 2026",https://www.aol.com/news/virginia-lottery-powerball-pick-3-033008922.html,Check your tickets for Virginia daily lottery draw games here.,aol.com,"('ETF', 'Fb', 'Powerball', 'Powerball Drawings', 'Stock', 'Technology', 'Unknown Sector', 'Virginia Lottery')",2026-05-28T03:46:22.703560Z,"('fb', 'meta')"
96008187,2026-05-28T03:30:08Z,"Florida Lottery Powerball, Lotto, Fantasy 5 results for May 27, 2026",https://www.aol.com/news/florida-lottery-powerball-lotto-fantasy-033008213.html,Check your tickets for Florida daily lottery draw games here.,aol.com,"('ETF', 'Fb', 'Florida', 'Florida Lottery', 'Powerball', 'Stock', 'Technology', 'Unknown Sector', 'Winning Pick 3 Numbers', 'Winning Pick 4 Numbers', 'Winning Powerball')",2026-05-28T04:47:56.614107Z,"('fb', 'meta')"
96007465,2026-05-28T03:30:08Z,"Florida Lottery Powerball, Fantasy 5 results for May 27, 2026",https://www.aol.com/news/florida-lottery-powerball-fantasy-5-033008215.html,Check your tickets for Florida daily lottery draw games here.,aol.com,"('ETF', 'Fb', 'Florida Lottery', 'Powerball', 'Stock', 'Technology', 'Unknown Sector', 'Winning Fantasy 5 Numbers', 'Winning Pick 3 Numbers', 'Winning Pick 4 Numbers')",2026-05-28T03:58:27.408262Z,"('fb', 'meta')"
96006753,2026-05-28T03:00:35Z,At-Home Care Devices May Make Pediatric Emergencies Easier To Deal With,https://www.forbes.com/sites/saibala/2026/05/27/at-home-care-devices-may-make-pediatric-emergencies-easier-to-deal-with/,Nearly 4 million children across the United States do not have regular access to a pediatrician.,forbes.com,"('Ai', 'ETF', 'Economy', 'Financial Services', 'Google', 'Iran', 'Jobs', 'Layoff', 'Meta', 'Microsoft', 'Nvidia', 'Stock', 'Technology', 'Tiingo Top', 'Trump', 'United States', 'Unknown Sector')",2026-05-28T03:06:20.062971Z,"('aaic', 'ai', 'meta', 'meta', 'metv', 'nvda')"
96006410,2026-05-28T02:33:35Z,"Meta launches Instagram Plus, Facebook Plus and WhatsApp Plus subscriptions globally: Here's what you get",https://www.livemint.com/technology/tech-news/meta-launches-instagram-plus-facebook-plus-and-whatsapp-plus-subscriptions-globally-heres-what-you-get-11779928717350.html,"Meta has begun roling. Instagram Plus, WhatsApp Plus, and Facebook Plus subscriptions globally. Instagram and Facebook subscription is priced at $3.99 per month while WhatsApp is priced at $2.99 per month.",livemint.com,"('CryptoCurrency', 'ETF', 'Facebook', 'Instagram', 'Instagram Subscription', 'Meta', 'Stock', 'Technology', 'Whatsapp', 'Whatsapp Subscription')",2026-05-28T02:35:20.278054Z,"('meta', 'meta', 'metv')"
96005865,2026-05-28T01:46:28Z,Daily Open: Oil falls on Iran peace hopes — then U.S. launches airstrikes,https://www.cnbc.com/2026/05/28/us-reportedly-carries-out-new-airstrikes-on-iran-.html,Global markets rally as investors continue to price in Middle East de-escalation. ,cnbc.com,"('Asia Economy', 'Basic Materials', 'Breaking News: Economy', 'Consumer Cyclical', 'Consumer Discretionary', 'ETF', 'Economy', 'Energy', 'Financial Services', 'Foreign Policy', 'Industrials', 'Iran', 'Middle East', 'Prices', 'Stock', 'Technology', 'Tiingo Top', 'Unknown Sector')",2026-05-28T01:52:48.175898Z,"('aal', 'aapl', 'amzn', 'arkk', 'avgo', 'ba', 'baba', 'bno', 'cf', 'cop', 'cvx', 'dal', 'dbo', 'dell', 'dell', 'ewh', 'ewj', 'ews', 'ewu', 'ewy', 'fdn', 'fdx', 'googl', 'gs', 'igv', 'intu', 'ixc', 'kwt', 'kwt', 'lmt', 'mchi', 'meta', 'meta', 'metv', 'mos', 'mrvl', 'msft', 'noc', 'ntr', 'nvda', 'orcl', 'oxy', 'qqq', 'ryaay', 'shel', 'shel', 'snow', 'snow', 'socl', 'soxx', 'thd', 'tsla', 'tsm', 'tte', 'tte', 'ual', 'uco', 'uga', 'vgk', 'wday', 'xar', 'xlk', 'xom')"
96006574,2026-05-28T01:38:40Z,Jensen Huang Joins Elite Tsinghua University Advisory Board That Includes Tim Cook And Elon Musk: Report,https://finance.yahoo.com/sectors/technology/articles/jensen-huang-joins-elite-tsinghua-013840598.html,"Nvidia Corp. (NASDAQ:NVDA) CEO Jensen Huang has reportedly agreed to join the advisory board of one of China's most prestigious universities. Nvidia CEO Joins Elite Tsinghua Advisory Board Huang accepted an invitation to join the advisory board of Tsinghua University School of Economics and Management, the Financial Times reported on Wednesday, citing people familiar with the matter. The board includes some of the world's most prominent business leaders. It has Apple Inc. (NASDAQ:AAPL) CEO Tim C",finance.yahoo.com,"('Advisory Board', 'Apple Inc.', 'Benzinga', 'China', 'Consumer Cyclical', 'Dell Technologies', 'Elon Musk', 'Jensen Huang', 'Michael Dell', 'Nvidia', 'Satya Nadella', 'Stock', 'Technology', 'Tiingo Top', 'Tim Cook', 'Tsinghua University', 'Unknown Sector', 'World University Rankings')",2026-05-28T02:50:07.674326Z,"('aapl', 'dell', 'dvmt', 'meta', 'msft', 'nvda', 'tsla')"
96005535,2026-05-28T01:30:35Z,"Meta Launches Facebook Plus, Instagram Plus at $3.99/Month, Debuts Exclusive Premium Features",https://www.techtimes.com/articles/317290/20260527/meta-launches-facebook-plus-instagram-plus-399-month-debuts-exclusive-premium-features.htm,"Meta has officially launched the new Facebook Plus and Instagram Plus subscriptions, which bring premium features, at $3.99 per month.",techtimes.com,"('Apps', 'ETF', 'Instagram Plus 3.99 Per Month', 'Meta', 'Meta Facebook Plus', 'Meta Facebook Plus 3.99 Per Month', 'Meta Instagram Plus', 'Meta Social Media Subscrition', 'Software', 'Stock', 'Technology', 'Whatsapp Plus')",2026-05-28T01:32:57.828093Z,"('meta', 'meta', 'metv')"
96005121,2026-05-28T00:59:11Z,Increased Funding Is Making At-Home Hospital Care A Reality,https://www.forbes.com/sites/saibala/2026/05/27/increased-funding-is-making-at-home-hospital-care-a-reality/,Studies have indicated that at-home hospital services have lower mortality rates and costs.,forbes.com,"('Ai', 'ETF', 'Economy', 'Financial Services', 'Google', 'Hiring', 'Iran', 'Jobs', 'Meta', 'Microsoft', 'Stock', 'Technology', 'Tiingo Top', 'Trump', 'Unknown Sector', 'War')",2026-05-28T01:02:22.551761Z,"('aaic', 'ai', 'meta', 'meta', 'metv', 'war')"
