id,published_date,title,source,tags,crawl_date,tickers,day_of_week
97106553,2026-07-10,META Stock Eyes Best Weekly Finish In Over 2 Months On Muse Spark Boost: AI Chief Promises ‘More To Come’,finance.yahoo.com,"('Alexandr Wang', 'Data Center', 'ETF', 'Meta', 'Muse Spark', 'Stock', 'Technology', 'Unknown Sector')",2026-07-10,"('meta', 'meta', 'meta', 'metv', 'tcehy')",5
97107057,2026-07-10,"Stock Market News for July 10, 2026",zacks.com,"('ETF', 'Market News', 'Stock', 'Technology', 'Unknown Sector')",2026-07-10,"('meta', 'meta', 'meta', 'metv', 'mu', 'mu')",5
97105709,2026-07-10,Global Power Solutions Announces Registration to Attend Data Centre West 2026 in Calgary and Applauds Meta’s Historic CAD $13 Billion Alberta Data Centre Investment,finance.yahoo.com,"('Alberta', 'Canada', 'Data Centre', 'Digital Infrastructure', 'ETF', 'Global Power', 'Global Power Solutions Corp.', 'Industrials', 'Meta', 'Premier Of Alberta', 'Province Of Alberta', 'Stock', 'Sturgeon County', 'Technology', 'The Company', 'Tsx Venture Exchange', 'Unknown Sector', 'Western Canada')",2026-07-10,"('glpw', 'meta', 'meta', 'meta', 'metv')",5
97106716,2026-07-10,The problem with U.S. AI policy,fortune.com,"('Aerospace And Defense', 'Brad Smith', 'Defense', 'ETF', 'European Parliament', 'Federal Reserve', 'Fortune Tech', 'Google', 'India', 'Marc Andreessen', 'Meta', 'Microsoft', 'Microsoft Xbox', 'No Copyright', 'Openai', 'Stock', 'Surveillance', 'Technology', 'Tiingo Top', 'Unknown Sector', 'Venture Capital')",2026-07-10,"('goog', 'googl', 'meta', 'meta', 'meta', 'metv')",5
97103318,2026-07-10,"Virginia Lottery Pick 3 Night, Pick 3 Day results for July 9, 2026",aol.com,"('ETF', 'Fb', 'Stock', 'Technology', 'Unknown Sector', 'Virginia Lottery')",2026-07-10,"('fb', 'meta')",5
97103441,2026-07-10,"Virginia Lottery Pick 3 Night, Pick 3 Day results for July 9, 2026",aol.com,"('ETF', 'Fb', 'Stock', 'Technology', 'Unknown Sector', 'Virginia Lottery')",2026-07-10,"('fb', 'meta')",5
97104246,2026-07-10,"Florida Lottery Fantasy 5, Cash Pop results for July 9, 2026",aol.com,"('ETF', 'Fb', 'Florida Lottery', 'Stock', 'Technology', 'Unknown Sector', 'Winning Fantasy 5 Numbers', 'Winning Pick 3 Numbers', 'Winning Pick 4 Numbers')",2026-07-10,"('fb', 'meta')",5
97103319,2026-07-10,"Florida Lottery Fantasy 5, Cash Pop results for July 9, 2026",aol.com,"('ETF', 'Fb', 'Florida Lottery', 'Stock', 'Technology', 'Unknown Sector', 'Winning Fantasy 5 Numbers', 'Winning Pick 3 Numbers', 'Winning Pick 4 Numbers')",2026-07-10,"('fb', 'meta')",5
97102285,2026-07-10,Meta Plans AI Chip Production to Enhance Performance on Facebook and Instagram (META),gurufocus.com,"('ETF', 'Stock', 'Technology', 'Unknown Sector')",2026-07-10,"('meta', 'meta', 'meta', 'metv')",5
97102298,2026-07-10,"WhatsApp, Telegram submit responses to MeitY on upcoming username feature: Here's what we know",livemint.com,"('CryptoCurrency', 'ETF', 'Meity', 'Meta', 'Ministry Of Electronics And Information Technology', 'Stock', 'Technology', 'Unknown Sector', 'Username Feature', 'Whatsapp')",2026-07-10,"('meta', 'meta', 'meta', 'metv')",5
97102149,2026-07-10,Meta Absorbs AI Security's Top Red Team as Autonomous Ransomware Arrives,techtimes.com,"('Ai Security', 'Communication Services', 'Consumer Cyclical', 'ETF', 'Healthcare', 'Industrials', 'Meta', 'Security', 'Stock', 'Technology', 'Unknown Sector')",2026-07-10,"('baba', 'intc', 'iqnt', 'meta', 'meta', 'meta', 'metv', 'msft', 'nvda', 'vrtx', 'vtnrq')",5
97102056,2026-07-10,META Stock Moves Closer To 200-DMA After Muse Spark AI Release: Cathie Wood's ARK Boosts Stake By Over $20M,finance.yahoo.com,"('Ark Invest', 'Cathie Wood', 'ETF', 'Meta', 'Muse Spark', 'Stock', 'Technology', 'Unknown Sector')",2026-07-10,"('meta', 'meta', 'meta', 'metv')",5
97101621,2026-07-10,Why Arm Holdings Stock Soared 224.4% Through The First Half Of 2026,fool.com,"('06Cd052B-2634-4195-A510-58Cd45732F16', 'Aapl', 'Amzn', 'Arm', 'Consumer Cyclical', 'ETF', 'Investing', 'Meta', 'Stock', 'Technology', 'Technology And Telecom', 'Tiingo Top', 'Unknown Sector')",2026-07-10,"('aapl', 'aapl', 'amzn', 'amzn', 'arm', 'arm', 'meta', 'meta', 'meta', 'metv')",5
97100858,2026-07-10,"ARK Investment Acquires 34,000 Shares of META",gurufocus.com,"('ETF', 'Stock', 'Technology', 'Unknown Sector')",2026-07-10,"('meta', 'meta', 'meta', 'metv')",5
97102264,2026-07-09,"OpenAI exec Fidji Simo says she's stepping down due to chronic illness, will transition to advisor",cnbc.com,"('Breaking News: Business', 'Breaking News: Technology', 'Business', 'ETF', 'Enterprise', 'Entertainment', 'Internet', 'Media', 'Publishing', 'Stock', 'Technology', 'Television', 'Unknown Sector')",2026-07-10,"('cart', 'meta', 'meta', 'meta', 'metv')",4
97098938,2026-07-09,"Meta (META) Launches Muse Spark 1.1 AI Model, Stock Rises 4.7%",gurufocus.com,"('ETF', 'Stock', 'Technology', 'Unknown Sector')",2026-07-09,"('meta', 'meta', 'meta', 'metv')",4
97099587,2026-07-09,"Meta to produce AI chips in September, memo shows",finance.yahoo.com,"('ETF', 'Meta', 'Nvidia', 'Stock', 'Taiwan', 'Technology', 'Unknown Sector')",2026-07-09,"('brcm', 'meta', 'meta', 'meta', 'metv', 'nvda', 'tsm')",4
97097403,2026-07-09,"Market Today: Goldman Sachs Lands $70B Asset Win; Meta, OpenAI Launch AI Upgrades",gurufocus.com,"('Communication Services', 'ETF', 'Financial Services', 'Industrials', 'Stock', 'Technology', 'Unknown Sector')",2026-07-09,"('cht', 'gs', 'gs', 'gsbd', 'gsf', 'gsj', 'lmt', 'lmt', 'meta', 'meta', 'meta', 'metv', 'vz', 'vz')",4
97097331,2026-07-09,Military Strikes Renew Tensions as Meta (META) Launches AI Tools,gurufocus.com,"('ETF', 'Stock', 'Technology', 'Unknown Sector')",2026-07-09,"('meta', 'meta', 'meta', 'metv')",4
97097246,2026-07-09,Jim Cramer says investors are making a mistake with the trillion-dollar tech giants,cnbc.com,"('Business', 'Computing', 'Consumer Cyclical', 'ETF', 'Internet', 'Investment Strategy', 'Markets', 'Stock', 'Stock Markets', 'Technology', 'Tiingo Top', 'Unknown Sector', 'Wireless')",2026-07-09,"('aapl', 'aapl', 'amzn', 'amzn', 'googl', 'mags', 'meta', 'meta', 'meta', 'metv', 'msft', 'msft', 'nvda', 'nvda', 'qqq', 'qqq', 'tsla', 'tsla', 'vgt', 'xlk')",4
97097581,2026-07-09,Alphabet vs. Meta: Which AI Stock Is the Better Buy Right Now?,fool.com,"('3Dfb5D6E-E88A-4784-Be0E-Ce0296D8B63F', 'ETF', 'Goog', 'Googl', 'Investing', 'Meta', 'Stock', 'Technology', 'Technology And Telecom', 'Unknown Sector')",2026-07-09,"('goog', 'goog', 'googl', 'meta', 'meta', 'meta', 'metv')",4
97097450,2026-07-09,Meta Platforms Inc (META) Shares Surge 4.7% -- What GF Score of 96 Tells Investors,gurufocus.com,"('ETF', 'Stock', 'Technology', 'Unknown Sector')",2026-07-09,"('meta', 'meta', 'meta', 'metv')",4
97095486,2026-07-09,"This Small-Cap Growth ETF Is Beating the ""Magnificent Seven"" in 2026. Should You Buy It?",fool.com,"('16573C2E-D0F2-4863-Aa11-93E335E255C6', 'Aapl', 'Amzn', 'Consumer Cyclical', 'ETF', 'Goog', 'Googl', 'Investing', 'Iwo', 'Mags', 'Markets', 'Meta', 'Msft', 'Nvda', 'Stock', 'Technology', 'Tsla', 'Unknown Sector')",2026-07-09,"('aapl', 'aapl', 'amzn', 'amzn', 'goog', 'goog', 'googl', 'iwo', 'mags', 'meta', 'meta', 'meta', 'metv', 'msft', 'msft', 'nvda', 'nvda', 'tsla', 'tsla')",4
97094736,2026-07-09,Meta Platforms (META) Explores Cloud Business for AI Infrastructure Access,gurufocus.com,"('ETF', 'Stock', 'Technology', 'Unknown Sector')",2026-07-09,"('meta', 'meta', 'meta', 'metv')",4
97094223,2026-07-09,Meta AI Data Center Linked To Rare Bacteria In City’s Water System,forbes.com,"('Ai', 'Artificial Intelligence', 'Cheyenne', 'Data Center', 'Data Centres', 'ETF', 'Facebook', 'Financial Services', 'Instagram', 'Legionella', 'Meta', 'Stock', 'Technology', 'Unknown Sector', 'Wyoming')",2026-07-09,"('aaic', 'ai', 'ai', 'meta', 'meta', 'meta', 'metv')",4
97094802,2026-07-09,Meta Platforms Inc. (META) Launches Competitive AI Model Muse Spark 1.1,gurufocus.com,"('ETF', 'Stock', 'Technology', 'Unknown Sector')",2026-07-09,"('meta', 'meta', 'meta', 'metv')",4
97103812,2026-07-09,"Meta set to overtake Google’s frontier AI models in six months, SemiAnalysis says",au.finance.yahoo.com,"('ETF', 'Google', 'Infrastructure', 'Mark Zuckerberg', 'Meta', 'Muse Spark', 'Semianalysis', 'Stock', 'Technology', 'Unknown Sector')",2026-07-10,"('brcm', 'goog', 'googl', 'meta', 'meta', 'meta', 'metv', 'sndk')",4
97093983,2026-07-09,"Meta set to overtake Google’s frontier AI models in six months, SemiAnalysis says",finance.yahoo.com,"('ETF', 'Financial Services', 'Google', 'Infrastructure', 'Mark Zuckerberg', 'Meta', 'Muse Spark', 'Semianalysis', 'Stock', 'Technology', 'Unknown Sector')",2026-07-09,"('brcm', 'goog', 'googl', 'gs', 'gsf', 'gsj', 'gvip', 'meta', 'meta', 'meta', 'metv', 'sndk')",4
97093851,2026-07-09,Last look pre-earnings for the old Mag7 – Meta,dragonflycap.com,"('ETF', 'Meta', 'Stock', 'Stock Charts', 'Technical Analysis', 'Technology', 'Unknown Sector')",2026-07-09,"('meta', 'meta', 'meta', 'metv')",4
97101640,2026-07-09,META Stock Alert: What to Know as Meta Platforms Announces $9 Billion Data Center,finance.yahoo.com,"('Artificial Intelligence', 'Canada', 'ETF', 'Meta', 'Meta Stock', 'Stock', 'Technology', 'Unknown Sector')",2026-07-10,"('meta', 'meta', 'meta', 'metv')",4
97091498,2026-07-09,It's a jam-packed afternoon of developments impacting 7 portfolio stocks,cnbc.com,"('Breaking News: Markets', 'Consumer Cyclical', 'ETF', 'Healthcare', 'Industrials', 'Investment Strategy', 'Markets', 'Real Estate', 'Stock', 'Technology', 'Tiingo Top', 'Unknown Sector')",2026-07-09,"('amzn', 'amzn', 'cah', 'cor', 'cor', 'cor', 'dal', 'fdx', 'hon', 'hon', 'hona', 'hona', 'ibm', 'iyt', 'mck', 'meta', 'meta', 'meta', 'metv', 'msft', 'msft', 'sbux', 'sbux', 'ups', 'xlk', 'xlv')",4
97091376,2026-07-09,GDPR Applies to AI Training Data: EU Ends Web Scraping Free Pass for Every Lab,techtimes.com,"('Data Protection', 'ETF', 'Edpb Web Scraping Guidelines', 'Eu Ai Act', 'Gdpr', 'Gdpr Ai Training Data', 'Legitimate Interest Balancing Test', 'Meta', 'Openai', 'Security', 'Stock', 'Technology', 'Unknown Sector')",2026-07-09,"('goog', 'googl', 'meta', 'meta', 'meta', 'metv')",4
97103883,2026-07-09,Meta breaks ground on first data center in Canada,finance.yahoo.com,"('Artificial Intelligence', 'Canada', 'Data Center', 'ETF', 'Meta', 'Stock', 'Technology', 'Unknown Sector')",2026-07-10,"('meta', 'meta', 'meta', 'metv')",4
97092204,2026-07-09,Oklo Just Dropped Below $50. Should Long-Term Investors Pounce?,fool.com,"('Ac5822Af-9215-4353-A5D1-B6351Afaf420', 'And Utilities', 'ETF', 'Energy', 'Investing', 'Materials', 'Meta', 'Oklo', 'Stock', 'Technology', 'Unknown Sector')",2026-07-09,"('meta', 'meta', 'meta', 'metv', 'oklo')",4
97090681,2026-07-09,Meta aims to make its own chips as AI giants strive for independence from strained supply chain,nypost.com,"('Communication Services', 'ETF', 'Meta', 'Nvidia', 'Stock', 'Technology', 'Unknown Sector')",2026-07-09,"('brcm', 'goog', 'googl', 'intc', 'iqnt', 'meta', 'meta', 'meta', 'metv', 'msft', 'nvda', 'tsm')",4
97096523,2026-07-09,Meta’s Latest AI Model Could Finally Justify Its Massive Spending,finance.yahoo.com,"('Anthropic', 'ETF', 'Meta', 'Muse Spark', 'Stock', 'Technology', 'Unknown Sector')",2026-07-09,"('goog', 'googl', 'meta', 'meta', 'meta', 'metv', 'nvda')",4
97090935,2026-07-09,Zuckerberg confirms Meta is eyeing an AI cloud business to rent out its compute,thenextweb.com,"('Artificial Intelligence', 'Business', 'Deep Tech', 'ETF', 'Financial Services', 'Meta', 'Next Featured', 'Stock', 'Technology', 'Tiingo Top', 'Unknown Sector')",2026-07-09,"('brcm', 'goog', 'googl', 'gs', 'gsbd', 'gsf', 'gsj', 'meta', 'meta', 'meta', 'metv', 'msft')",4
97090527,2026-07-09,Meta Drops $9 Billion on AI Expansion With Massive Canada Data Center,finance.yahoo.com,"('Canada', 'ETF', 'Gurufocus', 'Meta', 'Stock', 'Technology', 'Unknown Sector')",2026-07-09,"('meta', 'meta', 'meta', 'metv')",4
97090225,2026-07-09,Direxion Daily Semiconductor Bull 3X ETF Explodes,fool.com,"('22488546-5287-4Aba-8Bcb-5F3E819913Ea', 'Avgo', 'ETF', 'Investing', 'Meta', 'Mu', 'Other', 'Sndk', 'Soxl', 'Stock', 'Technology', 'Tsm', 'Unknown Sector')",2026-07-09,"('avgo', 'avgo', 'meta', 'meta', 'meta', 'metv', 'mu', 'mu', 'sndk', 'sndk', 'sndk', 'soxl', 'soxl', 'tsm')",4
97089664,2026-07-09,"Meta launches a new AI coding model with 'very aggressive' pricing, CEO Mark Zuckerberg says",businessinsider.com,"('Ai', 'ETF', 'Financial Services', 'Mark Zuckerberg', 'Meta', 'Stock', 'Tech', 'Technology', 'Unknown Sector')",2026-07-09,"('aaic', 'ai', 'ai', 'goog', 'googl', 'meta', 'meta', 'meta', 'metv', 'tech')",4
97089206,2026-07-09,Apple's On-Device AI Path Gets Clearer,gurufocus.com,"('Consumer Cyclical', 'ETF', 'Stock', 'Technology', 'Unknown Sector')",2026-07-09,"('aapl', 'aapl', 'amzn', 'amzn', 'baba', 'goog', 'goog', 'meta', 'meta', 'meta', 'metv', 'msft', 'msft')",4
97089198,2026-07-09,Meta Drops $9 Billion on AI Expansion With Massive Canada Data Center,gurufocus.com,"('Canada', 'ETF', 'Stock', 'Technology', 'Unknown Sector')",2026-07-09,"('meta', 'meta', 'meta', 'metv')",4
97089168,2026-07-09,Chip Stocks Drop 12% as Software Rebounds in AI Trade Shift,gurufocus.com,"('ETF', 'Stock', 'Technology', 'Unknown Sector')",2026-07-09,"('adbe', 'adbe', 'amat', 'amat', 'chkp', 'crm', 'meta', 'meta', 'meta', 'metv', 'nvda', 'nvda')",4
97089142,2026-07-09,Meta Takes Aim at Google and OpenAI,gurufocus.com,"('ETF', 'Stock', 'Technology', 'Unknown Sector')",2026-07-09,"('goog', 'goog', 'googl', 'meta', 'meta', 'meta', 'metv')",4
97088835,2026-07-09,Meta’s new AI chips will begin production in September,finance.yahoo.com,"('Chips', 'ETF', 'Meta', 'Mtia', 'Stock', 'Technology', 'Unknown Sector')",2026-07-09,"('brcm', 'goog', 'googl', 'meta', 'meta', 'meta', 'metv', 'nvda')",4
97089020,2026-07-09,A four-year-old has seen more of the world than ChatGPT. Yann LeCun is betting $1bn on that,thenextweb.com,"('Artificial Intelligence', 'Deep Tech', 'ETF', 'Europe', 'Government And Policy', 'Meta', 'Robots', 'Startups And Technology', 'Stock', 'Technology', 'Tiingo Top', 'Unknown Sector')",2026-07-09,"('meta', 'meta', 'meta', 'metv')",4
97103880,2026-07-09,Meta launches Muse Spark 1.1,finance.yahoo.com,"('ETF', 'Meta', 'Muse Spark', 'Spark', 'Stock', 'Technology', 'Unknown Sector')",2026-07-10,"('meta', 'meta', 'meta', 'metv')",4
97086267,2026-07-09,Meta Platforms Inc. (META) Launches Competitive AI Model Muse Spark 1.1,gurufocus.com,"('ETF', 'Stock', 'Technology', 'Unknown Sector')",2026-07-09,"('meta', 'meta', 'meta', 'metv')",4
97086704,2026-07-09,Why Meta Stock Dropped -- Then Bounced Back,fool.com,"('396D43F5-1E9B-400A-8681-5Ce17A674316', 'Avgo', 'ETF', 'Investing', 'Meta', 'Sndk', 'Stock', 'Technology', 'Technology And Telecom', 'Tsm', 'Unknown Sector')",2026-07-09,"('avgo', 'avgo', 'meta', 'meta', 'meta', 'metv', 'sndk', 'sndk', 'sndk', 'tsm')",4
97086333,2026-07-09,"Meta (META) Launches $9.2 Billion Data Center in Alberta, Canada",gurufocus.com,"('Canada', 'ETF', 'Stock', 'Technology', 'Unknown Sector')",2026-07-09,"('meta', 'meta', 'meta', 'metv')",4
97085610,2026-07-09,"Meta patents 'creepy' AI device that tracks wearer's sighs and laughter, medication intake",nypost.com,"('Digital Privacy', 'ETF', 'Facebook', 'Instagram', 'Mark Zuckerberg', 'Meta', 'Privacy', 'Stock', 'Technology', 'Unknown Sector')",2026-07-09,"('meta', 'meta', 'meta', 'metv')",4
97085151,2026-07-09,Cramer defends a struggling tech giant and says another stock could soon be a buy,cnbc.com,"('Aerospace And Defense Industry', 'Breaking News: Markets', 'Breaking News: Technology', 'Business', 'Computing', 'Consumer Defensive', 'ETF', 'Industrials', 'Internet', 'Investment Strategy', 'Markets', 'Software', 'Stock', 'Technology', 'Tiingo Top', 'Unknown Sector', 'Wireless')",2026-07-09,"('crm', 'hon', 'hon', 'hona', 'hona', 'igv', 'intc', 'intc', 'levi', 'meta', 'meta', 'meta', 'metv', 'mu', 'mu', 'pep', 'pep', 'sndk', 'sndk', 'sndk', 'soxx', 'xlk')",4
97085434,2026-07-09,Why Broadcom Stock Rallied Thursday Morning,fool.com,"('22B15B81-0D89-4601-A007-04F0Be0E187C', 'Aapl', 'Avgo', 'ETF', 'Investing', 'Meta', 'Stock', 'Technology', 'Technology And Telecom', 'Tiingo Top', 'Unknown Sector')",2026-07-09,"('aapl', 'aapl', 'avgo', 'avgo', 'brcm', 'meta', 'meta', 'meta', 'metv')",4
97084791,2026-07-09,Why Sandisk Stock Popped Again Today,fool.com,"('Avgo', 'ETF', 'F50D8Eec-B4E5-4Aef-B2Ab-Bde212E0B9F1', 'Investing', 'Meta', 'Sndk', 'Stock', 'Technology', 'Technology And Telecom', 'Tsm', 'Unknown Sector')",2026-07-09,"('avgo', 'avgo', 'meta', 'meta', 'meta', 'metv', 'sndk', 'sndk', 'sndk', 'tsm')",4
97084590,2026-07-09,Meta's Cloud News Just Made This the Most Obvious Buy in the Market,fool.com,"('061D1439-E439-4E8B-96Ee-41B4F8Bdc5B4', 'Crwv', 'ETF', 'Investing', 'Meta', 'Nbis', 'Stock', 'Technology', 'Technology And Telecom', 'Unknown Sector')",2026-07-09,"('crwv', 'crwv', 'meta', 'meta', 'meta', 'metv', 'nbis')",4
97083147,2026-07-09,Meta Unveils Advanced AI Model Muse Spark to Compete in Tech Sphere,gurufocus.com,"('ETF', 'Stock', 'Technology', 'Unknown Sector')",2026-07-09,"('meta', 'meta', 'meta', 'metv')",4
97083034,2026-07-09,Meta Platforms (META) Unveils Advanced Muse Spark 1.1 AI Model,gurufocus.com,"('ETF', 'Stock', 'Technology', 'Unknown Sector')",2026-07-09,"('meta', 'meta', 'meta', 'metv')",4
97082904,2026-07-09,"Meta Announces Its 'Strongest' AI Model Yet, Emphasizes 'Aggressive And Attractive' Pricing",ibtimes.com,"('Ai', 'ETF', 'Financial Services', 'Mark Zuckerberg', 'Meta', 'Stock', 'Technology', 'Unknown Sector')",2026-07-09,"('aaic', 'ai', 'ai', 'goog', 'googl', 'meta', 'meta', 'meta', 'metv', 'msft')",4
97084436,2026-07-09,Alex Schultz on Meta’s future: “It might be the next tier of business for our entire company”,finance.yahoo.com,"('Alex Schultz', 'Chief Data Officer', 'ETF', 'Meta', 'Stock', 'Technology', 'Unknown Sector')",2026-07-09,"('meta', 'meta', 'meta', 'metv')",4
97082813,2026-07-09,Meta Shares Slip as Heavy AI Infrastructure Spending Weighs on Investor Sentiment (META),finance.yahoo.com,"('Advanced Micro Devices', 'Artificial Intelligence', 'Chip Design', 'ETF', 'Financial Services', 'Meta', 'Meta Training', 'Stock', 'Taiwan Semiconductor Manufacturing Co.', 'Technology', 'Unknown Sector')",2026-07-09,"('barl', 'brcm', 'meta', 'meta', 'meta', 'metv', 'ms', 'msk', 'mwg', 'mwo', 'mwr', 'nvda', 'tsm')",4
97080928,2026-07-09,"Meta (META) Accelerates AI Chip Development with New ""Iris"" Chip",gurufocus.com,"('ETF', 'Stock', 'Technology', 'Unknown Sector')",2026-07-09,"('meta', 'meta', 'meta', 'metv')",4
97080842,2026-07-09,Meta's $9.2 Billion Data Center Project in Alberta (META),gurufocus.com,"('ETF', 'Stock', 'Technology', 'Unknown Sector')",2026-07-09,"('meta', 'meta', 'meta', 'metv')",4
97081252,2026-07-09,Meta jumps into AI coding market in effort to chase Anthropic and OpenAI,cnbc.com,"('Breaking News: Technology', 'Business', 'ETF', 'Entertainment', 'Internet', 'Media', 'Publishing', 'Social Media', 'Stock', 'Technology', 'Television', 'Unknown Sector')",2026-07-09,"('googl', 'meta', 'meta', 'meta', 'metv')",4
97080622,2026-07-09,Meta patches the mod that turned its Ray-Ban glasses into secret spy cams,thenextweb.com,"('Augmented Reality', 'Data And Security', 'ETF', 'Meta', 'Privacy', 'Stock', 'Technology', 'Tiingo Top', 'Unknown Sector')",2026-07-09,"('meta', 'meta', 'meta', 'metv', 'tcehy')",4
97080659,2026-07-09,Chip Stocks Are Buys on Weakness — A Top Name That Pros Expect Big Things From in the Second Half,finance.yahoo.com,"('Custom Silicon', 'Data Center', 'ETF', 'Financial Services', 'Meta', 'Meta Compute', 'Morgan Stanley', 'Rosenblatt Securities', 'South Korea', 'Stock', 'Technology', 'Top 10 Ai Stocks', 'Unknown Sector')",2026-07-09,"('barl', 'jpm', 'jpm-ws', 'meta', 'meta', 'meta', 'metv', 'ms', 'msk', 'mwg', 'mwo', 'mwr', 'nvda')",4
97083883,2026-07-09,"META's $9B AI Infrastructure Bet, Cloud Ambitions: Is the Stock a Buy?",zacks.com,"('Analyst Blog', 'Consumer Cyclical', 'ETF', 'Stock', 'Technology', 'Unknown Sector')",2026-07-09,"('amzn', 'amzn', 'googl', 'meta', 'meta', 'meta', 'metv', 'msft', 'msft')",4
97081048,2026-07-09,Meta Plans AI Chip Production with Iris to Boost Processing Power,gurufocus.com,"('ETF', 'Stock', 'Technology', 'Unknown Sector')",2026-07-09,"('meta', 'meta', 'meta', 'metv')",4
97080524,2026-07-09,Investors Are Underestimating This Incredibly Cheap Artificial Intelligence (AI) Stock. Buy It Before It Joins the $2 Trillion Club,fool.com,"('6A3D342C-C406-4B06-9746-376Be148A57E', 'ETF', 'Investing', 'It', 'Meta', 'Stock', 'Technology', 'Technology And Telecom', 'Unknown Sector', '^Ixic')",2026-07-09,"('meta', 'meta', 'meta', 'metv')",4
97079286,2026-07-09,Jim Cramer's top 10 things to watch in the stock market Thursday,cnbc.com,"('Basic Materials', 'Breaking News: Markets', 'Consumer Cyclical', 'Consumer Defensive', 'Consumer Discretionary', 'ETF', 'Healthcare', 'Industrials', 'Investment Strategy', 'Markets', 'Stock', 'Technology', 'Tiingo Top', 'Unknown Sector')",2026-07-09,"('avav', 'azn', 'azncf', 'cost', 'cost', 'esi', 'esi', 'esi', 'fdx', 'fdxf', 'five', 'gild', 'gild', 'ions', 'jnj', 'jnj', 'lly', 'lly', 'meta', 'meta', 'meta', 'metv', 'odfl', 'pep', 'pep', 'qqq', 'qqq', 'sols', 'sols', 'soxx', 'tsco', 'wmt', 'wmt', 'xlk', 'xlp')",4
97079721,2026-07-09,Meta Just Delivered Big News. Why Did the Stock Fall Anyway?,fool.com,"('1F84D4Bc-9541-446F-8580-4E4F51Bb0F7A', 'ETF', 'Investing', 'Meta', 'Stock', 'Technology', 'Technology And Telecom', 'Unknown Sector')",2026-07-09,"('meta', 'meta', 'meta', 'metv')",4
97087287,2026-07-09,Meta releases latest update of AI model Muse Spark as tech giant accelerates AI push under Alexandr Wang,fortune.com,"('Anthropic', 'ETF', 'Instagram', 'Mark Zuckerberg', 'Meta', 'Openai', 'Stock', 'Technology', 'Unknown Sector')",2026-07-09,"('meta', 'meta', 'meta', 'metv')",4
97077799,2026-07-09,First Look: Meta AI Raises Privacy Concerns with Instagram Deepfakes,gurufocus.com,"('Basic Materials', 'Communication Services', 'Consumer Defensive', 'ETF', 'Stock', 'Technology', 'Unknown Sector')",2026-07-09,"('cht', 'meta', 'meta', 'meta', 'metv', 'pep', 'pep', 'psmt', 'smpl', 'soief', 'wdfc')",4
97078172,2026-07-09,"Here are Thursday's biggest analyst calls: Nvidia, SpaceX, Tesla, AMD, Toast, Meta, Five Below, MP Materials & more",cnbc.com,"('Breaking News: Markets', 'Consumer Cyclical', 'Consumer Defensive', 'ETF', 'Financial Services', 'Healthcare', 'Industrials', 'Investment Strategy', 'Markets', 'Real Estate', 'Stock', 'Technology', 'Tiingo Top', 'Unknown Sector')",2026-07-09,"('amat', 'amat', 'amd', 'amt', 'ceco', 'cohu', 'crm', 'five', 'fix', 'gww', 'igv', 'isrg', 'isrg', 'itt', 'iyt', 'knx', 'lrcx', 'lrcx', 'mcd', 'meta', 'meta', 'meta', 'metv', 'mp', 'mrln', 'nvda', 'nvda', 'odfl', 'prdo', 'prm', 'prm', 'prm', 'saia', 'soxx', 'spcx', 'spcx', 'spg', 'srpt', 'stla', 'tost', 'tsla', 'tsla', 'wat', 'xlk')",4
97077741,2026-07-09,Meta Breaks Ground on a C$13 Billion Data Center,gurufocus.com,"('ETF', 'Stock', 'Technology', 'Unknown Sector')",2026-07-09,"('meta', 'meta', 'meta', 'metv')",4
97077826,2026-07-09,Meta Starts $13 Billion Alberta Data Center,gurufocus.com,"('ETF', 'Stock', 'Technology', 'Unknown Sector')",2026-07-09,"('meta', 'meta', 'meta', 'metv')",4
97077839,2026-07-09,Meta (META) Faces French Competition Authority Over Copyright Payment Dispute,gurufocus.com,"('ETF', 'Stock', 'Technology', 'Unknown Sector')",2026-07-09,"('meta', 'meta', 'meta', 'metv')",4
97077843,2026-07-09,Cerebras Stock Jumps After Unveiling Multibillion-Dollar Europe Expansion,gurufocus.com,"('Consumer Cyclical', 'ETF', 'Stock', 'Technology', 'Unknown Sector')",2026-07-09,"('amzn', 'amzn', 'cbrs', 'ibm', 'meta', 'meta', 'meta', 'metv')",4
97078327,2026-07-09,Meta to start production of Iris AI chip in September 2026,finance.yahoo.com,"('Chip Production', 'ETF', 'Internal Memo', 'Meta', 'Stock', 'Sumitomo Electric', 'Technology', 'Unknown Sector')",2026-07-09,"('amd', 'brcm', 'meta', 'meta', 'meta', 'metv', 'nvda', 'tsm')",4
97078742,2026-07-09,"Meta to put its own AI chip into production in September, aiming to double computing capacity",thenextweb.com,"('ETF', 'Meta', 'Next Featured', 'Stock', 'Technology', 'Tiingo Top', 'Unknown Sector')",2026-07-09,"('brcm', 'goog', 'googl', 'meta', 'meta', 'meta', 'metv', 'nvda')",4
97076051,2026-07-09,Meta Plans to Sell AI Compute — So Why Spend $10 Billion to Build Even More Data Centers?,finance.yahoo.com,"('Ai Training', 'Data Center', 'ETF', 'Excess Capacity', 'Meta', 'Stock', 'Technology', 'Top 10 Ai Stocks', 'Unknown Sector')",2026-07-09,"('meta', 'meta', 'meta', 'metv', 'nvda')",4
97076079,2026-07-09,Meta builds first Canadian data center in Alberta for $9 billion,finance.yahoo.com,"('Alberta', 'Alberta Electric System Operator', 'Capital Power', 'Data Center', 'ETF', 'Energy', 'Meta', 'Stock', 'Sturgeon County', 'Technology', 'Unknown Sector')",2026-07-09,"('meta', 'meta', 'meta', 'metv', 'msft', 'pba')",4
97074837,2026-07-09,Meta Platforms (META) Secures Spot on BofA's US 1 List of Top Investments,gurufocus.com,"('ETF', 'Stock', 'Technology', 'Unknown Sector')",2026-07-09,"('meta', 'meta', 'meta', 'metv')",4
97075049,2026-07-09,Can Meta’s Latest AI Glasses Redefine The Luxury Sunglasses Market?,forbes.com,"('ETF', 'Kylie Jenner', 'Luxury Eyewear', 'Meta', 'Meta Smart Glasses', 'Paris', 'Ray-Ban', 'Smart Glasses', 'Stock', 'Sunglasses Trends 2026', 'Technology', 'Unknown Sector', 'Wearable Technology')",2026-07-09,"('meta', 'meta', 'meta', 'metv')",4
97074222,2026-07-09,Meta's new AI image generation tool raises alarm in Hollywood,finance.yahoo.com,"('Caa', 'Content Creation', 'ETF', 'Image And Likeness', 'Kyle Hjelmeseth', 'Meta', 'Meta Product', 'Muse Image', 'Stock', 'Talent Agency', 'Technology', 'Unknown Sector')",2026-07-09,"('caa', 'meta', 'meta', 'meta', 'metv')",4
